future wearable devices like smart earbuds able sense mood turn pump jams right need,HER
weight equals performance like know works,HER
happy 13th anniversary disney california adventure park,HER
join ikeabyof day bring friends click rsvp learn special day exclusive rewards activities saturday march 2014 plus rsvp entered win 500 ikea gift card,HER
valentine day corner hope cards signed share legovalentine,HER
magical end magical day,HER
seize days check day offers feb 15 17 2014 click plan days head ikea store,HER
energy business changing say upcoming challenges opportunities taking harvard business review survey sie ag 1exiub5 survey current collaboration future influencers futureinfluencers com results survey way whitepaper published hbr months posted,HER
discover new collection featuring runway inspired accessories vibrant pastels painterly tones bags scarves shoes updated graphic prints check details spring summer 2014,HER
welcome main street,HER
bmw series gran coup perfect fusion elegance agility comfort joined exclusiveness bmw individual new benchmark,HER
emmet monday feeling thelegomovie,HER
perception winter sports day bmw driving experience austrian alps near lden,HER
click rsvp ikeabyof day special shopping event invite friends enjoy perks rewards march 2014,HER
ikea fan used expedit room divider storage unit check share space inspiration ikea fans,HER
check gillette deodorant new nfl web series pressurepoints nfl com pressurepoints,HER
ryan suter teamusa taking russia men ice hockey saturday check inspiring story,HER
nbaallstar jerseys look great loyalty east west read rachael mcbrearty blog keys enabling emotional spark build loyalty consumer brand,HER
weeks byof day saturday march 2014 rsvp ikea usa com byof join enjoy shopping perks friends ikeabyof,HER
disney animated classic cinderella released 64 years ago today favorite princess,HER
ya gonna lego ghostbusters course ghost busting greatness coming june legopreview toyfairny,HER
cor tip add wall shelves art entertainment center create focal point inspiration designing media center,HER
bloomsbury girls view runway looks burberry womenswear w14,HER
new challenger bmw m235i racing bmw motorsport,HER
draw box galaxy note bring pen window quickly access useful features like calculator contacts internet,HER
called share matching plan base share plan transferred employees year 440 000 siemens shares value 41 million increase 25 percent year volume 350 000 shares,HER
excited sight,HER
win,HER
early 1866 werner von siemens introduced stocktaking bonus enabled employees participate jointly generated profits 1969 siemens ag german employees able buy shares today employees siemens ag shareholders,HER
ikea gift card giveaways ikeabyof perks rsvp ikea usa com byof tell looking forward saturday march 2014,HER
style,HER
make bathroom sanctuary check simple ideas improvement,HER
feeling little goofy today,HER
discover new collection featuring runway inspired accessories vibrant pastels painterly tones bags scarves shoes updated graphic prints check details spring summer 2014,HER
days barcelona capital things mobile innovation learn mobile world congress,HER
magical day awaits,HER
inspired nature bmw i8 aerodynamics meets eye,HER
free breakfast coupon ikeabyof day special day rewards 14 rsvp ikea usa com byof create personalized invitations send friends,HER
week awesome alliance prize epic giving away lego star wars death star pretty cool right lego bricks join fun,HER
hex code combinations html produce 16 million different colors screens common human eye colors hex code eyes,HER
thank laughter harold ramis 1944 2014,HER
hungry,HER
bmw pictures follow instagram instagram com bmw,HER
throwback ikea customers byof day 2013 rsvp ikeabyof 2014 ikea usa com byof join 3rd annual celebration friendship shopping ikea rewards tbt,HER
pictureoftheweek 4438 hp strong room 940 passengers award winning design meet siemens c2 latest rail innovation munich metro network,HER
unveiled year international ces jarvis intel powered personal assistant knows want maybe suit wear today,HER
ladies latte vanillalatte coffeedate,HER
140 disney characters invite night disneyside party coasts learn,HER
goes,HER
follofriday mercedes benz niederlassung berlin beast temporarily taken command dealership berlin quite stunning sight customers site think photos courtesy mercedes benz berlin,HER
wave goodbye real world,HER
tonight oscar night favorite best sound photo courtesy marioroman pictures,HER
feelin crafty national craft month click tips ideas craft zone overtaking home,HER
sent tweeted tweet million rts tonight academy awards,HER
congrats walt disney animation studios,HER
best selfie,HER
new flyer blooming deals ideas spring click ready bright sunny mornings,HER
free ikea blue bag days ikeabyof day special day shopping rewards activities friends wait saturday march 2014 rsvp,HER
think werner von siemens proud today technology,HER
discover new collection featuring runway inspired accessories vibrant pastels painterly tones bags scarves shoes updated graphic prints check details spring summer 2014,HER
gps enhanced beetles surgical scorpions jellyfish drones discover artist vincent fournier new kind animal kingdom,HER
real oscars selfie sort photo courtesy legoland discovery centre manchester,HER
happy 19th anniversary indiana jones adventure,HER
carry creativity,HER
ready magical day,HER
press days looking forward meeting geneva motor bmwgeneva siag,HER
galaxy s5 feature excited,HER
days ikeabyof day saturday march 2014 friends bringing rsvp details,HER
troverted character,HER
think score high wonderlic win trip train like pro team exos,HER
happy friday chance win 100 ikea gift card craft diy project hope complete month leave comment post answers question randomly selected win official rules,HER
fit pleasure driving pleasure precise new generation bmw bikes,HER
disney california adventure visit,HER
coming collect true icon classic star wars universe mighty sandcrawler,HER
exceptional luggage exceptional automobile louis vuitton pioneer art created tailor luggage set progressive sports car bmw i8 plug hybrid,HER
thank country joined saturday ikeabyof day check photo album tag,HER
combined cycle power plant ccpp lausward location port sseldorf aiming world records electrical efficiency 61 percent learn,HER
ornament valley beautiful sight cars land,HER
teaching wind turbines automatically optimize operation line weather conditions curious works read,HER
sustainability car efficiency work renewable materials,HER
rome feel free closer look visit bmw city sales outlet opened days ago,HER
happy pi day,HER
love kitchen check homes fellow ikea fans ideas click share space ikea usa com sharespace,HER
sorry going drive tgif,HER
ready disney california adventure visit,HER
started dreaming outdoor dining ikea family members save falster table month ikea family offers,HER
happy st patrick day,HER
great geneva motor thanks having,HER
hybrid locomotive siemens awarded build 32 diesel electric passenger locomotives states contract valued approximately 165 million 225 million marks siemens entry diesel electric locomotive market,HER
yar happy 47th anniversary pirates caribbean,HER
bmw motogp 16th season running bmw m4 coup heart 2014 safety car fleet,HER
congratulations pina dunne tze ling chung azhar sheikh adrian macdonald judy holmes scored samsung galaxy s5 thanks entering watch space samsung promotions coming,HER
excited big thunder mountain railroad action,HER
partners,HER
pictureoftheweek fully assembled siemens high speed velaro trains testing center wegberg wildenrath germany trains traveling germany speeds 300 kilometers hour details,HER
learn small world 50th anniversary celebration,HER
spring germany click calm,HER
spring deals check new offers things need organized fresh start,HER
signature details burberry heritage trench coat year old design proudly england fits colours explore burberry heritage trench coat,HER
best worlds plug hybrid makes perfect match,HER
magical week,HER
long thinking new kitchen check kitchen designs,HER
congratulations pina dunne tze ling chung azhar sheikh adrian macdonald judy holmes scored samsung galaxy s5 thanks entering watch space samsung promotions coming,HER
happy international waffle day mickey waffles right,HER
investing eur190 million gbp160 million new offshore production facilities great britain production rotor blades offshore wind turbines megawatt class planned new logistics service centre slated hull,HER
putting speed goodwood festival speed bmw m4 coup,HER
hands samsung galaxy s5 launch sydney admit pretty excited check hand pics galaxys5launch,HER
coming,HER
new bmw m3,HER
want hands galaxy s5 pre order,HER
pictureoftheweek a2sea installation vessel sea installer designed built transport installation large wind turbines details,HER
visit mickey right,HER
vp talent tara august sheds light cisco telepresence technology internetofeverything helping nba connect players tv hosts fans powering seamless live interviews watch,HER
zen simplicity 2in1 device,HER
reinvent wheel reinvent light makes bmw laserlight special,HER
watch executive producer turner sports scooter vertino talking barclays arena game app changing nba fan experience help cisco internet,HER
summer getting hot refresh bmw summer complete wheelsets suit best,HER
homesync media hub personal cloud free pre purchase galaxy s5 gear samsung experience store april 10 2014,HER
wishes cars land right,HER
buddies,HER
congratulations pina dunne tze ling chung azhar sheikh adrian macdonald judy holmes scored samsung galaxy s5 thanks entering watch space samsung promotions coming,HER
books fit intel tablet stack approximately half height mount everest,HER
heritage trench coats miniature boys girls new burberry childrenswear s14 campaign,HER
coffee press perfect entertaining home share questions help prepare perfectly athomecoffeeweek,HER
open maximum intensity bmw m4 convertible,HER
good night disney california adventure,HER
comes final march magic matchup west coast vs east coast decide winner comment pirates vote pirates caribbean disneyland comment hitchhikers vote haunted mansion walt disney world,HER
german chancellor angela merkel dutch prime minister mark rutte gained useful insights siemens booth year hannover messe siemens ceo joe kaeser siegfried russwurm member siemens managing board industry sector ceo gave outlook integrated manufacturing solutions industrie watch video,HER
40 years heart europe 40 years bmw belux experience 600 best bmw offer celebrating anniversary opening new bmw brand store brussels come visit,HER
new episode ikeahometour squad heads brooklyn living room ideas help family create organized space watch makeover living room storage options transform room,HER
shakespeare tablet live tweeted plays,HER
100 seconds closed open 20 seconds upper limit performance bmw m4 convertible,HER
gillette body razor built male terrain ready bodyready,HER
power tablet tethering helping photographer paul souders capture unforgettable moments learn,HER
macchiato macchiato macchiato pour,HER
say bmw piece art admit exhibition george france shows unique art cars visit facebook com bmwgeorgev,HER
cern world largest automation systems generates terabytes operation data day smart data management solutions provide event based diagnostics discover unknown relations patterns automate complete alarm management process,HER
reservation extended stay,HER
espresso symphony sound aroma smiles,HER
driving bmw series convertible postcard setting listen postcards greetings james blunt bmwstories,HER
barclays center transforming fan experience internetofeverything change way fans enjoy nba game future,HER
make friday better release galaxy s5 gear family available samsung experience stores telco operators selected retailers samsung com au galaxys5,HER
pictureoftheweek lunch break hannover messe titan robot impressed entertained visitors siemens booth year hannover messe seemingly robots hungry,HER
battery life outlast writer block equip asus t100 transformer,HER
exclusive open air concert senses enjoy new bmw m4 convertible inspired bmw individual like interaction merino leather opal white tanzanite blue metallic paintwork bmwindividual,HER
let count ways espresso love,HER
come long way hair cut fusion proglide razor real,HER
splash right,HER
spring savings click new offers inspiration let home come life,HER
exclusive download new arc client report future manufacturing scenarios investment manufacturing 2050 register,HER
nearly million german households supplied clean electricity wind power check new project borwin3,HER
looking forward smashing easter weekend,HER
wildest ride wilderness,HER
playground grown ups built bmw asia insider bmwstories,HER
look set world premiere fall 2014 mercedes amg thrill sports car fans world breath taking design supreme agility look interior promises upcoming sensation define concept modern luxury,HER
owning kind transportation naming legobatman batman75 batman75thanniversary,HER
load experience hit track,HER
nba legend longtime fan george iceman gervin takes walk new barclays center internetofeverything action cisco nba teaming make big bigger,HER
burberry brings london city 24 april 2014 night celebrations heart shanghai,HER
cozy spot collect thoughts changeofscenery,HER
magical weekend,HER
sunday april 27 2014 day save 20 brand new ikea kitchen tops list kitchen improvements,HER
mood dole whip,HER
wish happy easter holidays colorful beautiful classics photos courtesy auto focused,HER
concept coup suv sensual coup visionary suv flowing line stretched greenhouse striking radiator grille central chrome louvre concept coup suv mercedes benz presents extremely sporty study raising standard new higher level,HER
forever bostonstrong remember affected tragedy hometown year wewillrun united,HER
great weekend,HER
day 1964 small world opened new york world fair happy 50th anniversary happiest cruise sailed round world,HER
let power intel mate,HER
build build hard question happy 450th birthday william shakespeare,HER
feeling little goofy today,HER
impression creative possibilities bmw individual manufaktur bmw m6 gran coup frozen red,HER
better way shave king gillette,HER
carlex design released set renders mercedes benz 63 amg recently gtspirit com discusses article right verdict,HER
playing safe playing riskeverything,HER
happy national pretzel day,HER
unleash imagination,HER
love warmer season new flyer ways save click check,HER
intel 2in1 battery life good need new emoji express happiness,HER
hope week magical start,HER
equipment manufacturing plant erlangen gwe awarded factory year key success keeping flow,HER
cars land calling ready racing,HER
congratulations cathy kwan winner samsung curved uhd tv competition thanks entries visiting facebook page upcoming promotions news,HER
soarin right,HER
new episode ikeahometour squad helps case family bedroom makeover including dream pax closet meet storage needs watch,HER
matter adventure intel powered tablets ride,HER
introducing fusion proglide flexball technology learn,HER
pictureoftheweek borwin2 provide power supply 800 000 homes low loss hvdc systems sie ag 1kopqre,HER
happy friday home improvement month chance win 100 ikea gift card makeover rooms home leave comment post answers question randomly selected win official rules,HER
check new pictures future magazine issue let know think,HER
enjoy scenery big small,HER
relax 4th starwarsday sharetheforce photo balakov flickr com balakov,HER
fourth shared favorite happy starwarsday,HER
ikeahometour design tips squad make small bedroom thanks fans giving ikeahometour videos million views,HER
happily,HER
20 seconds sun bmw m4 convertible,HER
happy 10th anniversary tower terror disney california adventure park,HER
factsvsfacts world biggest wind rotor blade vs largest commercial passenger jet think win unusual standoff,HER
powerful apps turning tablets trusted companions favorite apps use,HER
awake night bmw series gran coup lighting dark,HER
world carousel color,HER
released results second quarter half fy2014 recording press analyst conference,HER
congratulations cathy kwan winner samsung curved uhd led tv competition thanks entries visiting facebook page upcoming promotions news,HER
mom disneyside,HER
let celebrate 30 years bmw m5 powerful version times 600 horses bonnet limited 300 units bmw m5 30 jahre m5,HER
moves quite like roger moves like shavingrebuilt,HER
discover new collection featuring runway inspired accessories vibrant pastels painterly tones bags scarves shoes updated graphic prints check details spring summer 2014,HER
dying meet inside,HER
limitless learning chromebooks intel inside,HER
exporting germany chengdu china built highly automated factory modeled amberg electronics plant production quality 99 9988 percent,HER
welcome cars land,HER
bmw cars way living bmw associated individual experience story,HER
happy mother day share mom makes life magical,HER
long disneyland visit,HER
make history submit innovative concept wearable technology win big learn,HER
happy 22nd anniversary fantasmic disneyland park,HER
journey impossible possible discover bmw story bmw i8,HER
factsvsfacts siemens velaro high speed train efficient world seats occupied fuel consumption passenger low 33l 100km,HER
new episode ikeahometour squad uses ikea kitchen cabinets add extra work space room storage craft room watch makeover,HER
deliver 150 wind turbines capacity megawatts mw rotor diameter 130 meters largest dutch offshore project read project gemini,HER
discover new collection featuring runway inspired accessories vibrant pastels painterly tones bags scarves shoes updated graphic prints check details spring summer 2014,HER
finest fuel fifty states,HER
bmw story unbelievable comeback listen alessandro zanardi feel life changing power driving pleasure,HER
create beautiful summer inside check new deals ikea store,HER
ikea love use creativity love ikea best effort video win 500 ikea gift card learn,HER
ice cream main street right,HER
proud announce siemens ranked attractive employer engineering students europe details,HER
happy happy happy iced coffee coffee coffee,HER
pier fect view paradise pier,HER
factsvsfacts impressive europe 195 000 people work siemens help shaping future easily football stadiums siemens employer choice europe,HER
discover new collection featuring runway inspired accessories vibrant pastels painterly tones bags scarves shoes updated graphic prints check details spring summer 2014,HER
parties worth staying night right olaf disney24,HER
looks like 24 hour party got little magical disney24,HER
know ikea fans crafty creative exceptional enter video ikea love contest win 500 ikea gift card details,HER
happy birthday goofy,HER
honda wins 2014 indianapolis 500 congratulations ryan hunter reay official page andretti autosport capturing checkered flag,HER
hoff hard getting virtually hair face beach ready shavingrebuilt,HER
called timeless classics stands concorso eleganza villa este 2014,HER
sights speed city,HER
share space place design inspiration ikea fans check,HER
result bmw individual manufaktur invited create vehicle professional dtm driver marco wittmann official extraordinary mixture high performance exclusive beauty bmw individual m6 coup orange,HER
happy 37th anniversary space mountain disneyland park,HER
competition closed announce winners soon stay tuned good luck,HER
clouds block sun wind dies power fluctuations balanced quickly gas fired power plants started quickly idea learn energy efficiency feature future energy,HER
work black dark grey legobatman batman75 batman75thanniversary legobatmangame,HER
new ikeahometour episode squad helps pereira family complete master bedroom makeover check transform space,HER
old bike year harry truman president united states billy crystal born eliot won nobel prize literature,HER
experience sydney morning evening using 2in1 power,HER
pictureoftheweek 440tons making way berlin sgt5 8000h gas turbine way sseldorf germany carefully wrapped read record setting project,HER
thatisall,HER
car roger bosch taken hospital born car traveled europe sitting child car seat dad driver rally classics bmwstories,HER
love long summer days join june 13 2014 celebrate midsummer traditional swedish sm rg sbord check local store webpage tickets,HER
lighting taipei exciting announcements computex 2014 round,HER
know catch beautiful sunset paradise pier,HER
splash mountain right,HER
congrats class 2014 ready think new home college let ikea inspired,HER
bmw individual featuring high end audio expertise bang olufsen experience special edition bmw series gran coup bmw m6 gran coup limited 110 vehicles,HER
today unveiled world 14nm design fanless detachable powered new intel core processor available later year learn core computex2014,HER
happy anniversary ariel undersea adventure,HER
horses house powerful bmw machines visiting bmw welt bmw museum munich,HER
typical grocery getter mom selling gta inspired design dodge viper built west coast customs,HER
overclockers rejoice introducing new quad core chip codenamed devil canyon broke world records computex2014 week achieving 5ghz air cooling,HER
mercedes amg model houses interior design,HER
happy friday june chance win 100 ikea gift card place summer relaxation leave comment post answers question randomly selected win official rules,HER
powerful inner values come powerful outer ones 450 hp unique coup design new bmw x6,HER
gonna celebrating 30 years ghost busting action iconic lego ghostbusters ecto car available,HER
exclusive evening exclusive vehicle celebrate launch bmw i8 delivery ceremony,HER
sleek sophisticated barometer work lamp adds style desk check new ikea family offers,HER
sports car outside pioneer inside dynamic efficient bmw i8,HER
upsized features downsize bag,HER
point friendly competition mercy rule come effect,HER
monday summer right gethappier,HER
happy birthday donald celebrate limited release shirt,HER
risky job hire avatar jack jill virtual test persons siemens tecnomatix portfolio help energy industry minimize radiation employees exposed nuclear facilities instance,HER
happy 8irthday 120 cars came celebrate 25th anniversary bmw series 260 participants 20 countries joined party bavarian birthplace bmwstories,HER
ready disneyland visit,HER
bigger better case point tiny houses small house offers maintenance costs spent cleaning best tiny utility bills,HER
13 new technologies computex worth second look,HER
share dad makes life magical father day,HER
sporty design coup presence bmw model short unique look forward exclusive bmw individual features new bmw x6,HER
world color fourth anniversary disney california adventure park,HER
new ikeahometour episode watch week squad makes good use space awkward shaped family room create places dining doing homework,HER
discover new collection featuring runway inspired accessories vibrant pastels painterly tones bags scarves shoes updated graphic prints check details spring summer 2014,HER
need father day gift ideas inspiration,HER
hi ya pal,HER
people think round football shape spherical polyhedron ready kick,HER
real nighter making grade fusion proglide razor real happy father day gillette,HER
happy second anniversary cars land buena vista street,HER
kitchen place make meals dream new recipes signature dishes hone cooking skills check ways improve dream kitchen,HER
delivered bmw i8 arrived,HER
mondays summer better included dole whip gethappier,HER
college digs decorate moving dorm campus housing check ways express personal style new space,HER
moscow dawn dusk 2in1 power,HER
el secreto para anotar el goool definitivo este mes en brasil es el ximo contacto fusion proglide tecnolog flexball,HER
power make design reality,HER
favorite fantasyland attraction,HER
featuring guests including tom felton jourdan dunn tinie tempah david gandy,HER
ready racin,HER
football inspired builds epic want coming using legocup2014 ball,HER
seven dwarfs train opened rave reviews magic kingdom walt disney world resort ride control systems technology hi tech solutions new attraction siemens disney magical alliance look,HER
reasons love summer iced caramel macchiato,HER
breaking boundaries test track finally conquer road bmw m3 sedan bmw m4 coup launching week,HER
check college living space ideas pinspiration new home away home,HER
whitecupcontest designs inspired delighted charmed plain wowed,HER
welcome main street,HER
hp matter meg say,HER
says summer relaxing dining outdoors check ideas creating favorite spot eat outside,HER
hunt begins looking affordable furniture campus college housing inspired,HER
tablet want laptop need,HER
tuesday check simple sewing projects conquer sy sewing machine favorite textiles,HER
football inspired builds getting better better coming legocup2014 image courtesy nivrana,HER
pier fect night disney california adventure,HER
ducati leader design production high end motorbikes company reduced development cycle year use siemens plm software nx teamcenter check sie ag 1ngdcqc,HER
bmw story wants told tell share individual bmw experience bmwstories discover,HER
selection latest mbshootout 63 amg coup hugo boss st tropez thanks gfwilliams photographer beautiful shots,HER
pictureoftheweek check world largest lifting yoke makes installations high wind b75 blade safer faster cost efficient details,HER
work passion,HER
disneyland visit better bring buddy,HER
girlfriend dumped middle 4th period real girlfriend stays fusion proglide razor real mp flexball,HER
getting excited college check ideas bring new home school,HER
houston winner hondaracing carlos huertas dale coyne racing wins race grand prix houston presented greater houston honda dealers,HER
turn outdoor space little getaway share ikea space,HER
wish soarin right,HER
true story death rebirth starting company kiva changed man life,HER
