day masters tournament starts proud global sponsor mercedes benz star course make sure follow mercedes benz golf updates tournament,HER
share ikea space explore rooms designed fans country,HER
veggie lovers like new ikea restaurant,HER
mysterious powerful vortex suddenly appears various lego worlds different characters dc comics lord rings trilogy lego movie swept away save friends batman gandalf wyldstyle bravely jump vortex fighting save lego humanity lego dimensions coming september 2015 breaktherules,HER
experienced frozen fun disney california adventure park,HER
look surprised captured samsung galaxy s6 edge buy,HER
new maseratighibli manufactured new state art production plant industrial software solutions siemens efficiently merge virtual real worlds,HER
check attics original game boy like pleasant surprise,HER
enjoy stay,HER
discover creative ways display plants,HER
virtually developed efficiently built combining virtual real manufacturing maserati increasing efficiency competitiveness future manufacturing,HER
spend minutes outside morning help wake feel refreshed,HER
released ms dos advertisement microsoft ms dos,LER
unveiled windows comdex windows page fall comdex 1983 microsoft marketing handout,LER
celebrated 10th anniversary poster commemorating microsoft 10th anniversary artwork james dietz,LER
shipped cd rom application microsoft bookshelf carl stork demonstrating microsoft bookshelf ca september 1987 bookshelf included popular reference tools cd rom including american heritage dictionary world almanac book facts bartlett familiar quotations chicago manual style roget electronic thesaurus,LER
released office windows office windows ca 1990,LER
released windows federal express truck filled copies microsoft windows ca april 1992,LER
released windows 95 gates stage windows 95 launch held redmond campus august 24 1995 introduced windows 95 start button major focus launch marketing campaign microsoft extensive point,LER
unleashed clippy microsoft office assistant unsuspecting world office 1997 clipit better known clippy screen office assistants introduced microsoft office 97 using technology originally developed microsoft bob,LER
windows xp launched marriott marquis theatre heart new york city new york mayor rudolph giuliani applauds launch windows xp gates october 25 2001,LER
xbox live launched advertisement xbox live launched november 15 2002 year launch original xbox,LER
launched xbox 360 xbox 360 zero hour launch event november 22 2005 500 gamers world engaged 24 hours xbox 360 gameplay chance buy new machine games peripherals exclusive launch party held california mojave desert,LER
microsoft surface announced microsoft surface action customers review features mobile device simply placing surface recognizes device provide graphical overview capabilities,LER
excited joined kick adidas originals facebook spring page home films widgets checking update miss article young superstars complex magazine adi dassler microsite adidas com thanks adidas fan,LER
look blog celebrating 25th anniversary forum collection future forum lo,LER
love adidas originals checking fan photos meantime,LER
launch puffer red ed 25th anniversary forum partnered complex magazine store retail event launch limited edition collaboration forum retailers selected limited edition partners carried adidas 25 years launch forum retailers moe queens ny walter atlanta harput san francisco wjlb radio promoted event hosted wjlb dj bushman mo beatz decks chauncey billups appearance signed product away series piston trivia questions addition day 26 mtv making band stopped,LER
hey check new adidas originals page awesome,LER
music adi dassler film mix artists including crazy baldhead dj 360 seventeen years ratatat virgins happy hear enjoying,LER
link adidas online store help hope looking,LER
adidas like thank lassi lankinen question april 22nd regarding overseas credit cards online shopping shopadidas com helpful future development apologize unfortunately ordering use automatically cancels orders placed foreign credit cards shipping billing address based order took little longer trigger cancellation fact requested shipping address based united states working solutions allow broader secure credit card acceptance future thank sharing suggestions,LER
check new superstar magic film globe click view featured films let know think download free ringtones,LER
thanks beau better bon bons peg bundy disagree won,LER
muchas gracias andres,LER
sure dialect writing thanks comments kittles lubbs nu,LER
brogan hitting pinatas looking,LER
beginning july 17 2008 upper playground release new adidas originals sneaker thursday new shoe line features signature designs fine artists sam flores david choe herbert baglione hip hop artist aesop rock sneaker design available sale upper playground retail stores los angeles portland berkeley sacramento san francisco london england shoes available limited quantity online upperplayground com beginning pst,LER
marc hopefully able use skittles hunger sort rescue device like signal giant falcon overhead pull safety,LER
hey check mix rainbow click drag skittles make track amazing beatboxing kenny muhammad human orchestra wanna hear creative unique fresh tracks forget post mix page send friends fun,LER
michael sieben microsite live approaching michael sieben guest artist adidas originals assortment early 2008 inspired partnership artist adidas quickly bloomed collection exclusive shoe designs shirt hoody featuring sieben artwork entire campaign complete feature mini film micro site web film features inside view sieben character driven world brings illustrated creatures life check adidas com michaelsieben,LER
thursday july 17th marks release new herbert baglione adidas originals sneaker upper playground sneaker series pair unique herbert baglione adidas originals sneaker visit store thursday july 17th order pair online beginning thursday 17 visit upperplayground com details,LER
chris enact second rule won tell want extend hours,LER
ashley lemonade maybe handful sour lemon skittles trick instead,LER
bongi love hear beats post mix discussion board,LER
anya honored maybe skittles playmate named sour skittles,LER
great story really true,LER
thank dimitri like hope bring good start,LER
maria tina turner say better rest,LER
thanks rhea skittles literally rocks check mix rainbow make beats,LER
thanks jessica break company softball game,LER
hey cheri believed love came cutting,LER
kevin dictionary com defines skittles ninepins wooden ball disk used knock pins know definition nicer maybe urban dictionary definition instead,LER
week left save 20 select originals gear residents visit shopadidas com free shipping orders 99 code adiship99f click image right page start shopping,LER
hey quila try meantime mix lemon strawberry let know comes close pink lemonade,LER
sorry hear michael maybe basking tropical sunlight st kitts long word,LER
 ,LER
laurie george mcfly say density mean destiny,LER
lot love air like spring skittles board,LER
noor saying like sour skittles hunch,LER
woo hoo 100 000 fans months thanks stopping got good stuff come stay tuned,LER
hey pamela able save widget facebook page separate page music sounds mix click word save click mix facebook mix button hope helps happy mixing skittles team,LER
nice julie cooper sounds like wedding vow,LER
noor trying say chocolate favorite,LER
wow thanks carol world truly honor say belong,LER
nice beats heather brecken future professional skittles mixing awaits,LER
days left submit photo adidas originals photo contest chance win 500 gift card head school style visit,LER
mix hot ryan em coming,LER
derek despite internet thing assure orange skittles conspiracy red hand,LER
alexander brandon think like really tasty jaw exercise,LER
flip adiscript devon boyd,LER
jennie roygbiv says technically true like believe rainbow make,LER
heber eating,LER
cleo stores sorry hear friend maybe 4th times charm,LER
ashley best friend referring,LER
ashley pru glad guys expressing friendship little facebook rainbow world tim looking bff want make dynamic duo trio,LER
christine glad hear like better sugar coated crab apples previous favorite,LER
emma rose sorry hear blue skittles appreciate haiku ish post,LER
sameer agree say slightly biased,LER
mahtz introduce matt sounds like worked skittles financing operation,LER
sian maybe green ones got confused hemisphere changed,LER
hey mikes ideal world skittles used form currency killer exchange rate settle favorite candy,LER
carson kate offense taken thanks letting know,LER
carly thanks life pretty sweet,LER
luciano beach try tropical skittles tell like doubling paradise,LER
lauren sourman agree performing strict course,LER
know couple days late wanted wish happy newyear traveling dec 31 landed today,LER
pamela,LER
vanessa suppose way bring new meaning taste rainbow,LER
wait second laila think line,LER
lucie est notre secret sol pour la mauvaise francais,LER
taking look facebook stuff,LER
solveig green purple like word,LER
thanks wilyssa like binky blanket bit tastier,LER
thanks thoughts new site know lingering questions twitter site real causing smell stay tuned answers questions promise,LER
thanks teenum sounds like world popular extreme sport,LER
skittles love inside mouth brant,LER
thanks stay tuned,LER
brant happen regional manager mid level paper company ne pennsylvania,LER
thanks jacob forget post mix discussion forum love hear,LER
liz know referring mind need work family beet farm,LER
thanks scott check skittles com chatter htm tweet away,LER
breathing room counts new layout,LER
melanie street harper wrote skittles rock autistic son loves skittles word learned spell thanks melanie humbled honored lives,LER
ryan lynch wrote think skittles taste good cousin katy sorry hear taste buds disagree skittles excited page doubles lynch family reunion group,LER
performing deliciousness enhancement procedure taste buds,LER
froze rainbow today,LER
currency good theory eat checking account,LER
completely forgot friday,LER
darla brown wrote skittles new white meat skittles wrote especially white meat skittles,LER
mandra fandel wrote kids reward going potty reliable skittles wrote thanks mandra glad know regular life,LER
adrian ho wrote skittattle skittalz skittles green blue skittle guy skittles wrote adrian spell,LER
romina castro wrote cost lot money argentina im fan kisses skittles wrote blush rainbow,LER
paulette thompson wrote way release bag red purple original flavors skittles wrote paulette maybe instead introduce likes green yellow orange skittles bff soul mates,LER
nicole stevens wrote loveee american skittles soo better english skittles wrote thanks nicole promise tell queen paintball game,LER
karen solomon wrote soooooooooo addicted skittles yep breakfast lunch dinner karen know breakfast burrito skittles,LER
rick thornes bring noize skatepark tour dates,LER
2009 adidas skateboarding introduced signature skate shoe pro dennis busenitz pro model inspired love football cleats past,LER
louis vuitton art fashion architecture deluxe edition designed takashi murakami available september 2009 copyrights louis vuitton,LER
ken block want heads link new official fan page click fan topped number friends current page allow needed fan page everyon join current content,LER
idc survey suggests cloud computing live high expectations read report reasons prompted organisations consider service,LER
kylie featured windows ads ceo steve ballmer check new windows pc keynote launch event new york october 22 2009,LER
smarter technology available affordable shocks seen systems current approaches sustainable want ibm starting conversation world think make changes better,LER
know 1900 13 world population lived cities 2050 number 70 source global proportion urban population rose 13 220 million 1900 source half world population live urban areas end year 70 city dwellers 2050,LER
fuel economy improvements urban driving hybrid vs intelligent vehicles quest fuel efficient vehicles driven increasing price oil chris manzie harry watson saman halgamuge department mechanical engineering university melbourne present research paper compares emerging technologies automotive systems hybrid drivetrains telematics capability paper hybrid intelligent technologies using different amounts traffic flow information compared terms fuel economy common urban drive cycles view paper,LER
review scs setup wizard,LER
getting speed moblin,LER
testing linux applications help pvs studio windows,LER
videochat net developers benefit multicore platforms,LER
square looking forward seeing tomorrow mighty,LER
parallel programming talk 55 daniel moth microsoft visual studio 2010,LER
intel update,LER
intel education service corps volunteers work save children train teachers students bangladesh use intel powered classmate pc,LER
intel says shape shifting robots closer reality story computerworld,LER
vpro proved value,LER
ereader purpose intel reader abc news link tv segment,LER
know 30 food purchased developed nations ends going waste,LER
taking security initiative,LER
newsweek daniel mcginn span america losing mojo,LER
kgo tv host step richard hart gives dolby ubergizmo intel love abc7 report uber10 list best gadgets 500,LER
testing scaling using computers clouds,LER
universum asked nearly 120 000 students world like work results thank making intel 50 employers best business undergrad employers list check discover intel global like work intel,LER
isilon intel delivering high performance scalable storage,LER
lead corporate sustainability efforts sure help,LER
10 gigabit iwarp sc 09,LER
old computer getting slow new pc,LER
brandweek story lifescoop intel publisher interested brands follow,LER
tuesday krushed winner luke gets 100 picture sad lcd tv sent picture details enter running daily prizes,LER
ibm makes computing cloud capable holding 250 billion itunes songs,LER
krushed comp vote week best pic think better submit entry running win daily judges pick 100 prize,LER
everyday ways reduce air pollutions improve air quality,LER
smashed broken shattered wrecked demolished mashed squashed flattened trampled squeezed email photo enter running win daily judges pick 100 prize mates vote friday pic weekly 500 people choice prize,LER
intel cto keeping america great cnbc squawk box interview twitter follow innovateus converastions,LER
ibm furnish cloud computing ho chi minh city,LER
research exploring programming models single chip cloud computer research prototype,LER
intel livecasting intel cto justin rattner intel labs announce new research milestone core computing,LER
ubergizmo uber10 giveaway hp envy beat courtesy intel close friday,LER
intel unveils 48 core processor single chip cloud computer experimental effort stoy ubergizmo,LER
ok intel fans let great writing haiku interested winning home server check,LER
vote week best entry think better email photo enter running win daily judges pick 100 prize,LER
intel rt video intel labs team dives inside single chip cloud computing experimental chip,LER
ibm helps launch green data centre,LER
enter krushed competition running win daily judges pick 100 prize mates vote friday pic weekly 500 people choice prize,LER
ibm wires trucks water lines smarter city bid,LER
story intel anthropologist genevieve bell,LER
enter krushed photo competition running win daily judges pick 100 prize mates vote friday pic weekly 500 people choice prize,LER
clearing path hands free automated driving,LER
video choosing right computer processor intelinsiders,LER
intel preview new chips december 17 story business tech ces,LER
jane learning pick day 12 10 09 intel technology wiki,LER
rt shuttle bringing pinetrail ces 2010 ces,LER
intel got intel core i7 i5 processor action intel turbo boost technology monitor widget,LER
computers mimic brain,LER
check fun new blog intel education service corps volunteers working care egypt deploy 500 intel powered classmate pcs 20 schools,LER
intel fans question intel really shoot engineers cannons recreate company biggest ubiquitous bong theme chime video ekaterina disclosure personally blown away,LER
ibm nabs wa smart meter deal,LER
final krushed people choice award visit website vote week best entry,LER
intel announces new atom platform integrates graphics memory controller cpu enabling smaller systems lower power,LER
pepsi helping refresh new year 25 000 prizes stay tuned scoop refresh world,LER
elizabethan look,LER
going gaga pepsi,LER
great christmas,LER
ideas star hit refresh tvc,LER
counting new year going hit refresh 2010,LER
ball filming new hit refresh tv spots going share bit bit reveal jan 2010,LER
ready hit refresh,LER
starring mtv vjs erin mcnaught darren mcmullen course pepsi,LER
great new year,LER
hit refresh pepsi mtv vjs erin mcnaught darren mcmullen,LER
shots hit refresh outdoor campaign,LER
hit refresh pepsi mtv vjs erin mcnaught darren mcmullen,LER
pepsi refreshers chatswood nsw 12 2pm monday jan track clues win 250 pepsi refresh card,LER
hit refresh pepsi mtv vjs erin mcnaught darren mcmullen,LER
amy winner refreshwin,LER
hit refresh pepsi mtv vjs erin mcnaught darren mcmullen,LER
hunt pepsi refreshers melbourne cbd tues 5th jan 12 2pm chase clues win 250 pepsi refresh card clues posted 12 noon twitter tweets tab follow twitter,LER
going consumer electronics las vegas year intel prep exercising core taking page 1980 handbook video look forward 2010 launch week intel latest core processors 2010core,LER
congratulations gay winner 250 pepsi refresh card jan melbourne hit refresh hunt refreshmelb,LER
ok brisbanites pepsi refreshers brisbane cbd wed 6th 12 pm ready chase win 250 pepsi refresh card clues posted tweets tab follow twitter,LER
brisbane hunt check hitrefresh com au clues,LER
ready canberra pepsi refreshers canberra 7th jan 2010 12 2pm hunt win 250 refresh card,LER
hours till pepsi refreshers hit canberra 12 2pm hunt win 250 refresh card,LER
winners 250 pepsi refresh cards,LER
look hobart pepsi refreshers 10am 12 noon hunt win 250 refresh card,LER
shots intel booth new technologies attendees tomorrow consumer electronics set include photos pre ces media briefing december plus shots taken evening intel insider core kick party held samba sushi palazzo hotel las vegas,LER
hurrah tassie brad hobart tassie winner fun 250 eftpos card,LER
tgif perth people ready saturday hit refresh hunt sat 9th scarborough 12 00 pm,LER
check cool blog intel education service corps volunteers came training students teachers egypt intel powered classmate pc,LER
hot day beach adelaide today pepsi refreshers henley beach sun 10th 12 00 pm hunt win 250 refresh card,LER
ready darwin chase refreshers mon 11th 11 00 pm win 250 refresh card,LER
congratulations allan winner adelaide jan 10 refreshadel,LER
hunts cities tomorrow ready hunt refreshers tue 12th jan sydney cbd 10 12 noon melbourne prahran 12 00 pm brisbane cbd 00 pm map details site,LER
today coles vouchers receive 50 pepsi product following locations starting 1pm fun remember push sydney martin place pitt castlereagh st world square george st near bathurst st alfred st circular quay melbourne flinders st swantson st bourke st spencer st fitzroy st grey st kilda,LER
look interactive outdoor displays dispensing 50 pepsi product coles vouchers,LER
great job ryder second winner brisbane jan 12 crazy 250 refresh card refreshbris,LER
detective skills prepped tonight hunts tomorrow refreshers waiting cities wed 13th jan adelaide cbd 10am 12 noon sydney parramatta 12 00pm melbourne tullamarine 00pm map details site,LER
fun hunts day sydney pheobe takes home 250 pepsi refresh card parramatta 13 january sydney ready hunt thursday 14 january,LER
excited hunts cities tomorrow thurs 14th jan race refreshers claim prizes west melbourne 10am 12 noon brisbane cbd 12 00pm sydney cbd 12 00pm map details hit refresh site,LER
going run additional adelaide hunt scheduled week error yesterday lucky adelaide gets hunt stay tuned details,LER
winners 250 pepsi refresh cards,LER
day hunts ready search refreshers tomorrow friday 15th january locations perth carlisle 10am 12 noon sydney central 10am 12 noon melbourne cbd 2pm 4pm map details website,LER
forget pick 50 pepsi product coles coupon interactive coles panels,LER
winners 250 pepsi refresh cards,LER
want shiny refresh card worth 250 join hunts tomorrow saturday 16th jan sydney manly 10am 12 noon melbourne cbd 12pm 2pm gold coast broadbeach 2pm 4pm map details website,LER
ready day hunting sunday 17th jan track cities newport sydney 10am 12 00 noon hillarys perth 12pm pm essendon melbourne 2pm pm check map details site area refreshers good luck,LER
ready brisbane melbourne sydney monday 18th hunts track refreshers win 250 refresh card south brisbane 10 12 00 noon melbourne cbd 12 noon 2pm sydney cbd 2pm 4pm clues maps website hunt areas watch photo written clues hunt starts tweets tab twitter website,LER
winners 250 pepsi refresh cards,LER
refreshers hiding seeking hunts tomorrow tuesday 19th jan ready locations perth northbridge 10am 12 noon sydney pyrmont 12pm 2pm canberra city 2pm 4pm check site maps,LER
winners 250 pepsi refresh cards,LER
ready hunts tomorrow certainly race following locations tomorrow wednesday 20th jan melbourne cheltenham 10am 12 noon brisbane cbd 12pm 2pm sydney north sydney 2pm 4pm map details website apologies double post,LER
winners 250 pepsi refresh cards,LER
listen adelaide special hunt coming way couple days competition likely fierce game face prepare hunt friday 22 january 12 noon 2pm adelaide cbd use map 13 jan adelaide cbd hunt,LER
racing shoes pepsi fans hunts tomorrow thursday 21st jan dash prize locations sydney brookvale 10am 12 noon adelaide cbd 12pm 2pm melbourne richmond 2pm 4pm map details website,LER
prior ces 2010 asked gizmodo like test new intel atom powered umid mbook bz agreed spent ample giving mobile internet device bit 6twgeq look share tiny mobile computer,LER
listen adelaide special hunt coming way competition likely fierce game face prepare hunt friday 22 january 12 noon 2pm adelaide cbd map hit refresh website,LER
hunts tomorrow make sure prepared hunters friday 22nd january going waiting locations sydney olympic park 10am 12 noon melbourne cbd 12pm 2pm adelaide cbd 12pm 2pm brisbane southbank 2pm 4pm map details site,LER
winners 250 pepsi refresh cards,LER
intel proud sponsor weekend mia hamm celebrity soccer tournament donate 32 000 honor 32nm chips mia hamm foundation supporting bone marrow research treatment really worthwhile reading letter william aunt pattie works intel william mother remission stage non hodgkin lymphoma day special,LER
ready weekend hunt waiting tomorrow saturday 23 january locations sydney paddington 10am 12 noon gold coast surfer paradise 12pm 2pm melbourne airport west 2pm 4pm map details site,LER
big day hunting sunday 24th january ready adelaide perth sydney chase perth mullaloo 10am 12 00 noon adelaide semaphore 12 noon 00 pm sydney moore park 2pm 4pm check website maps hunt watch site twitter tweets tab photo text clues hunt hit refresh button wins 250 refresh card,LER
congratulations james crew refresher bus stop corner lang cook rd outside equestrian centre refreshsyd,LER
bianca winner perth 24 jan hit refresh mullaloo enjoy prize refreshperth,LER
adelaide winners bruno nate hit refresh beach kiosk semaphore south jan 24 refreshadel,LER
congrats vlad hit refresh near members carpark scg happy spending refreshsyd,LER
working week starts tomorrow better hunts monday 25th darwin geelong sydney darwin 10 12 00 noon geelong 10 12 00 noon sydney cbd pm 00 pm check website map hunt good luck,LER
winners 250 pepsi refresh cards,LER
hunters public holidays come australia day 26 january locations sydney bondi 10am 12 noon melbourne flemington 12pm 2pm brisbane bribie island 2pm 4pm map details website,LER
happy australia day especially morgan hit refresh bondi pavilion morning refreshsyd,LER
ready brisbane melbourne sydney wednesday 27th hunts southbank brisbane 10 12 00 noon syd cbd sydney 12 noon 00 pm melbourne broadmeadows pm pm check site map details,LER
double winner hands nice work mark brisbane winner 27 jan enjoy second 250 refresh card having won twice mark longer eligible win refreshbris,LER
double winner day natasha raced way second win congratulations sydney winner 27 jan enjoy second 250 refresh card natasha won twice longer elegible win refreshsyd,LER
think task refreshers hunts tomorrow thursday 28th jan em adelaide west lakes 10am 12 noon melbourne chadstone 12pm 2pm sydney cbd 2pm 4pm check map details website,LER
winners 250 pepsi refresh cards,LER
friday best day week hunts happening make better locations friday 28 jan perth joondalup 10am 12 noon sydney darling harbour 12pm 2pm melbourne port melbourne 2pm 4pm map details website,LER
winners 250 pepsi refresh cards,LER
weekend hunts hit refresh tomorrow saturday 30th jan locations sydney coogee 10am 12 noon melbourne cbd 12pm 2pm gold coast 2pm 4pm map details website,LER
sunday 31 january opportunity track refreshers hunts sydney cronulla 10 12 00 noon adelaide west beach 12 noon 00 pm adelaide glenelg 2pm 00pm check site maps hunts start,LER
winners 250 pepsi refresh cards,LER
pinch punch month tomorrow february 1st hunts going hobart 10 12 00 noon melbourne southbank 10 12 00 noon sydney cbd pm 00 pm check hit refresh site map clues follow twitter clues track refreshers,LER
winners 250 pepsi refresh cards,LER
new month begun hunts coming cities near refreshers locations tuesday 2nd feb brisbane garden city 10am 12 noon sydney cbd 12pm 2pm melbourne st kilda 2pm 4pm check map details website,LER
winners 250 pepsi refresh cards,LER
ready mid week 250 boost wednesday fun come hunt refreshers wed 3rd feb spots perth subiaco 10am 12 noon brisbane fortitude valley 12pm 2pm sydney cbd 2pm 4pm check map details site,LER
congratulations jennifer 1000 richer weekly prize winner pringles play win 100k friends click,LER
