***Facebook EXCLUSIVE Monster Giveaway***   Leave a comment below and in the next hour  we will be picking a random winner.The winner will recieve an EXCLUSIVE Athlete only hat OR an athlete only tshirt (Winner will choose). Let the comments flow =D [The more you comment  the more chances you have to win],HER,status
Thanks to the beautiful Barbara Palvin for being our VIP guest at L'Oreal Melbourne Fashion Festival 2013. Get behind the scenes at she wins over her Australian fans.,LER,video
Here are some of our favourite blogs to follow and we're sure you'll love them too!  Life.Styled.  SASSYBELLA.com  Breakfast With Audrey  drop dead gorgeous daily  Hair Romance  bellaMUMMA  Beautyholics Anonymous  Fat Mum Slim  stylehunter.com  The Daily Buzz.,LER,photo
We were excited  a little nervous and overjoyed by the fantastic response at our first community event in Surry Hills last night. A big cheers to our local community and  PLAY BAR for hosting us in style - we'll be back for more!,LER,photo
Meet Carl 'Wazza' Thompson. He 'wazza' Chicken before he changed his name...  See more stories on 'Meet the Chickens' at: http://tinyurl.com/bg6twop,LER,video
We are proud to support such a good cause! Help spread the word by supporting White Shirt Day today. Ovarian Cancer Research Foundation (OCRF),LER,photo
GE Australia CEO Steve Sargent believes the Industrial Internet will deliver big gains to business and Australia's long-term productivity and growth.,LER,link
Who do you think should Say It With Chicken? ,LER,status
How connecting machines to sensors will help everything run more efficiently  sustainably & productively. http://bit.ly/12hWErQ,LER,link
Don't forget to join us at 1pm TODAY for the LIVE FACEBOOK CHAT with marie claire magazine Australia Beauty Editor  Lucy Adams!,LER,photo
Don't forget to join the conversation at 1pm TODAY!,LER,photo
Less than 1 hour to go until the marie claire magazine Australia LIVE CHAT with Lucy Adams! Be sure to visit our page and join in the conversation to have all your hair care questions answered.,LER,status
Watch as L'Oréal Paris Ambassadors Freida Pinto  Madame Inès De La Fressange and Aimee Mullins give you 'a day in the life' on Day 02 at the 66th Annual Cannes Film Festival.,LER,video
The sun came out for Day Three on the Red Carpet at the 66th Annual Cannes Film Festival. Watch as L'Oréal Paris beauties  Megan Gale  Doutzen Kroes  Eva Longoria  Aimee Mullins and Leila Bekhti create unforgettable moments...,LER,video
Get Behind the Scenes with our ambassadors during the 66th Annual Cannes Film Festival.,LER,photo
Get Behind the Scenes moments with our gorgeous Australian Ambassador  Megan Gale as she walks the Red Carpet for a second year at the 66th Annual Cannes Film Festival.,LER,video
The sun was back and just in time for another day on the Red Carpet. Watch as Bollywood bombshell Aishwarya Rai walks alongside timeless icon Jane Fonda and Indonesian beauty Maudy Koesnaedi at the 66th Annual Cannes Film Festival on Day Five.,LER,video
ANZ Global Wealth CEO  Joyce Phillips  on new #IBMWatson collaboration fuelling smarter financial recommendations,LER,link
GE Mining CEO Geoff Knox on how the Industrial Internet is set to bring massive productivity gains in mining.,LER,link
A special message from Barbara Palvin to her fans ahead of her red carpet appearance at 66th Annual Cannes Film Festival on day seven.,LER,video
New red carpet pics have been uploaded. See what Milla  Aishwarya and Barbara wore on day seven at the 2013 Cannes Film Festival.,LER,photo
Update from our friends at Pepsi Max Crew FPR,LER,link
Barbara chose a stand-out beauty look on day eight wearing an eye-catching orange eyeshadow…this is certainly a look not many people could pull off. We loved her matching manicure and black textured floor-length gown!,LER,photo
Get behind the scenes at the ultimate gold fashion show  the amfAR gala. Curated by Carine Roitfeld  this is one event not to be missed and our L'Oréal Paris dream team were part of the action. Bianca Balti  Isabeli Fontana and Tais Araujo's share their Red Carpet beauty secrets.,LER,video
Discover why Saadet Aksoy loves being part of the L'Oréal Paris 'Dream Team' and Stéphane Lancien shows us how to recreate Bianca Balti's chignon bun.,LER,video
Join us for the last day at the 66th annual Cannes Film Festival as Laetitia Casta  Saadet Aksoy and Ximena Navarrete walk the red carpet at the closing ceremony.,LER,video
7 lucky VIP bloggers from all over the world got exclusive access to Eva Longoria during a Google Hangout which was held live from Cannes on May 18th.,LER,video
Come and join the Macca's playground! Sign up now for the chance to give us feedback  and tell us what you think.   To join  simply click - www.themaccasplayground.com.au. Cash prizes given out every week to our members!,LER,link
What are your plans for the weekend?,LER,photo
What changes are needed in the Australian healthcare system?   Hear from experts & join the debate at Australia 2.0 so we can solve our nation's toughest problems together: http://www.afr.com/australia2-0,LER,video
What should a blueprint for the future of Australian infrastructure look like?   Hear the views of industry experts & tell us your thoughts in the comments.,LER,video
Come and join the Macca's playground! Sign up now for the chance to give us feedback  and tell us what you think.   To join  simply click - www.themaccasplayground.com.au. Cash prizes given out every week to our members!,LER,link
Discover our NEW Shine Caresse... a lip gloss  shine  lipstick  stain and colour in one!,LER,video
Paul Garvey discusses the outlook for mining in Australia with Resources Minister Gary Gray  Atlas Iron CEO Ken Brinsden and Reg Howard-Smith of the WA Chamber of Minerals and Energy.,LER,video
Paul Garvey looks further into the outlook for mining in Australia with Resources Minister Gary Gray  Atlas Iron CEO Ken Brinsden and Reg Howard-Smith of the WA Chamber of Minerals and Energy.  The Path to Prosperity round-table series looks at ways for Australia to become a richer nation through productivity gains and technical innovation. Click here for more: http://bit.ly/GEPathToProsperity,LER,video
Paul Garvey looks into the outlook for LNG in Australia with Resources Minister Gary Gray  Atlas Iron CEO Ken Brinsden and Reg Howard-Smith of the WA Chamber of Minerals and Energy.  The Path to Prosperity round-table series looks at ways for Australia to become a richer nation through productivity gains and technical innovation. Click here for more: http://bit.ly/GEPathToProsperity,LER,video
Paul Garvey interviews Resources Minister Gary Gray  Atlas Iron CEO Ken Brinsden and Reg Howard-Smith of the WA Chamber of Minerals and Energy.  The Path to Prosperity round-table series looks at ways for Australia to become a richer nation through productivity gains and technical innovation. Click here for more: http://bit.ly/GEPathToProsperity,LER,video
Are we running out of water? Global demand for water is expected to increase by 60% between now & 2030 http://bit.ly/11YhPRK,LER,status
How far would you go for younger looking skin? The results are in: http://bit.ly/LaserTheResults,LER,photo
Unconventional production is changing the US O&G industry but how fast can it spread to other countries? http://gelookahead.economist.com/the-unconventional-revolution/,LER,photo
How far would Australian women go for younger looking skin? The results are in and we have the low down here: http://bit.ly/SeeTheProof,LER,photo
We can't wait for this! Be sure to enter now for the chance to secure a seat... spaces are limited.  ,LER,link
How we're using #BigData sensors to build the turbines and jet engines of the future http://nyti.ms/17hMquL,LER,status
Starpharma CEO Jackie Fairley looks at running a health sector co,LER,video
Why Arginine? Essential for the growth of hair  Arginine helps the hair regain its natural strength  stimulating the growth of the hair fibre starting from the bulb. http://bit.ly/WatchArginineResist  Discover more here: http://bit.ly/LPInsider,LER,photo
WIN a V8 pit crew experience with the Pepsi Max Crew FPR!! Grab 2 Pepsi products from participating stores to enter: http://bit.ly/v8pitcrew,LER,photo
Paula Joye from Life.Styled. shares her 'Joye's of shopping' during her trip to Paris and introduces our NEW Nude Magique CC Cream.,LER,link
Suffering from Mondayitis? Here's Dr Levy's advice www.wheeloflevy.com,LER,photo
The team at L’Oréal Melbourne Fashion Festival are giving away the chance to WIN a VIP fashion experience! ,LER,photo
Get up close & personal to Pepsi Max Crew drivers  Mark Winterbottom & Will Davison! Check out all of their appearances in Townsville here: http://tinyurl.com/bnaxhx2,LER,photo
Sean Parnell discusses the aged care sector with GE Healthcare’s Michael Ackland and a panel of other experts.,LER,link
Geoff Elliott discusses the airports of the future with Boeing Australia's Ian Thomas and GE Aviation’s Max York.,LER,link
Surgery  Botox  Facials or Skincare... what do you do for your skin? The results are in: http://bit.ly/SeeTheProof,LER,photo
Access to unconventional resources  reductions in costs of renewables  climate change and water and increasing energy demand are changing the energy system.,LER,link
Wrapping up for the week? Take a breather - which mouse will get to the Windows Phone?,LER,photo
See why www.beautyheaven.com.au readers gave our Hair Expertise EverCrème 48H Moisture System Deep Nourishing Masque 5 STAR reviews!,LER,link
Guess what device is being assembled in the image below?,LER,photo
Some people are trying the new Internet Explorer and actually liking it. Not that they would say that out loud. Curious? Find out more: http://browseryoulovedtohate.com.au,LER,video
With only 7 weeks to go until TechEd Australia 2013  it’s time to introduce you to the travails of TechEddie and TechEdie! We’ll be sharing the next instalment of their adventures each Friday – what do you think Wesley Gripes is getting up to?,LER,photo
In the market for a fancy new mouse  keyboard or webcam? Now's the time - get loads of computer accessories at 25% off by July 31st: http://msft.it/6034Zkuu,LER,photo
Watch Jennifer Lopez strengthen her hair with our new Elvive Arginine Resist anti hair fall range! http://bit.ly/WatchArginineResist,LER,photo
In September 2012  V8 Supercars upgraded to Office 365. They are a dynamic business  with teams working on different events around Australia and overseas. Office 365 was the perfect solution for keeping their workforce connected on the go. See how Office 365 has transformed the way the V8 Supercars' team works: http://www.youtube.com/watch?v=nQaOLoe6rHY&list=PLz6RgUKX11CXowKBqXEcJqlJ_eRmG8CFe&index=1,LER,video
Be sure to enter for your chance to WIN!,LER,photo
Hungry for more nitty-gritty detail? Check out what WIRED think in this exclusive look at the Xbox One http://xbx.lv/10Se8sV,LER,photo
WIN a V8 pit crew experience with the Pepsi Max Crew FPR!! Grab 2 Pepsi products from participating stores to enter: http://bit.ly/v8pitcrew,LER,photo
Will the Blues be able to end their Origin drought? 'Like' if you're backing New South Wales  or 'Share' if you'll be supporting the Queensland!,LER,photo
Purchase the Asus VivoTab Smart and score a free subscription to Microsoft Office Home and Student 2013. Or  buy the Asus VivoTab RT and get Sennheiser HD239 Headphones free! Be quick - offer ends 30th June. Purchased yours? Redeem here: http://www.vivoasuspromo.com.au/,LER,photo
Battle the Covenant from your Surface! Halo: Spartan Assault is now available for Windows 8! Download your copy today: http://msft.it/6034ZZSa,LER,photo
In the lead up to TechEd Australia 2013  we’re paying tribute to the technology that has brought us to where we are today. Wesley’s got different ideas though…,LER,photo
If you could have a Skype call with someone famous  who would it be? One name per comment - go!,LER,photo
Congratulations to the Duke and Duchess of Cambridge on their new little boy.,LER,photo
Our CEO  Steve Sargent  is speaking at tomorrow's American Chamber of Commerce business briefing. Join us on Twitter  @GEAustralia  from 12pm  for snippets of his speech on the future of Australia's prosperity,LER,status
Microsoft and LEGO Education team up to inspire the next generation: http://msft.it/6038ZdrQ,LER,photo
Do 'drop bears' exist? Things aren't always what they seem. http://www.browseryoulovedtohate.com.au/,LER,photo
Don't forget that Father's Day is only 2 weekends away! #fathersday #menexpert,LER,photo
Is the 5 second rule true? Things aren't always what they seem. http://msft.it/6035ZlTx,LER,photo
How did this mountaineer scale a 8 000m peak with temperatures of minus 60 degree celsius? http://pco.lt/164Hp7l,LER,photo
Let's share! Peers  a member-driven organisation that supports the sharing economy  goes live today. Join your peers now: http://www.peers.org/,LER,link
Need inspiration for your Friday night out? #FridayGenius  Download our Colour Genius app for free: http://bit.ly/ColourGeniusApp,LER,photo
Max your Friday with DYNAMO #maxmoment,LER,video
How much would you spend to fight the signs of ageing per month? Find out what Australian women think here: http://bit.ly/SeeTheProof,LER,photo
Come in and get FREE donut sticks with any breakfast purchase! (Ballarat KFC's only),LER,photo
Did you know: There are 44 countries around the world that have fewer than 23 doctors  nurses and midwives per 10 000 population,LER,link
We are excited that so many of our products are in the running! VOTE NOW for your favourites:   Readers Choice Mascara - False Lash Telescopic Readers Choice Eye Cream – Revitalift Laser X3 Readers Choice Eyeliner – Colour Riche Le Smokey Readers Choice Blush – Nude Magique BB Blush Readers Choice Bronzer – Glam Bronze La Terra Readers Choice Cult Product – Nude Magique Anti-Redness CC Cream Readers Choice Powder – Nude Magique BB Powder Readers Choice Lip Gloss – Shine Caresse Readers Choice Cult Item [Hair] – Elvive Extraordinary Oil Readers Choice Home Colour – Wild Ombres Hair Colour Readers Choice Shampoo & Conditioner [Mass] – Elvive Arginine Resist X3,LER,link
Fancy a trip to Las Vegas for the Mr Olympia Arm Wars (& a slew of VIP fun). Grab a Pepsi Max from BP & enter here:  http://bit.ly/ArmUrself or here www.smfuse.com/m/ArmUrself for mobile,LER,photo
Find out how you can join in the fight against ovarian cancer by hosting a High Tea. Because every woman is worth it! http://bit.ly/OCRFGetInvolved  Ovarian Cancer Research Foundation (OCRF),LER,photo
Want a FREE Pepsi MAX Kick to fix the afternoon slump. Request HERE: http://statictab.com/yngmh87,LER,photo
Recognise these outfits? It's name that Beyoncé Iconic moment! Can you do it? #NEXT,LER,photo
Want a FREE Pepsi MAX Kick to fix the afternoon slump. Request HERE: http://statictab.com/yngmh87,LER,photo
Want a FREE Pepsi MAX Kick to fix the afternoon slump. Request HERE: http://statictab.com/yngmh87,LER,photo
Award winning director Jake Nava has been behind some of Bey's most iconic music videos and the visionary new Pepsi ad. Here he reveals what it's really like to work with music icon Beyonce. http://www.youtube.com/watch?v=BLQeRVoxBYE,LER,photo
Our KICK Girls are armed with cold cans of Pepsi Max KICK and visiting workplaces all week!! Have you seen them? Don't miss out #kicktheafternoonslump. Request a visit here: http://bit.ly/MaxKICK,LER,photo
Would you eat Nutella on Mars? These astronauts say they would!,LER,link
Want a FREE Pepsi MAX Kick to fix the afternoon slump. Request HERE: http://statictab.com/yngmh87,LER,photo
L’Oréal Paris Make-Up Director  Elsa Morgan  shares her tips on how to wear pastel hues with style.,LER,link
We're here! Bullseye University is going down now. Check us out between 10am–8pm at Rudder Plaza for games  food  prizes  and a chance to shop the latest Back-to-College items for your dorm.,LER,status
Want a FREE Pepsi MAX Kick to fix the afternoon slump. Request HERE: http://statictab.com/yngmh87,LER,photo
We're going to let the Nutrilift Gold results speak for themselves…  and remind you that today is your LAST CHANCE to WIN your very own! http://bit.ly/NutriGoldCompetition,LER,photo
Have you seen the Datalandia series?   Watch episode 3  to see how big data decrypted an alien language and saved the small town. http://pco.lt/19FrYZv,LER,photo
Want a FREE Pepsi MAX Kick to fix the afternoon slump. Request HERE: http://statictab.com/yngmh87,LER,photo
L'Oréal Paris vs. MAC - watch to find out which product this reviewer ranked on top! http://bit.ly/LPBeautyReview,LER,photo
Want a FREE Pepsi MAX Kick to fix the afternoon slump. Request HERE: http://statictab.com/yngmh87,LER,photo
Congratulations to all winners at the BRW GE Captial Mid-Market Awards! See the wrap up from last night and read about the winners.,LER,link
Want a FREE Pepsi MAX Kick to fix the afternoon slump. Request HERE: http://statictab.com/yngmh87,LER,photo
Want a FREE Pepsi MAX Kick to fix the afternoon slump. Request HERE: http://statictab.com/yngmh87,LER,photo
When you're a true superstar like @Beyonce  even your nails look hot! #NEXT,LER,photo
Why compromise when you can have it all? Introducing new Volume Million Lashes Excess Mascara. The first mascara that defines each lash for over-the-top volume without clumping. Discover three ways to wear your VML!,LER,photo
What’s your style - Gatsby Glam  Smouldering Seductress or Femme Fatale?   Find out how to get the look with our new Volume Million Lashes Excess Mascara!,LER,photo
Want a FREE Pepsi MAX Kick to fix the afternoon slump. Request HERE: http://statictab.com/yngmh87,LER,photo
Want a FREE Pepsi MAX Kick to fix the afternoon slump. Request HERE: http://statictab.com/yngmh87,LER,photo
If you've tried our new Préférence Wild Ombré kits & would like the chance to WIN a L'Oréal Paris Pamper Pack  don't forget to "Share Your Hair" with us before 11am Monday! #ombrehairau Visit www.ombrehair.com.au for more details.,LER,photo
Beautiful #science: Check out this Lego city!  http://pco.lt/1cmBCOc,LER,photo
Could your unused energy be the key to your own solar panel? http://pco.lt/1aczsU1,LER,photo
Want a FREE Pepsi MAX Kick to fix the afternoon slump. Request HERE: http://statictab.com/yngmh87,LER,photo
In our latest behind the scenes interview  Beyonce's stylist Ty Hunter reveals all about working with the Queen B herself! #NEXT http://www.youtube.com/watch?v=b3vBuizEbuI,LER,photo
Could we live to 200 years? http://pco.lt/19dgoQY,LER,photo
Want a FREE Pepsi MAX Kick to fix the afternoon slump. Request HERE: http://statictab.com/yngmh87,LER,photo
Congratulations to Marney Shephard our week 6 and final #ombrehairau winner!   Thank you for all of your great entries. Keep inspiring us with your awesome #ombrehairau looks here on Instagram and over at www.ombrehair.com.au,LER,photo
Want a FREE Pepsi MAX Kick to fix the afternoon slump. Request HERE: http://statictab.com/yngmh87,LER,photo
The final episode of Datalandia is here. http://pco.lt/1dRa9Zn,LER,photo
Need an excuse to get glammed up? Vogue Australia's annual Fashion's Night Out is on tonight! Plan your night's fabulous festivities here: http://bit.ly/VogueNightOut,LER,photo
Pepsi could be your ticket to New York! Grab one & head here to see how: http://bit.ly/18CfSKc Exclusive to Woolworths Australia's Fresh Food People,LER,photo
Does Infallible 2-Step Longwear Lip Colour really last ALL day long? Discover the verdict here: http://bit.ly/Infallible2StepReview,LER,photo
Curious about the #IndustrialInternet? Check out GE Wonderground to discover history  innovation and go on a virtual treasure hunt http://pco.lt/14oJkaQ,LER,photo
Want a FREE Pepsi MAX Kick to fix the afternoon slump. Request HERE: http://statictab.com/yngmh87,LER,photo
Watch this video to find out more about the Industrial Internet http://pco.lt/18NXWMF,LER,photo
Spring is finally here which means more picnics in the park  more beach trips and more outdoor fun! Check out our new Youth Code Luminosity with SPF 15 to keep your skin perfectly protected. http://bit.ly/YouthCodeLuminositySPF15,LER,photo
Look Good Feel Better - Australia helps to improve the wellbeing and confidence of people undergoing treatment of cancer… join us this week to support this fantastic cause!   How? Buy our new L'Oréal Paris Nutrilift Gold Foundation in Priceline before 11th September and they will donate $2 OR purchase your favourite L'Oréal Paris lipstick in Myer this week and $1 will go to Look Good…Feel Better.,LER,photo
Want a FREE Pepsi MAX Kick to fix the afternoon slump. Request HERE: http://statictab.com/yngmh87,LER,photo
Like if you think it's...,LER,photo
There’s nothing more Aussie than getting a free snag while you’re having your say about who should run the country. But in what state are you most likely to find a sausage sizzle at your polling booth? According to Saturday’s data  the results are in. ,LER,photo
L'Oréal Paris Men Expert is proudly sponsoring the Best Captain Award to be presented at this year’s 2013 Be the Influence AFL Players’ MVP Awards. Tune in to Fox Sports at 9:30pm tonight to catch the action live!,LER,photo
Congratulations to Prof Graeme Clark  on his 2013 Lasker award  http://nyti.ms/1efsVK7,LER,photo
Guess which product this reviewer rated 5/5? http://bit.ly/SpoiltBlogReview,LER,photo
#XboxOne is racing in the Supercheap Auto Bathurst 1000 this year! Meet our car and watch it getting built: http://www.youtube.com/watch?v=EFiOKT1X0CQ,LER,video
To raise money for Look Good Feel Better - Australia  we are doing makeovers at Priceline Australia's Biggest Beauty Playground until 5pm today! If you are in Sydney  head down to Martin Place  join in the fun and support a great cause!,LER,photo
#BigData – from business to art http://bit.ly/1b7gr58,LER,photo
The demand on our electrical grid is ever increasing  with the need to rapidly integrate renewable energies and other off-grid energy sources. See how Australia  and other countries around the world  are managing this demand.,LER,photo
With Spring comes the age old question... Pastel or Pop? Which are you?,LER,photo
World's longest apple drop,LER,link
Want to light up your Monday? Try brightening your look with these gloss enhancing products & let it shine!,LER,photo
We're Crazy in Love with this!!! Grab a Pepsi Next and head here to find out how: http://bit.ly/18qAb2r,LER,photo
Your questions  answered! Find out more about our Arginine products  here: http://bit.ly/LorealParisArginineResist,LER,photo
Want to learn how to get beautiful looking skin? We have the answers right here! http://bit.ly/SkincareQuestionsAnswered,LER,photo
Did you miss our Runway shows during Melbourne Spring Fashion Week?   Never mind  view the Album HERE -->  http://goo.gl/162XiS,LER,photo
Micah from Controle Creatif is one of our favourite Bloggers and knows how to serve up some serious Denim Realness!   Find Micah's look here >http://goo.gl/1wLDTY View Micah's full Blog Post here > http://goo.gl/leIdZz,LER,photo
RED HOT TIP! Layering is the key to a solid red colour statement. Line lips  load on lipstick and set with a translucent powder or similar colour eyeshadow for the ultimate power pout. Which red is your favourite?,LER,photo
The girls at Beauty Directory vote these as their Friday Eyesentials! What are yours? http://instagram.com/p/dVeje1SCYc/,LER,photo
Forza Motorsport 5 has partnered with McLaren and legendary stunt driver Tanner Foust to create “FilmSpeed ” a blisteringly fast zoetrope-based short film featuring scenes from Forza Motorsport 5! Watch it here: http://www.youtube.com/watch?v=-5fiJ49-o_8,LER,video
A classic since its 1962 introduction. This fit  features two button-flap chest pockets  two welt pockets  and side tabs that adjust the fit.  View our famous Trucker Jacket here --> http://goo.gl/uJhTcN,LER,photo
Liquid shaping technology + the perfect fit = a revolution in shaping jeans.   Get to know Levi's® Revel --> http://goo.gl/HyzSMN,LER,photo
Can’t live without your jeans this summer? Then why not try chinos and cargo short styles including on trend army camouflage and cheeky floral.    Find your closest Levi's store here --> http://goo.gl/YDrNao,LER,photo
Worried you're not going to make it to see people holidaying on Mars? Don't worry  scientists are making 80 the new 20.,LER,link
We’re traveling across America with Station to Station  equipped with a camera  a video camera  a typewriter  and a guitar – all hacked to post directly to the Web.  Learn more about the tools or collaborate with the creative pioneers on board using #MakeOurMark.   Watch --> http://www.youtube.com/watch?v=nMi9swYqbN4,LER,photo
It's Spring and your eyes have told us they want to celebrate! Time to put away the neutrals and have some fun - read how Beauty with the Beautifool worked our Colour Riche Quads palette to do just that. http://bit.ly/TheBeautifool,LER,photo
This is how big data is improving efficiencies in the Australian oil & gas industry right now. http://pco.lt/180YelU,LER,photo
SALE ENDS TODAY at Priceline Australia! Don't miss out!,LER,photo
The Big Apple's calling…here's how to pick up: http://bit.ly/18CfSKc Exclusive to Woolworths Australia's Fresh Food People,LER,photo
EverPure  EverSleek or EverStrong? Find out which Hair Expertise product is right for you and discover the benefits of 100% Sulphate Free haircare with your chance to WIN your very own samples  here: https://www.facebook.com/LOrealParisAU/app_459383004085111,LER,photo
Match it  Blend it  Clash it! Try our Colour Genius app here! http://bit.ly/ColourGenius,LER,photo
Christophe Robin  Colour Designer for L'Oréal Paris shares his top 10 tips to colouring hair: http://bit.ly/ChristophesTop10,LER,photo
Who'll be left holding the cup?! #footyfinals http://youtu.be/dJ3uCMEmzgM,LER,photo
