facebook exclusive monster giveaway leave comment hour picking random winner winner recieve exclusive athlete hat athlete tshirt winner choose let comments flow comment chances win,HER
love somebody let come skittles,HER
discover,HER
discover,HER
step lighting technology obvious led headlamps efficient laser technology consumes space flexible efficient bmw i8 concept introduce headlights use laser light think,HER
computer dispense skittles click like,HER
happy national coffee day,HER
thank steve jobs world better place missed,HER
steve jobs 1955 2011 behalf google broadly technology missed,HER
favorite person coffee,HER
pumpkin spice latte pumpkin patch meta,HER
seen java life rap video,HER
joe locicero aka million mile joe reached million miles 1990 accord way joe maine celebrating posting video big moment festivities followed soon meantime congratulate comment,HER
happy halloween,HER
red cups,HER
lot try comment post rainbros,HER
happy birthday walt,HER
like visited mickey house,HER
director sofia coppola wearing total look louis vuitton photocall bling ring 66th annual cannes film festival,HER
runway red carpet follow friends house wearing louis vuitton collections world,HER
madonna wearing prada ss2012 necklace luvin feat nicki minaj videoclip,HER
madonna wearing prada ss2012 necklace luvin feat nicki minaj videoclip,HER
happy valentine day lego fans,HER
miu miu tales screening woman dress short film giada colagrande willem dafoe giada colagrande bfa,HER
mocha self portrait,HER
hey look coffee cherries,HER
eternal question hot iced,HER
andrey malakhov prada prada stoleshnikov store opening moscow march 20th 2012,HER
kate bosworth wearing prada dress life happens premi los angeles april 2012,HER
scarlett johansson wears prada ss12 dress premi avengers assemble london april 19 2012,HER
olivia wilde wore prada dress attending help wanted premi tribeca film festival new york april 20 2012,HER
jason schwartzman prada moonrise kingdom photocall 65th cannes international film festival 16 2012,HER
mia wasikowska prada spring summer 2012 collection lawless photocall 65th cannes international film festival 19th 2012,HER
bit facial hair means click adrien brody story share,HER
like spending weekend family,HER
smith prada men black premi berlin 14 2012,HER
said,HER
think pirelli goodyear michelin largest tire manufacturer humble lego tire rolls right brands producing staggering 318 million lego tires year happy 50th anniversary lego wheel,HER
fun friday caption photo,HER
hope lose sight thing started mouse walt disney,HER
city,HER
thong cheeky kind girl tell style love unlock exclusive panty perk comment team thong team cheeky cast vote,HER
ultra light lace super summery colors love new desire push demi shop,HER
paws moment say hi pals pluto goofy,HER
heart beats true red white blue happy 4th july,HER
perfect disneyland day definitely include,HER
hq think sports entertainment special events oracle arena oakland california,HER
mickey looks dressed 1929s,HER
kick comic international thought enjoy seeing life size lego lord rings models bilbo baggins gandalf trip way middle,HER
met prince dream,HER
yes true brand new lego hobbit sets revealed comic international stay tuned reveals hobbit coming months,HER
foolish mortals fear friday 13th,HER
attending oracle openworld,HER
available prada stores,HER
man touch,HER
come happy place welcome happy 57th birthday disneyland,HER
power intel core i3 processor 4x4 computer small fit pocket use,HER
today 44th birthday let celebrate,HER
woot sexiest night television emmy 2011 victoria secret fashion nominated outstanding lighting design lighting direction variety special nominees include superbowl oscars grammys nominee looks best lingerie win,HER
sunny friday hq photo post share photo,HER
iced coffee,HER
stop visit mickey toontown neighbors including minnie mouse,HER
challengers countries ultrabook race challengers say goodbye st petersburg sydney,HER
disneyland vacation,HER
thing inside inspires says going make matter,HER
sun sets disneyland park new opportunity emerges love photography,HER
ready make splash,HER
guess location ultrabook hint,HER
want 2012 likes support james swim tonight aussie support home like,HER
honda badge evolved thanks tyler cool shot honda badge,HER
pop quiz ok ok know summer new quiz super quick super cute way perfect bodybyvictoria bra check,HER
hard work spectacular live entertainment experience fantasyland theatre set debut summer prepare princess fantasy faire closing august 12 look favorite disney princesses path small world new fantasy faire opens spring learn,HER
set sail safari uncharted waters fearless skipper,HER
ultrabook race officially watch happens episode,HER
wisp lace pretty picot trim little bow match body victoria bras love body victoria panties shop,HER
wisp lace pretty picot trim little bow match body victoria bras love body victoria panties shop,HER
race clock today interactive doodle,HER
hear neon summer agree,HER
define bra perfection day essential wonder bodybyvictoria quiz perfect bra,HER
beautifully crafted cars thing special treat check photos ninth generation honda accord,HER
repeat hakuna matata,HER
fall look book came ready trade flip flops fierce suede pumps help excited looking new trends start getting fall fashion state mind shop,HER
computers,HER
happy anniversary haunted mansion opened gates ghoulish grounds day 1969,HER
catch day watch episode ultrabook race,HER
photo caption geo quiz team oracle pilot sean tucker enjoys flight,HER
opens mouth eating comes goes geppetto,HER
sing disney small world storybook app languages learn disney parks blog,HER
ready scream,HER
candice candice water know shark week,HER
makes happy,HER
holiday season history candlelight ceremony processional extended total 20 nights stay tuned disney parks blog information,HER
happy anniversary dumbo flying disneyland sky day 1955,HER
comment battle try type comments row interrupting,HER
start weekend like join,HER
tasty tour newly updated candy kitchen main street disney parks blog video,HER
know popularity small world replicated disney resort world,HER
india brasil indonesia country challenger came ultrabook race watch final episode,HER
like intel powers,HER
places explore like head,HER
fast oracle team usa sail 20 knots 30 knots faster wind,HER
smooth lace favorite body victoria bra shop body victoria,HER
good day pineapple dole whip agree,HER
gamers specs rigs,HER
favorite panty ready fall lacie 33 stores online shop,HER
editor fall lookbook little black dress chic sexy separates women girls favorite lbd shop,HER
know sure building oracle global headquarters bonus stories tall,HER
code live,HER
oh summer thanks memories,HER
picture oracle executives latest tech innovations developments industry insights strategies success,HER
ultrabook,HER
great tribute legend memory neil armstrong,HER
editor fall lookbook fragrance perfect finishing touch look favorite finishing touch shop,HER
laptop tablet best worlds new hp envy x2 read,HER
happy birthday big thunder mountain railroad wildest ride wilderness day 1979,HER
click like wish aussie paralympic swimmer ahmed kelly good luck race hope hard work pays,HER
labor day marks unofficial end summer fun stop disneyland resort upcoming season excited celebrating disneyland halloween disneyland holidays,HER
laptop tablet meet new hp envy x2,HER
hey honda fans share creative caption,HER
pump wedge shop shop,HER
firsthonda tim mings stumbled valuable pieces honda history means,HER
plug hybrid honda accord yep wait 2013 info,HER
new fall edition designer lingerie collection stunning pics sara sampaio barbara palvin shop,HER
hope today doodle fascinating,HER
celebrating week post clay predator pose gillette wall,HER
shop shop,HER
logan lerman prada fall winter 2012 collection perks wallflower premi toronto international film festival toronto canada september 2012,HER
managing linux servers discover oracle integrated solution linux lifecycle management live webcast wednesday september 12th 10 pacific register,HER
look new lego phone prototype service spotty 4g falls apart,HER
yay nay cruising aboard mark twain riverboat rivers america,HER
designed humans inspired nature,HER
disneyland halloween better way ready frighteningly fun gear treat disney parks blog,HER
gangnam intel style,HER
jack skellington taken haunted mansion create haunted mansion holiday discover goes magical makeover disney parks blog,HER
welcome official corporate page siemens facebook today page source interesting news siemens course great thing facebook looking forward interacting fans,HER
black new black shop,HER
prada doctor bag fashion weeks special edition new york london milano paris,HER
know 300 sculpted pumpkins main street alike discover frightening facts disneyland halloween disney parks blog,HER
tomorrow marks official opening crystal sustainable cities initiative siemens thecrystal org stay tuned mean check discover siemens tab guides siemens channels,HER
indie band monsters calling home music video hondas showed big dose love jimmy kimmel live watch surprise lifetime,HER
roland busch member managing board siemens ag ceo infrastructure cities sector crystal press conference city tight budget beloved customer bring solutions problems,HER
honda building new 2013 honda accord mind learned action,HER
looking bite eat disneyland restaurant typically head,HER
crystal heart starts beating official opening peter scher president ceo siemens ag boris johnson mayor london,HER
favorite shop,HER
new 2013 accord mind best way make car know people use,HER
fall autumn way,HER
space shuttle endeavour flew headquarters mountain view california great excuse step away desks grab cool photo,HER
ahoy like come aboard,HER
window gibson girl ice cream parlor changed original photo taken 1960 love nostalgia main street,HER
pose fans post clay predator pose gillette donate boys girls clubs america photo,HER
check fun video samsung mobile usa,HER
world fair security 2012 siemens demonstrates motto safe secure city infrastructure solutions create sustainable values people environment check siemens com security essen,HER
seeing people rocking sandals ballet flats booties boots today stepping shop,HER
soarin late week shared photos video space shuttle endeavour making historic flyover disneyland resort nasa photographers able capture sky,HER
round,HER
worry elephants trunks,HER
gamer brain,HER
celebrating google 14th anniversary delicious doodle,HER
best thing downtown disney district,HER
yay nay adding bit minnie mouse makes day better,HER
today day nationalcoffeeday,HER
knows make smile itsfallwhen,HER
increasing resource scarcity major nuclear accident japan onset global warming making clear world energy sustainable sustainable energy future require wide range measures measures fit perfectly like parts puzzle siemens offers develops siemens com future energy,HER
rihanna performing 2012 victoria secret fashion stay tuned announcements later morning forget tune watch tuesday december 10 9c cbs,HER
ready tweet storm justin bieber second musical guests 2012 vs fashion guest announced noon think,HER
musical guest bruno mars tune december 10 9c watch rihanna justin bieber bruno mars favorite angels cbs,HER
happiest place got spookier merrier times far disneyland holidays officially arrive november 12 2012 spirit disney parks blog,HER
yep charm rihanna justin bieber bruno mars musical guests 2012 victoria secret fashion wait,HER
amanda seyfried suit prada resort bag shoes prada fall winter 2012 collection miu miu spring summer 2013 fashion paris october 2012,HER
briar patch right way,HER
new accord orange auto starting today looking good,HER
passion,HER
spooky surprises await corner mickey halloween party favorite thing party eerie images disney parks blog,HER
true false stay fireworks,HER
introducing limited edition sexy seduction bra victoria secret seduction dark orchid fragrance shop seduction,HER
congratulations answered cover picture siemens headquarters building munich glad know,HER
hear hotel ups downs recommend drop experience,HER
honda official sponsor year acl check honda civic new honda accord year acl music festival,HER
candy makers plenty tricks sleeves halloween season discover oooey gooey ghoulish delights disneyland resort candy kitchens,HER
seduction secret 253 lingerie seriously fun shop seduction,HER
warm big cozy sweater,HER
staring contest blink pizza original,HER
today siemens celebrating 165th anniversary 1847 siemens halske telegraph construction company began doing business backyard workshop berlin check letterhead company,HER
prada levitate shoes available prada com prada stores,HER
holiday visit hundredth new experience holidays bringing disneyland park holiday disneyland park guided tour offered november 12 january pricing booking information 714 781 8687 tour learn disney parks blog,HER
happy boss day mob bosses count,HER
morning mickey pals helped unveil story ice castle heart times square new york city kicking limited magic 52 weeks magical surprises unexpected experiences disney parks 2013 true love long lost friends pirates villains discover extra sprinkles pixie dust await disney parks blog,HER
remembering honoring celebrating touched breast cancer,HER
wicked good treats disneyland halloween frightfully delectable dishes tried far discover ghoulishly fun favorites disney parks blog,HER
trick treat mickey pals disneyland halloween click link start filling bag treats forget invite friends available mobile,HER
noticed new cover picture country siemens headquarters,HER
yay nay spending downtown disney district visiting disneyland resort,HER
ikea teaming oprah bring year oyou conference helping live best life better place start home tell oprah com improved life home chance win 500 ikea gift cards oprah com ikeaoyoucontest,HER
happy birthday candice,HER
robbie williams prada fall winter 2012 collection tv factor milan italy october 18 2012,HER
seduction secret 204 lingerie goes comes day choose styles make feel amazing shop seduction,HER
siemens sponsoring world energy forum 2012 taking place dubai motto safe accessible sustainable energy check link info,HER
wonder employees use phrase proud siemens competition share siemens stories like congratulate winners china colombia denmark egypt france germany malaysia siemens proud,HER
hp windows launch guide,HER
know tinker bell flying disneyland park fireworks 1961 pixie hollow home fairy friends day 2008,HER
coffee lovers,HER
introducing ultrabook convertible laptop tablet smart little looker,HER
seduction secret 58 apologize want shop seduction,HER
innovation stops,HER
best disneyland halloween,HER
secret rewards better angels share early access friend stores store,HER
thumbs wondering halloween candy bought days ago went,HER
tech god introducing ultrabook convertible laptop tablet epic,HER
pumpkin sculptors creating works art halloween carnival big thunder ranch jamboree disney parks blog,HER
hi everybody,HER
kylie minogue carrying prada bag fall winter 2012 collection,HER
dressing honda halloween elena fit sports devilish look going trunk treating tips decorate honda,HER
push fantasies new angel fantasies,HER
unleash superpower,HER
sexy scary,HER
months left 2012 joining year,HER
oppan lego style,HER
geek chic,HER
combine disney parks photographers various styles backgrounds brand new tumblr account peek looking glass,HER
01010111 01101000 01100001 01110100 00100000 01101001 01110011 00100000 01111001 01101111 01110101 01110010 00100000 01100110 01100001 01110110 01101111 01110010 01101001 01110100 01100101 00100000 01100110 01100101 01100001 01110100 01110101 01110010 01100101 00100000 01101111 01101110 00100000 01110100 01101000 01100101 00100000 01010101 01101100 01110100 01110010 01100001 01100010 01101111 01101111 01101011 00111111,HER
yay nay acting little goofy mickey toontown,HER
checked new arrivals designer collection shop,HER
dead men tell tales,HER
meet samsung ativ smart pc pro powered 3rd gen intel core i5 processor sneak peek new samsung smart pc series notebook pc series ultratouch notebook,HER
garrett hedlund prada fall winter 2012 collection road premi los angeles november 2012,HER
du juan prada vogue china charity gala dinner beijing october 30 2012,HER
2012 marks 140th anniversary siemens china celebrate proud moment siemens anniversary stamp album born telling story century long cooperation siemens china 1872 year siemens delivered pointer telegraph china marking beginning china tele industry today siemens 30 000 staff members 16 centers 65 operating companies 65 regional offices china,HER
let wish lists begin toy catalog ready bookmarking highlighting dog earing,HER
yay nay going spin disneyland resort,HER
pup gives st jude purchase good boy store online,HER
intel,HER
today siemens held annual press conference berlin ceo peter scher talked earnings fiscal year 2012 outlook year comprehensive information press conference visit,HER
enter chance set filming amazing spider man movie enter daily amazing spider man sweepstakes,HER
wait black friday sharing deals early,HER
ready glow snow disneyland park beginning november 12 believe holiday magic fireworks spectacular wear glow ears learn disney parks blog,HER
black friday dealicious goodness,HER
happiest place got merrier mater ringing disneyland holidays january joining watch video,HER
meet samsung ativ smart pc pro powered 3rd gen intel core i5 processor sneak peek new samsung smart pc series notebook pc series ultratouch notebook,HER
thankful fans giving away 25 target giftcards day enter daily chance win,HER
beware haunted mansion holiday fright dreadful delight survive holidays,HER
lace right places shop angel fantasies,HER
check ricki lee sam sparro collaboration thanks galaxy note ii guys think,HER
doutzen favorite section fashion dangerous liaisons tune december tell,HER
 ,HER
happy birthday lily,HER
disneyland holidays,HER
like oracle facebook,HER
smooth blingy lacy blingy angel fantasies bra fave shop angel fantasies,HER
ultrabook light fly away,HER
day 1993 partners statue walt disney mickey mouse joining hands dedicated disneyland park taken picture nostalgic icon,HER
happy birthday lindsay,HER
love gift giving giving away 25 target giftcards day 11 21 enter daily chance win,HER
calendar girls lindsay favorite fashion theme tune december tell,HER
beat rush sale start saving,HER
know pictures future magazine research innovation key technology trends scenarios future features reports interviews internationally recognized experts latest edition released includes story mars rover landing,HER
favorite black friday deals buy ipad 60 target giftcard gift little win win excludes ipad mini,HER
flipping bad thing dell xps 12 king backflip,HER
yay nay having disneyland day,HER
thankful,HER
giving thanks 20 million sexiest awesome est fans facebook enjoy holiday,HER
happy thanksgiving fans,HER
photos magic touch adobe photoshop comes galaxy note 10 like,HER
disney souvenir want holiday season,HER
true false holiday season favorite year visit disneyland resort,HER
exactly month away christmas celebrating,HER
select nights come pool deck stay disney paradise pier hotel special viewing disneyland fireworks including piped music,HER
discover siemens wind power new perspective explore innovative machinery scenes learn people make technology possible look latest siemens 360 siemens com innovation siemens360 wind power,HER
day 1997 small world received holiday overlay seeing lights brightens day,HER
looks like red elf shelf busy decorating holiday section night elf,HER
love experience disneyland holidays best friend share picture let know,HER
eye honda civic updates la auto tomorrow including fresh photos 2013 civic lineup,HER
siemens awarded germany highest honor technology innovation german future prize year recipients congratulated personally president joachim gauck yesterday ceremony research team led dr torsten niederdr nk collaboration university oldenburg developed called binaural hearing enables hearing aids ears communicate read siemens com press futureprize2012,HER
highly anticipated 2014 honda accord plug sale january starting tomorrow la auto december 9th sneak peek innovative features,HER
great things come small packages dell inspiron 15z ultrabook,HER
thumbs excited target neiman marcus launch tomorrow,HER
light,HER
happy target neiman marcus launch day blank item wishlist,HER
target neiman marcus collection arrived item favorite,HER
cruise route 66 celebrate disneyland holidays cars land,HER
revealing new gift day 12 24 day giving gift away fans head dream big win bigger app ticket chance win,HER
doha tornado tower landmark example efficient siemens total building solution lit green using energy efficient led lights duration cop18,HER
santa mrs claus trip north pole host jingle jangle jamboree big thunder ranch,HER
distinctly unique like,HER
like creative everyday samsung galaxy note ii,HER
know follow computer tablet smartphone exclusive deets runway look stream runway insider tonight,HER
true false daytime nice nighttime disneyland holidays come life,HER
watch creative everyday galaxy note ii,HER
happy birthday walt disney,HER
favorite thing vs fashion,HER
thumbs loving disneyland holidays,HER
tease season shop,HER
remember earlier post proud siemens competition yesterday peter scher president ceo siemens ag met personally congratulated winners dedicating facebook page week stories stay tuned,HER
far given away furbies beats dr dre headphones nintendo 3ds giveaways better oh yes,HER
share love spend 50 10 giftcard tomorrow quantities limited follow link print coupon limited quantities available limit friends fans coupon guest transaction valid store offer valid previous purchases void copied scanned transferred purchased sold prohibited law giftcards tax included determining purchase total free giftcard valid payment purchase terms conditions apply giftcards rain checks maximum retail value 10 free giftcard cash value,HER
dreams come true,HER
silent night likely shop,HER
yay nay new orleans square trading colorful mardi gras beads christmas ornaments,HER
shake things holiday,HER
hundreds australians joined siemens cadel evans futuride project break guinness world record electrical energy generated pedalling bicycles hour event working team make difference,HER
vs fashion airs tomorrow cw tune 9pm est,HER
friends fans offer gone spend 50 10 giftcard follow link print coupon limited quantities available limit friends fans coupon guest transaction valid store offer valid previous purchases void copied scanned transferred purchased sold prohibited law giftcards tax included determining purchase total free giftcard valid payment purchase terms conditions apply giftcards rain checks maximum retail value 10 free giftcard cash value,HER
awesome converse holiday decorations creative people old truman brewery london,HER
favorite gift giver little 50 giftcard purchase ipad excludes ipad mini,HER
tonight 9pm est catch encore performance 2012 vs fashion cw,HER
today werner von siemens birthday born dec 13 1816 lenthe near hannover germany today pioneering spirit ingenious inventor defines corporate culture siemens,HER
bell rings shop,HER
elevate af1 lf1 icon reborn hyperfuse lunarlon force future,HER
coal shop,HER
deck halls pin boards holidays hope new pinterest holiday board inspires holiday cheer,HER
congratulations 12 particularly successful research development employees honored inventor year patents totaling 734 laid foundation products example medical diagnostics improved industrial manufacturing power generation efficient flexible outstanding men women inventions siemens com press inventors2012,HER
celebrate unconventional ladies gifts,HER
continue prepare year destination cars land float look 75 year tradition disney involvement annual rose parade disney parks blog,HER
introducing new burberry spring summer 2013 campaign featuring romeo beckham,HER
better getting 16gb ipod touch getting free 50 target giftcard store,HER
000 hours million bricks later lego life sized model bag end,HER
fa la la la lingerie shop,HER
unwrap special holiday season intel,HER
romeo beckham set spring summer 2013 campaign shoot burberry chief creative officer christopher bailey,HER
forget men gifts,HER
red went galaxy far far away bring 20 lego star wars sets week,HER
home indoor winter wonderland like dreaming white christmas,HER
questions ask bmw experts bmw vehicles shown naias 2013 detroit ask commenting horatio boeriu bmw blog answers soon gates autoshow start opening,HER
ticking away chance enter win dream big win bigger sweepstakes enter 12 24 2pm cst,HER
snowman,HER
relax enjoy moment,HER
bring holiday cheer save 50 storewide minute sale,HER
tomorrow marks long predicted mayan apocalypse want thank fans great run,HER
like wish fans great weekend happy holiday season thank understanding actively posting facebook 22nd december till 6th january able inquiries office families soon enjoy families friends,HER
chuck taylor city collection launches today collaboration shoe biz sf sale proceeds youth poverty compass family services purchase limited edition online,HER
ultrabook sneaky centerpiece,HER
marching toy soldiers santa claus far,HER
plan seize days week check great day offers,HER
santa claus way red hot sporty sleigh coming soon bmw,HER
decorate honda holidays maybe decorate tree honda trimmings like hunter,HER
burberry festive gifts adorn london skyline night christmas,HER
merry christmas spending today,HER
burberry wishes facebook fans merry christmas,HER
honda wishes happy holidays seeing snow like fornells,HER
merry christmas happy holidays family eat lots fun,HER
merry christmas happy holidays family,HER
like celebrating holidays lil stunt bike session jason britton,HER
introducing saint alfred converse pro leather shown grey available black stalfred com,HER
favorite disneyland memory 2012,HER
