forza motorsport partnered mclaren legendary stunt driver tanner foust create filmspeed blisteringly fast zoetrope based short film featuring scenes forza motorsport watch,LER
classic 1962 introduction fit features button flap chest pockets welt pockets tabs adjust fit view famous trucker jacket,LER
liquid shaping technology perfect fit revolution shaping jeans know levi revel,LER
live jeans summer try chinos cargo short styles including trend army camouflage cheeky floral closest levi store,LER
worried going make people holidaying mars worry scientists making 80 new 20,LER
traveling america station station equipped camera video camera typewriter guitar hacked post directly web learn tools collaborate creative pioneers board using makeourmark watch,LER
spring eyes told want celebrate away neutrals fun read beauty beautifool worked colour riche quads palette,LER
big data improving efficiencies australian oil gas industry right,LER
sale ends today priceline australia miss,LER
big apple calling pick exclusive woolworths australia fresh food people,LER
everpure eversleek everstrong hair expertise product right discover benefits 100 sulphate free haircare chance win samples,LER
match blend clash try colour genius app,LER
christophe robin colour designer al paris shares 10 tips colouring hair,LER
left holding cup footyfinals,LER
guess scored stars bb beautiful blush,LER
manimonday le vernis nailicious shows bright summer mosaic nails,LER
got hands elle australia check al paris ambassador megan gale models year hottest spring racing styles magazine issue,LER
ibm expands cloud portfolio acquisition leading cloud computing infrastructure provider softlayer,LER
pulled artwork sony music entertainment rich music archives limited edition collection tees featuring original graphics american sound closer look range,LER
need help charting path achieve business goals cloud contact ibm,LER
official invite catch pepsi max crew fpr pit crew inside new mobile pits inaugural outing deni ute muster check deets,LER
need advice al paris hair colour product best needs hair colour diagnosis,LER
cut wear 501 short later view shorts,LER
lads popular straight fits closer look,LER
best tip girl saturday night,LER
hate leaving lipstick stains lid morning coffee read maiden blog recommends avoid,LER
radiant skin equals glamour instant favourites glowing,LER
wishing youngest member al paris family barbara palvin happy birthday today,LER
founding 2005 softlayer singular vision facto platform internet ibm company softlayer closer goal video softlayer cmo simon west discusses company journey bright future ahead ibm,LER
lighter look possible cloud computing systems dynamic smarter,LER
guess won priceline australia pinky award favourite moisturiser shop,LER
levi revel line designed shape enhance help women look feel best everyday patent pending liquid shaping technology learn,LER
cost reduction ibm director cloud business justin gatlin technology bigger concern article zdnet,LER
check easy liquid eyeliner tutorial tips perfect daytime nightime looks,LER
shirts man opinion western crew cut pocket tees pocket oxford workwear shirts view tees view shirts,LER
planning spend 85 minutes,LER
use chromatic wheel discover nude magique cc cream best,LER
need make inspiration week ahead got sorted,LER
like feeling massive props mark winterbottom steven richards,LER
wait smartcloud live begun melbourne follow hashtag smartcloudlive twitter bring live updates event today agenda,LER
dating 19th century military wear casual trouser reinforced lightweight sturdy cotton canvas ample room seat thigh delivering far expected view levi chino,LER
want fresh nourished skin easy,LER
proud announce exceptional lara stone newest member join al paris family,LER
summer split ends gone ask australian women answer,LER
sydney spotlight study shows airbnb supports 200 million economic activity city,LER
disruptive technology changing way build cure power australia future follow atwork2013 twitter 8am tomorrow discussions industry leaders,LER
guess winners best lipstick best hair treatment,LER
bud browne created surf films capturing birth big wave surfing short board evolution grass roots pioneer spirit tackled craft led inspired industry check levi bud browne tees,LER
denim style classic blues modern washes straight skinny cuts help signature fit favorite fit,LER
vogue vandal loves pr rence wild ombr kit watch achieved beautiful results,LER
levi commuter line remains wholly functional smart streamlined cuts nod classic modernism view range,LER
google cars 30 seconds tech adam creighton work 2013,LER
marry dude picture going buy pair chinos wearing seriously love closer look chinos,LER
reals love shirtdress stone red perfect coming weather removable jabot fancy sound closer look,LER
profiting change turning disruption opportunity panel today investigating business strategies eraofsmart,LER
getting ready business spectator event today sydney ensure australia competitiveness new eraofsmart join conversation,LER
trends new eraofsmart join conversation,LER
ensure australia competitiveness eraofsmart,LER
tonal diamond shaped stitching pocket shirt subtle effective definitely gents closer look,LER
check customisable dashboard called nimbus things nimbus monitor commute traffic calendar appointments weather social media activity invented ryan pendleton quirky com conjunction ge,LER
confused cc creams best beauty blog explains,LER
discover perfect jean minute curve id quiz shape,LER
new victorian inspired trend fuses austerity femininity jabot collars flutter sleeves pleats pieces designed make look effortlessly elegant dress shirts,LER
bright summer nails,LER
space food 3d printed pizza sans fresh ingredients corner,LER
lovely sarah bono music voice australia mcdonald parramatta north 12pm 2pm today support mchappy day final chance create virtual helping hand amex donating rmhc behalf clicking,LER
look real fun heart meet 36ers basketball team mcdonald frewville cross roads collinswood west beach 11 30am 2pm today support mchappy day,LER
aussie olympic hero cameron mcevoy mcdonald cavill iii 30pm 30pm today support mchappy day,LER
learn smart infrastructure ibmer catherine caruana mcmanus new australia adjusting ceda report,LER
smooth efficient fun welcome mobile airbnb available ios android airbnbopen,LER
ibm invents green power technology cloud computing service providers,LER
missed tickets ashes brisbane come dressed green gold clayfield kfc 5am 8am chance win tickets seen tv thanks crew today,LER
nyc friends registration open creative workshops taking place weekend converse rubber tracks brooklyn sign,LER
summeressentials perfect sun kissed look choose bronzer shades darker natural skin tone,LER
want track pepsi max crew grab pepsi max products head,LER
nyc sign free creative workshops taking place weekend converse rubber tracks brooklyn register,LER
watch new ambassador blake lively visits oreal paris labs paris officially introduced world media,LER
congratulations australian women weekly winner cell renewal competition zophie qld entry spoil mum 000 cash won major prize enjoy blissful cell renewing vacation,LER
accessorise weekend outfit simple red lip high impact results,LER
xo,LER
summer woohoo look grabs single day,LER
inspired lighten look summer,LER
nyc registration open consproject weekend converse rubber tracks come hangout,LER
kfc hindley bucketheads come green gold bucket support aussies day adelaide ashes test,LER
nyc registration consproject ends soon sign free workshops converse rubber tracks,LER
store performance today converse newbury store boston featuring boy toy,LER
skin tone changing come summer nude magique cc creams help correct complexion,LER
store performance today converse garden state plaza store featuring dj pq,LER
store performance today converse newbury store boston featuring dj bud green,LER
2013 came wire ready 2014,LER
like win oreal paris infallible lipstick pack valued 415 day left enter amazing competition priceline australia enter,LER
levisskateboarding south africa worked local riders builders revitalize skatepark johannesburg suburb edenvale check video,LER
kfc big bash fan cos giving awesome cricket fans opportunity claim free tickets mates local derby friday night quick bucketheads ready claim,LER
store performance today converse newbury store boston featuring viva viva,LER
store performance today converse soho store nyc featuring workout,LER
store performance today converse santa monica store featuring grmln,LER
kfc big bash season coming got tickets person giveaway hit mates bucketheads awesome night click claim,LER
favourite afl players used getting hands dirty field annual directors delegates conference week keeping bodies clean al men expert product favourite player need,LER
follow levi commuter fix cities cycling style check,LER
exciting event alert sleep,LER
levi 501 short embroidered embellished said view icon,LER
introducing new oreal paris skin genius app iphone revolutionary app analyse skin provide analysis recommend perfect solution best free download,LER
beauty important cause view pics al paris lip bar 2013 ocrf gala night earlier month,LER
work christmas afl players giving chance win perfect present years supply al paris men expert products enter,LER
decide tastes best naturally sugar pepsi sugar coke come following locations let taste decide 30 sugar regular pepsi sweetened naturally stevia,LER
decide tastes best naturally sugar pepsi sugar coke come following locations let taste decide 30 sugar regular pepsi sweetened naturally stevia,LER
decide tastes best naturally sugar pepsi sugar coke come following locations let taste decide 30 sugar regular pepsi sweetened naturally stevia,LER
renowned illustrator waldo longo artists recently invited levi join train journey expand borders art stationtostation join makeyourmark,LER
decide tastes best naturally sugar pepsi sugar coke come following locations let taste decide 30 sugar regular pepsi sweetened naturally stevia,LER
scenes years afl players delegates conference brought al paris men expert,LER
forget,LER
looking achieve volume curls tonight answer,LER
manimonday festive fingertips,LER
levi,LER
late perfect gift man al paris men expert packs available priceline chemist selected pharmacies december 2013 packs vary retailer,LER
discovered levi revel liquid shaping technology perfect fit revolution shaping jeans learn,LER
myer stocktake sale starts today nearest store al paris goodies stocking,LER
pepsi taste challenge team elbow deep boxing day sales today road tomorrow ultimate taste challenge following hot spots,LER
pepsi taste challenge team elbow deep boxing day sales today road tomorrow ultimate taste challenge following hot spots,LER
skylanders swap force starter kit,LER
looking xx solving global labour shortages requires closing gender gap,LER
managing editor drop dead gorgeous daily kate mckibbon gives verdict infallible step read,LER
2013 drawing end summer truly going road tripping celebrate share ultimate road trip destination,LER
beauty resolution 2014,LER
turning heat kfc big bash sending 100 bucketheads gabba 11th jan crew claim tickets got 20 tickets giveaway,LER
new year resolutions hitting road asking australians pepsi taste challenge head following,LER
new year resolutions hitting road asking australians pepsi taste challenge head following locations let taste decide,LER
new year resolutions hitting road asking australians pepsi taste challenge head following locations let taste decide,LER
niel scored 100 uber credits finding positives england disastrous campaign question pomms consistency artofsledge ashes,LER
fun levi 2014,LER
airbnb newbie book trip enjoy night valid jan 13 17 min nights click details onenightairbnb,LER
takes return serve bernard tomic rafa nadal chance visit ibmreturnserve face live serve seconds takes place centre court,LER
denim denim straight jeans stick contrasting shades day elevate look night fitted trucker view straight jeans,LER
ready return lightning bolt australian sam stosur visit ibmreturnserve face live serve round matchup tsvetana pironkova australian open,LER
rafa nadal talked player twitter ausopen far 166k mentions stay social leaderboard,LER
thanks marie claire australia thrilled selected finalists 2014 prix marie claire beauty awards love favourite oreal paris products vote,LER
going post holiday blues coffee stat,LER
serena williams sam stosur novak djokovic play round matches today visit ibm slam tracker gain additional insight pros performing,LER
happy friday girls,LER
keen night watching local derby unfold kfc big bash got tickets grabs watch sydney thunder vs sydney sixers saturday 25th january quick won,LER
fastest serve tournament far belongs aussie sam growth 234km fastest serve managed using ibm return serve,LER
forget photos tennis today tag uberozopen win daily uber credits details,LER
make melbourne australian open head westfield pitt street mall sydney experience ibm returnserve virtual reality installation face live serve pros,LER
surprised check pics weekend challenges,LER
vest rest closer look,LER
ana ivanovic david ferrer novak djokovic play quarterfinal matches australian open today visit ibmreturnserve face live serve moments takes place centre court,LER
love al paris revitalift laser x3 anti ageing power moisturiser vote 2014 prix marie claire beauty awards,LER
try return live serve today women quarterfinal australian open match agnieszka radwanska victoria azarenka using ibmreturnserve,LER
skinny slim straight relaxed lads perfect fit,LER
sweltering cool stay stylish sleek summer,LER
lina bouchard match stats happen slamtracker bit 1amwxgv ausopen,LER
lina takes bouchard semis stats slamtracker,LER
na li grand finals smashed return serve points key ibmslamtracker datagram ibm,LER
looking smart alternative old school trouser tip darker blues grey black denim washes night ready needs view dark jeans,LER
live al paris excess volume million lashes cast vote favourite mascara 2014 prix marie claire beauty awards,LER
airbnb selby unique documentation hosts homes cities lives sydney tokyo paris london la,LER
thanks theyallhateus including true match touche magique make kits tash kit,LER
fellas imagined camouflage modern landscape sounds wanky looks amazing view range,LER
pre grammy event week la miguel rockin white 511,LER
fan al paris pr rence wild ombr hair colour let world know voting 2014 prix marie claire beauty awards,LER
hollywood glam sultry rock rock chick beyonce grammy looks favourite,LER
scenes sneak peek beautiful megan gale set latest commercial bts,LER
got secret special coming vamff year wait tell,LER
classic trucker white tee pair 501 comfort factor 10 10 hotness factor 11 10 view men icons,LER
looking future innovation make jump joy,LER
year levisskateboarding worked local riders builders revitalise skatepark johannesburg suburb edenvale check video,LER
read eva longoria trip melbourne month,LER
congratulations yesterday launch check pics ubermnllaunch spread word,LER
trucker styling tip wear open sleeves rolled pair shorts canvas sneaks equipped cuff activities view truckers,LER
join valentine day taste challenges fri 14th watergardens,LER
valentine year woo honey holiday built enchanting getaways,LER
510 511 508 513 know fit check slim fit guide compare slim fits,LER
valentine day plans undoing button jeans eating ice cream humanly possible,LER
pepsi pleased meet itunesradio australia decide station listen let taste decide,LER
pleased nominated beauty heaven glosscar awards cast vote,LER
want host learn secrets hospitality,LER
follow pinterest pinterest com nutellaanz,LER
make splash vibrant reds lips fingertips look,LER
celebrating double win kfc going sky high snacking kfc win win check howdoyoukfc,LER
nellie wearing crewneck fleece oil blue pair boyfriend skinnys loves view look,LER
excitement building gok makeover reveal wait work magic oreal paris favourites,LER
loving chic eva hairstyle look,LER
join chadstone today watch fabulously talented gok wan work makeover magic oreal paris favourites,LER
enjoyment bonus nominee georgia loves round golf win dream golf experience voting enjoymentbonus,LER
slim fit guide 510 skinny slimmest skinny range built fit snug waist ankle best slight medium builds view 510 skinny,LER
watch short video university south australia unleashed brainpower 8000 jammers transform strategy powered ibm ibmclientvoices,LER
let continue forward battle equality celebrate love happy safe mardi gras loveislove,LER
best dressed awards jennifer lawrence amy adams letyourtastedecide,LER
think ibm purely computer hardware company years steadily building broad portfolio software services read moving rethinkibm,LER
yesterday boys calling cars performed live stream music feeds decked head levi looking ridiculously good looking sound amazing check video,LER
wanted coachella chance april enter grab pepsi max independent supermarket head,LER
trucker styling tip easy layer sheer tank ankle skinnies choice accessories view truckers,LER
set aside family cup nescaf,LER
plans march celebrate international women day marie claire australia head twitter tweet wishes women womenswishes,LER
bright red hot trend oscar season look doutzen,LER
newest skate collection familiar,LER
ready send wishes twitter women tomorrow tweet wish,LER
celebrate international women day today marie claire australia head twitter tweet wish women womenswishes,LER
happy international women day ambassadors share wishes women,LER
feeling snow bleached blues loving view pocket shirt,LER
play pharrell williams happy john legend love future letyourtatedecide,LER
allover laser dot print clay shirt adds fresh feel lightweight chambray shirt throw throw stay cool way closer look,LER
want livefornow plane 30 days coachella details,LER
festival flashback bold eyes bold lips,LER
limited spots available mum exclusive workshop sydney hosted australian women women tomorrow night trial benefits oreal paris extraordinary oil expressions email kwalker,LER
layer trucker jacket crisp white button casual tee handsome cuff look adorable puppy optional view range,LER
2014 destinations plus experts missed,LER
hot looks hit runway week,LER
date live coverage vamff taking row backstage,LER
snapshot runway highlights rose hues sleek ponytails beauty trends,LER
know stylehunter com online fashion partner vamff visit runway action,LER
highlights easton pearson aurelio costarella thurley hardwick marianna hardwick beautiful looks complimented subtle winged eye berry stain lips favourite night,LER
great way start day check francesco mugnai blog,LER
yesterday celebrated vamff best way knew holding killer party calling cars perform insane denim installation drank brooklyn beer heads handle thanks came helped make night soon forgetting,LER
backstage fashion festival going look amazing runway,LER
oreal paris watch latest winged eye tutorial elsa morgan using google glass,LER
golden eyes ruby lips strutted runway tonight designers featured sass bide alex perry ellery,LER
runway reveal,LER
close look label levisskateboarding crew neck sweatshirt comfort durability like learn levi com skateboarding,LER
night attended national graduate showcase presented target upcoming designers unveiled looks plenty neutral tones structure unique knits beauty trend flawless face gold statement brows favourite new designer,LER
insight like make director elsa morgan steps winged eye look using google glass,LER
questions ready special guest joining facebook tomorrow,LER
using handloom likes ancient instrument jay palmer weaves compositions scraps denim unique harmony discord view 511 slim fits,LER
eva enjoy read,LER
excuse pick jaw floor micah gianneli turned impressive levi looks seen season view post,LER
case missed australian jumped right future vamff exploring create better tutorials using google glass check googleglass throughglass,LER
love customers share success stories story makes proud qantas freight transformed customer experience power mobile check ibmclientvoices,LER
thank voted theazeraproject theme input fantastic results theme chose evolution excited designers start work monday like make,LER
orange pearl mani colour choosing today,LER
exciting news start week al paris gorgeous new spokesperson welcome zoe saldana,LER
ibm making positive impact natural resources sector check ibmoilandgas website,LER
hey peeps excited presenting upcoming viva prahran skateboard competition awesome skating crap load giveaways click info,LER
aussie startup global leader hotelscombined takes world softlayer cloud ibm cloud softlayer,LER
tasteful functional genuine follow jacob progress support uncomplicated craftsman battles designers weeks make fifty coffee plungers new extraordinary stay tuned theazeraproject amazing piece going create,LER
launch party oreal paris saturday,LER
inside macca 30am enjoymentbonus,LER
triple denim kinda day levis tripledenim newyork levistruckerjacket icons theoriginaldenimjacket,LER
visit al lip cart 6am complimentary lip consultation free nail polish,LER
thinking weekend ahead plans mondayitis getaway levis,LER
501 original iconic jean wear low slung casual belted high instant hourglass levis theoriginaljean denim,LER
loving 1970 inspired levi tee seen lorde la weeks levis orangetab lvc,LER
rain rain getting ready saturday viva prahran skate comp melbourne dust deck head prahran skate park registration 11am got loads awesome prizes giveaways check site info,LER
knows friday levis theweekend music theoriginaljean,LER
world class hair colour expert christophe robin hitting shores week,LER
sun skaters happening prahran skate park levi presents viva prahran skate competition,LER
mini vert ramp action levisskateboardingcollection vivaprahran2014,LER
levi presents viva prahran skate competition went saturday australia best skaters way prahran skate park huge congrats winner comp cameron stanley check action day,LER
free consultations beauty consultants 25 make opportunity missed visit al paris pop store doncaster westfield directions,LER
1951 bing crosby denied entrance hotel wearing jeans design team quickly created custom denim tuxedo bing problems wearing levi year levi vintage clothing reproduced limited edition run tuxedo celebrate moment history learn levisvintageclothing com,LER
waratahs rugby team predicting player injuries data injuries unavoidable reality sports data driven teams prevent competitive advantage discover madewithibm,LER
tonight christophe robin helped launch new range colours preference including intense copper striking elegant think,LER
seen interactive video starring 2014 futbolnow lineup make,LER
solange decks night annual hausofstrauss party went levis partytime,LER
let hard work sleep,LER
commute work morning better levis commuter rest easy weekend near longweekend,LER
coffee art hump day love adding special image credit,LER
levi story australia new zealand 40 years stories told levis originaldenim shareyourstory,LER
announced today splendour line levi action year stay tuned details line,LER
hair colour signature want julianne moore,LER
come join doncaster westfield exclusive pop store receive great discount 25 make hope directions,LER
al paris proud partners ocrf year supporting friends witchery help save lives buy white shirt 100 gross proceeds ocrf fund early detection test ovarian cancer shop,LER
looking littlebitfancy fancy ways started,LER
official shop things fpr facebook page make sure like fpr store latest things happening race centre track news team merchandise memorabilia cool things favourite team,LER
eau teint foundation glides,LER
rad piece going custom levi trucker jacket coming months working hand picked creatives customise levi stay tuned,LER
rocking berry lip stain play eyes try wing flick,LER
hollywood glam red carpet glitz hit french riveria festival cannes coming soon excited,LER
looking impress mates littlebitfancy words add vocabulary,LER
latest issue harper bazaar featuring blonde salad blogger chiara ferragni talking love levi levis,LER
festival flashback glimpse backstage cannes,LER
simply elegant stylish look,LER
saturday night rock levis zanita collab,LER
wishing mums world happy mother day know worth,LER
celebrating ages levi levisxzanita visit zanita com au blog levis history iconsinicons,LER
matte rich smooth tried,LER
red carpet whirlwind begun join coverage glitz glamour festival cannes,LER
fabulous jane fonda look look cannes2014,LER
blake lively wrong red carpet lately style flawless,LER
nail bling,LER
sunday skate levisskateboarding check website cool info,LER
getting super pumped splendour grass 2014 year small mall awesome activation details come started finished levis,LER
step scenes cannes ambassadors eva longoria freida pinto,LER
relate make working5to9 moment,LER
wear levi mr brainwash,LER
zanita levi modern classic check,LER
weekend customise levi tag levi customised levi,LER
special red carpet moment al paris beautiful chloe morello joined al paris red carpet debut cannes,LER
festival cannes come end whirlwind red carpet events premiers photo shoots glamorous dress ups al paris ambassadors world,LER
funny man wil anderson rocking levi,LER
ibm heart city installation using real data able determine 7pm busiest,LER
know instagram follow latest greatest ibm vividsydney snaps heartofthecity,LER
cognitive computing brought light dr robert morris vp ibm labs vividideas vivid,LER
disruptive transformational power technology surrounding big data lucy turnbull today ibm ideas exchange event,LER
running play pop play game think beat current scores head midnight 31 click terms conditions,LER
truckload vintage patches arrived like levis customised patches,LER
weekend countdown begins got mani planned,LER
