***Facebook EXCLUSIVE Monster Giveaway***   Leave a comment below and in the next hour  we will be picking a random winner.The winner will recieve an EXCLUSIVE Athlete only hat OR an athlete only tshirt (Winner will choose). Let the comments flow =D [The more you comment  the more chances you have to win],HER,status
Unveiled Windows 1.0 at Comdex. - The Windows page of the Fall Comdex 1983 Microsoft marketing handout.,LER,photo
Celebrated 10th anniversary. - Poster commemorating Microsoft’s 10th Anniversary. Artwork by James Dietz.,LER,photo
Shipped the first CD-ROM application  Microsoft Bookshelf. - Carl Stork demonstrating Microsoft Bookshelf 1.0  ca. September 1987. Bookshelf included ten popular reference tools all on one CD-ROM  including The American Heritage Dictionary  The World Almanac and Book of Facts  Bartlett’s Familiar Quotations  The Chicago Manual of Style  and Roget’s Electronic Thesaurus.,LER,photo
Released Office for Windows. - Office for Windows  ca. 1990.,LER,photo
Released Windows 3.1 - Federal Express truck filled with copies of Microsoft Windows 3.1  ca. April 1992.,LER,photo
Released Windows 95. - Bill Gates on stage at the Windows 95 Launch  held on the Redmond campus  August 24  1995. Introduced in Windows 95  the Start button was a major focus of the launch marketing campaign - Microsoft's most extensive to that point.,LER,photo
Unleashed Clippy  the Microsoft Office assistant  to an unsuspecting world via Office 1997. - "Clipit " better known as "Clippy " one of the on-screen Office Assistants introduced in Microsoft Office 97 using technology originally developed for Microsoft Bob.,LER,photo
Windows XP launched at the Marriott Marquis Theatre in the heart of New York City. - New York Mayor Rudolph Giuliani applauds the launch of Windows XP with Bill Gates  October 25  2001.,LER,photo
Xbox LIVE launched. - Advertisement for Xbox Live  launched November 15  2002 - one year after the launch of the original Xbox.,LER,photo
Launched Xbox 360. - The Xbox 360: Zero Hour launch event  November 22  2005. 3 500 gamers from around the world engaged in more than 24 hours of Xbox 360 gameplay and had the chance to buy the new machine  games  and peripherals at the exclusive launch party held in California's Mojave Desert.,LER,photo
Microsoft Surface announced. - Microsoft Surface in action at AT&T— customers review features of a mobile device by simply placing it on Surface  which recognizes the device and provide a graphical overview of its capabilities.,LER,photo
We’re excited you joined us for the kick off of adidas Originals on Facebook!  Throughout the spring this page will be the home for many more films and widgets so keep checking back with us as we update.  As for now  don’t miss our article on “Young Superstars” in Complex magazine and more about Adi Dassler at his microsite on www.adidas.com.  Thanks for being an adidas fan! ,LER,status
take a look at the blog which is celebrating our 25th anniversary of the Forum collection.  The future of the Forum Lo:  http://www.complex.com/blogs/2008/04/01/adidas-25th-anniversary-forum-lo-collection/,LER,status
we would love to see your adidas Originals and will be checking the fan photos in the meantime...,LER,status
To launch the Puffer Red's ed. 25th Anniversary of the Forum  we partnered with Complex magazine on an in-store retail event to launch their limited edition collaboration Forum.  They were one of 4 retailers who were selected as limited edition partners because they've carried adidas 25 years-since the launch of the Forum.  The other retailers were Moe's (Queens  NY)  Walter's (Atlanta)  and Harput's (San Francisco).  WJLB radio promoted the event  which was hosted by WJLB DJ Bushman with Mo Beatz on the decks.  Chauncey Billups made an appearance and signed some product to give away via a series of Piston's trivia questions.  In addition   Day 26 from MTV's "Making the Band" stopped in as well.,LER,video
hey  check out the NEW adidas Originals page: http://www.facebook.com/adidasoriginals AWESOME!,LER,status
the music in the Adi Dassler film is by a mix of artists including Crazy Baldhead  DJ 360  Seventeen Years  Ratatat  and The Virgins.  Happy to hear you are all enjoying it!,LER,status
Here is a link to our adidas online store which should help.  Hope this is what you were looking for.  http://www.shopadidas.com/product/index.jsp?productId=2870376&shopGroup=R&cp&keywords=instinct&y=0&searchId=26554950253&x=0&parentPage=search&colorId=,LER,status
adidas would like to thank Lassi Lankinen for her question on April 22nd regarding overseas credit cards with online shopping at www.shopadidas.com  it is very helpful for our future development.  We apologize but unfortunately our ordering system that we use automatically cancels orders placed with foreign credit cards and shipping or billing address based out of the US. Your order took a little longer to trigger cancellation due to the fact your requested shipping address was based in the United States.  We are working on solutions that will allow broader secure credit card acceptance in the future. Thank you again for sharing your suggestions.,LER,status
Check out the new 'Superstar Magic' film on the globe! Click "view featured films" and let us know what you think. While you're at it download the two free ringtones.,LER,status
Thanks Beau. Better than bon bons? Peg Bundy would disagree  but we won't.  ,LER,status
Muchas Gracias  Andres. ,LER,status
Not sure what dialect some of you are writing in  but we'll take it. Thanks for your comments. Kittles lubbs nu too.  ,LER,status
Indeed there are Brogan. Just don't go hitting any pinatas looking for them:  http://www.facebook.com/video/video.php?v=24332982952,LER,status
Beginning July 17  2008  Upper Playground will release a new adidas Originals sneaker every Thursday. The new shoe line features four signature designs from fine artists Sam Flores  David Choe  Herbert Baglione and hip hop artist Aesop Rock.   Each sneaker design will be available for sale at Upper Playground retail stores in Los Angeles  Portland  Berkeley  Sacramento  San Francisco  and London  England. The shoes will also be available in limited quantity online at www.upperplayground.com beginning at 8 am PST.,LER,video
Marc  hopefully you were able to use Skittles not only for your hunger in the well  but as some sort of rescue device. Like to signal a giant falcon overhead that could pull you to safety.,LER,status
Hey everyone   Check out Mix the Rainbow above. Just click and drag the Skittles to make your own track. The amazing beatboxing is from Kenny Muhammad - “The Human Orchestra.” We wanna hear some of the most creative  unique  and fresh tracks so don’t forget to post your mix to your page and send it to friends.   Have fun.  ,LER,status
Michael Sieben Microsite is live!  After approaching Michael Sieben as a guest artist for an adidas Originals assortment in early 2008  an inspired partnership between the artist & adidas quickly bloomed into a collection of two exclusive shoe designs  a t-shirt and a hoody featuring Sieben’s artwork  and an entire campaign  complete with a feature mini-film and micro site.   The web film features an inside view of Sieben’s character-driven world  and actually brings his illustrated creatures to life.    Check it out now at www.adidas.com/michaelsieben,LER,status
This Thursday  July 17th  marks the release of the new Herbert Baglione adidas Originals sneaker from Upper Playground. This is the first sneaker in the four-part series.  To get your own pair of these unique Herbert Baglione adidas Originals sneaker  visit a UP store on Thursday  July 17th or order your pair online beginning at 8 am on Thursday 7/17.  visit www.upperplayground.com for details.,LER,video
Chris  just enact the 5 second rule. We won't tell if you want to extend that by a few hours.  ,LER,status
Ashley  no lemonade yet  but maybe a handful of sour lemon skittles would do the trick instead. ,LER,status
Bongi  We'd love to hear your beats. You should post your mix in the discussion board. ,LER,status
Anya  We're honored. Maybe you should give Skittles a playmate named Sour Skittles. ,LER,status
that is such a great story! is it really true?,LER,status
Thank Dimitri  We like to hope they bring more than that together  but its a good start. ,LER,status
Maria   As Tina Turner would say  "Better than all the rest." ,LER,status
Thanks Rhea. Although now Skittles literally rocks. Check out Mix the Rainbow and make your own beats. ,LER,status
Thanks Jessica. We'll break that out at the next company softball game. ,LER,status
Hey Cheri  we always believed that love came in cutting them by 1/8. ,LER,status
Kevin  Dictionary.com defines Skittles as "ninepins in which a wooden ball or disk is used to knock down the pins." We don't know anything about that. Your definition is much nicer. Maybe that should be the Urban Dictionary definition instead. ,LER,status
There is just one week left to save 20% on select originals gear  US residents only. Visit www.shopadidas.com now!  Free shipping on orders $99+ with code: ADISHIP99F  click the image above (top right side of page) to start shopping now. ,LER,status
Hey Quila  We'll try it out. In the meantime  mix up a lemon and strawberry and let us know if that comes close to pink lemonade.,LER,status
Sorry to hear that Michael. Maybe they were basking in the tropical sunlight of St. Kitts for too long. We'll have a word with them about it.  ,LER,status
http://www.facebook.com/group.php?gid=25654067308&ref=mf,LER,status
Laurie  as George McFly would say  it was your density. I mean destiny. ,LER,status
There seems to be a lot of love in the air. Its like spring on the Skittles board. ,LER,status
Noor  so are you saying you like Sour Skittles? Call it a hunch. ,LER,status
Woo hoo! 100 000 fans in just under 2 months! Thanks for stopping by everyone. We've got more good stuff to come so stay tuned. ,LER,status
Hey Pamela   You should be able to save it both as a widget on your Facebook page or in a separate page.  After you put in the music and sounds  name the mix and click the word "save". From there you can either click "Go to Mix" or the "Facebook Your Mix" button just below.   I hope that helps.   Happy Mixing  The Skittles team,LER,status
Nice one  Julie Cooper. Sounds like a wedding vow. ,LER,status
Noor  so are you trying to say chocolate aren't your favorite? ,LER,status
Wow  thanks Carol. We've been around the world  but its truly an honor to say that we belong there. ,LER,status
Nice beats  Heather and Brecken. Perhaps a future in professional skittles mixing awaits. ,LER,status
There are just three days left to submit your photo for the adidas Originals photo contest! This is your chance to win a $500 gift card and head back to school in style. Visit http://www.facebook.com/event.php?eid=21296407554 to find out more.,LER,status
That mix is hot  Ryan. Keep 'em coming everyone. ,LER,status
Derek  despite what you or the internet may thing  we can assure you that there is no orange Skittles conspiracy. Red  on the other hand...,LER,status
Alexander and Brandon. Think of it like a really tasty jaw exercise. ,LER,status
"Flip the adiscript" Devon Boyd,LER,photo
Jennie  While ROYGBIV says that's technically true  we like to believe that the rainbow is what you make of it. ,LER,status
Heber. What about now? Still eating them? ,LER,status
Cleo  three stores? Sorry to hear that my friend. But maybe the 4th times the charm. ,LER,status
Ashley  is this the best friend you're referring to? http://www.new.facebook.com/video/video.php?v=23940202952,LER,status
Ashley/Pru Glad to see you guys expressing your friendship on our little Facebook rainbow world. But Tim is still looking for a BFF if you want to make your dynamic duo a trio.  http://www.new.facebook.com/video/video.php?v=23940202952,LER,status
Christine  Glad to hear that you like us better than sugar coated crab apples  the previous favorite of all-time. ,LER,status
Emma Rose  We're sorry to hear you couldn't find any blue Skittles  but we do appreciate your haiku-ish post.,LER,status
Sameer  we agree. Although some may say we're slightly biased.,LER,status
Mahtz  perhaps you should introduce yourself to Matt. Sounds like you two would have worked well together in your Skittles financing operation. ,LER,status
Sian  maybe the green ones got confused by the hemisphere and changed. ,LER,status
Hey Mikes: In an ideal world  Skittles could be used as a form of currency and have a killer exchange rate. Until then  we’ll settle for being your favorite candy. ,LER,status
Carson and Kate: No offense taken. Thanks for letting us know though. ,LER,status
Carly  thanks  but life is pretty sweet too. ,LER,status
Luciano  next time you go to the beach  try out the tropical skittles and tell us if its like doubling up paradise.,LER,status
Lauren  the sourman would agree. Although  not before performing a strict once over  of course. ,LER,status
I know we're a couple of days late on this  but just wanted to wish everyone a happy NewYear. Although  if you were time traveling from Dec. 31 and just landed today  then we're just in time. ,LER,status
Where did they go  Pamela? ,LER,status
Vanessa  we suppose that's one way to bring new meaning to "taste the rainbow." ,LER,status
Wait a second Laila  we think that might be someone else's line. ,LER,status
Lucie: C'est notre secret. Désolé pour la mauvaise francais,LER,status
is taking a look at facebook stuff.,LER,status
Solveig  the green and purple would like a word with you. ,LER,status
Thanks Wilyssa. It's like we're your binky blanket  only a bit tastier. ,LER,status
Thanks for all your thoughts on the new site. I know there are some lingering questions out there: will they twitter back? Is this site real? Am I causing that smell? Stay tuned for answers to those questions and more. We promise.,LER,status
Thanks Teenum. Although that almost sounds like the world's least popular extreme sport. ,LER,status
And Skittles love the inside of your mouth  Brant. ,LER,status
Thanks Will. We are too. Stay tuned. ,LER,status
Brant  you don't happen to be a regional manager at a mid-level paper company in NE Pennsylvania do you?,LER,status
Thanks Jacob. Don't forget to post your mix in the discussion forum. We'd love to hear what you put together. ,LER,status
Liz  I don't know what you're referring to. Now if you don't mind  we need to get back to work at the family beet farm. ,LER,status
Thanks Scott. It's still there. Check it out at Skittles.com/chatter.htm. Tweet away. ,LER,status
has more breathing room where it counts in this new layout.,LER,status
Melanie Street Harper wrote: "Skittles rock. My autistic son loves them  and skittles is the first word he learned to spell by himself."  Thanks Melanie  we're humbled and honored to be a part of your lives.,LER,status
Ryan Lynch wrote:  "I don't think Skittles taste good. Is that you cousin Katy?"  We're sorry to hear your taste buds disagree with Skittles. However  we're excited this page doubles as a Lynch family reunion group.,LER,status
is performing a deliciousness enhancement procedure on your taste buds.,LER,status
froze it's rainbow off today.,LER,status
as currency is good in theory  until you eat your checking account.,LER,status
completely forgot that it's Friday.,LER,status
Darla Brown wrote: "skittles are the new white meat"  Skittles wrote: Especially when they're "white meat skittles",LER,status
Mandra Fandel wrote: how much you were there for my kids reward for going potty  so reliable.   Skittles wrote: Thanks Mandra. Glad to know we could be a regular in your life.,LER,status
Adrian Ho wrote:  Skittattle skittalz skittles. i'm a green and blue skittle guy myself.  Skittles wrote:  Adrian: You are what you are  anyway you spell it.,LER,status
Romina Castro wrote: EVEN IF YOU COST ME A LOT OF MONEY HERE IN ARGENTINA (AND YOU DO) :p IM MORE THAN A FAN :p  KISSES!!  Skittles wrote: Blush the Rainbow.,LER,status
Paulette Thompson wrote: is there any way you can release a bag of only the red and purple from the original flavors??? :)  Skittles wrote: Paulette  maybe instead we can introduce you to someone who only likes green  yellow and orange. You two can be Skittles BFF and Soul mates.,LER,status
Nicole Stevens wrote: i loveee american skittles! soo much better than english!  Skittles wrote: Thanks Nicole. We promise to not tell the Queen at our next paintball game.,LER,status
Karen Solomon wrote: I am just soooooooooo addicted to skittles. Yep Breakfast  lunch and dinner.  Karen  you will be the first to know if we ever have the breakfast burrito Skittles.,LER,status
Rick Thornes "Bring the Noize" Skatepark tour dates,LER,status
2009: adidas Skateboarding introduced its first signature skate shoe for pro Dennis Busenitz on the Pro Model that was inspired by his love of football cleats of the past.,LER,photo
"Louis Vuitton : Art  Fashion and Architecture" Deluxe Edition  Designed by Takashi Murakami. Available in September 2009.  Copyrights Louis Vuitton,LER,photo
From Ken Block :  I want to give everyone a heads up - this link is to my new official fan page. Please click through and become a fan! Because I have topped out on the number of friends my current page will allow I needed to have a fan page where everyon...e can join  and see the most current content!  http://www.facebook.com/pages/Ken-Block/139454585764,LER,link
IDC survey suggests cloud computing will live up to high expectations  read the report to find the reasons that prompted their organisations to consider the service.  http://bit.ly/3fUIOz,LER,link
Kylie  featured in Windows ads  and CEO Steve Ballmer check out a new Windows 7 PC at the keynote launch event in New York  October 22  2009.,LER,photo
Why get Smarter? Because we can: the technology is both available and affordable. Because we must: the shocks we've seen to so many systems show that the current approaches aren't sustainable. And because we want to. IBM is starting a conversation with the world because we think now is the time to make these changes for the better. http://bit.ly/1rBop2,LER,link
Did you know that in 1900 only 13% of the world’s population lived in cities. By 2050  that number will be 70%.    Source: The global proportion of urban population rose from 13% (220 million) in 1900  http://bit.ly/3JmUfY    Source: Half the world's population will live in urban areas by the end of this year and about 70% will be city dwellers by 2050  http://bit.ly/3JmUfY  http://bit.ly/1QWtlQ,LER,link
Fuel economy improvements for urban driving:Hybrid vs. intelligent vehicles  The quest for more fuel-efficient vehicles is being driven by the increasing price of oil. Chris Manzie  Harry Watson and Saman Halgamuge of the Department of Mechanical Engineering at The University of Melbourne  present a research paper which compares two of the emerging technologies in automotive systems  hybrid drivetrains and telematics capability. In this paper  hybrid and intelligent technologies using different amounts of traffic flow information are compared in terms of fuel economy over common urban drive cycles. View the paper here http://bit.ly/3FEr81,LER,link
Review of the SCS Setup Wizard,LER,status
Getting up to speed with Moblin 2.1,LER,status
Testing of Linux-applications with the help of PVS-Studio in Windows,LER,status
Videochat: How .NET developers benefit from multicore platforms,LER,status
Be there or be square.  Looking forward to seeing everyone tomorrow at Mighty!,LER,status
Parallel Programming Talk #55 - Daniel Moth on Microsoft Visual Studio 2010,LER,status
Intel AT Update,LER,status
Intel Education Service Corps volunteers work with Save the Children to train teachers and students in Bangladesh in the use of the Intel-powered classmate PC.,LER,link
Intel says shape-shifting robots closer to reality -- story in ComputerWorld.,LER,link
How vPro proved it’s value even to me,LER,status
An eReader With a Purpose - Intel Reader on ABC News.  Link to the TV segment here.,LER,link
Did you know 30% of the food purchased in developed nations ends up going to waste?  http://bit.ly/2cT5xm,LER,link
Taking Back the Security Initiative,LER,status
Newsweek’s Daniel McGinn on C-SPAN: “Is America Losing Its Mojo?”,LER,link
KGO-TV and host of "Next Step" Richard Hart gives Dolby  Ubergizmo and Intel some love in his ABC7 report on the #Uber10 list -- best gadgets for under $500 http://om.ly/cBbq,LER,link
Testing scaling using computers in the clouds.,LER,status
Universum asked nearly 120 000 students from around the world about where they would like to work...and the results are in! Thank you for making Intel one of the top 50 employers on the "Best Business Undergrad Employers" list! Check out Discover Intel – Global to find out more about what it's like to work at Intel!,LER,link
Isilon and Intel  delivering high performance scalable storage,LER,status
IT Can’t Lead Corporate Sustainability Efforts but Sure Can Help,LER,status
10 Gigabit iWARP @ SC’09!,LER,status
Our old computer is getting slow... time for a new PC?,LER,status
BrandWeek story: With LifeScoop  Intel's a Publisher http://om.ly/cMPG.  Interested in Brands  follow @BrandWeekDotCom,LER,link
Tuesday's Krushed It! winner is Luke. He gets a $100 for his picture of a very sad LCD tv.  Have you sent us a picture yet? Details on how to enter and be in the running for daily prizes are at http://krushed-it.com.,LER,link
IBM makes computing cloud capable of holding 250 billion iTunes songs  http://bit.ly/5pYXhq,LER,link
Krushed It! Comp - Vote for this week's best pic. Think you can do better? Submit your entry and be in the running to win the daily Judges Pick $100 Prize.,LER,link
Everyday ways we can reduce air pollutions and improve air quality  http://bit.ly/6BuSbS,LER,link
Smashed  broken  shattered  wrecked  demolished  mashed  squashed  flattened  trampled  squeezed... you get it. Email your photo to enter@krushed-it.com and be in the running to win the daily Judges Pick $100 Prize.Get your mates to vote each Friday when your pic will be up for the weekly $500 People's Choice Prize.,LER,link
Intel CTO on Keeping America Great CNBC Squawk Box interview http://om.ly/cgac On Twitter  follow the #innovateUS converastions.,LER,link
IBM to furnish Cloud Computing to Ho Chi Minh City  http://bit.ly/4Uvd8f,LER,link
Research@Intel · Exploring programming models with the Single-chip Cloud Computer research prototype,LER,link
Intel                  Livecasting Intel CTO Justin Rattner - Intel Labs to Announce a New Research Milestone in Many-core Computing http://om.ly/chrE,LER,link
Ubergizmo Uber10 giveaway HP Envy Beat (courtesy of Intel) will close on Friday... http://om.ly/cjwB,LER,link
Intel unveils 48-core processor -- Single-Chip Cloud Computer experimental effort -- Stoy by Ubergizmo,LER,link
Ok  Intel fans  let's see how great you are at writing Haiku... If you are interested in winning a home server  check this out...,LER,link
Vote for this week's best entry. Think you can do better? Email your photo to enter@krushed-it.com and be in the running to win the daily Judges Pick $100 Prize,LER,link
Intel                  RT @IntelLabs Video - Intel Labs team dives inside the Single-chip Cloud Computing experimental chip.,LER,link
IBM helps launch Green Data Centre  http://bit.ly/5GMx75,LER,link
Enter our Krushed It! competition and be in the running to win the daily Judges Pick $100 Prize. Get your mates to vote each Friday when your pic will be up for the weekly $500 People's Choice Prize.,LER,link
IBM wires trucks  water lines in smarter city bid  http://bit.ly/6C9Ldy,LER,link
Story by @ComputerWorld w/ Intel anthropologist Genevieve Bell http://om.ly/cqmQ,LER,link
Enter our Krushed It! photo competition and be in the running to win the daily Judges Pick $100 Prize. Get your mates to vote each Friday when your pic will be up for the weekly $500 People's Choice Prize.,LER,link
Clearing the path for hands-free  automated driving  http://bit.ly/4YhaPJ,LER,link
@iJustine becomes @PCJustine in video for @Intel -- choosing the right computer and processor http://bit.ly/8s20qz #IntelInsiders.,LER,link
Intel to preview new chips on December 17 -- story from Business Tech @CNETNews http://om.ly/cygw #CES,LER,link
Jane's E-Learning Pick of the Day by @c4lpt on 12/10/09 was Intel's Technology Wiki http://om.ly/cyhO,LER,link
RT @JaniceAtShuttle: Shuttle Bringing @Intel Pinetrail All-In-One To CES 2010 http://om.ly/czVo #CES,LER,link
Intel                  Got an Intel Core i7 or i5 processor?  See it in action with this Intel Turbo Boost Technology Monitor/Widget http://om.ly/czuK,LER,link
Why Computers Can't mimic the brain  http://bit.ly/7WTLit,LER,link
Check out this fun new blog from the Intel Education Service Corps volunteers working with CARE in Egypt to deploy 500 Intel-powered classmate PCs in 20 schools.,LER,link
Intel fans  we have a question for you - would Intel really shoot five engineers out of cannons to recreate the company’s biggest ubiquitous “bong” theme chime? Well  see for yourself in this video ... (Ekaterina's disclosure: personally  I was blown away!),LER,link
IBM nabs WA smart meter deal    http://bit.ly/6kGHXc,LER,link
It's the final Krushed It! People's Choice Award - visit the website to vote for this week's best entry,LER,link
Intel Announces New Atom platform which integrates graphics and memory controller into CPU  enabling smaller systems  lower power,LER,link
Pepsi is helping you refresh in the new year with more then $25 000 in prizes! Stay tuned for the scoop on how you can refresh your world!,LER,status
Go the Elizabethan look!,LER,photo
going gaga over Pepsi,LER,photo
Have a great Christmas everyone!,LER,status
Any ideas on who's the co-star of the Hit Refresh TVC?,LER,photo
