***Facebook EXCLUSIVE Monster Giveaway***   Leave a comment below and in the next hour  we will be picking a random winner.The winner will recieve an EXCLUSIVE Athlete only hat OR an athlete only tshirt (Winner will choose). Let the comments flow =D [The more you comment  the more chances you have to win],HER,status
You’ve just passed through the gates! Where to first?,HER,photo
Thank you  Detroit!,HER,photo
We released our first quarter results for fiscal year 2014. Find a recording of the press conference here: http://sie.ag/1eV6PZm,HER,photo
Our Innovation Partner Infiniti Red Bull Racing revealed the brand new RB10 today  their car for the 2014 Formula One World Championship.  Siemens PLM software was crucial to building this first interpretation of F1’s new technical regulations.,HER,photo
The accomplishment of strength & beauty. – Don't you want to hit the road straight away?,HER,photo
At Arab Health (Jan. 27-30)  we will present our new computed tomograph (CT). SOMATOM Force*. Learn more here: http://sie.ag/1iNzBOp *Under FDA review. Not available for sale in the U.S.,HER,photo
How to make a classic roadster even more unique. Design Pure Fusion. http://bit.ly/1egCdnh,HER,photo
#PictureOfTheWeek: The full-size mock-up of the state-of-the-art Desiro City train that will transform rail travel across London was unveiled by UK Rail Minister Stephen Hammond on January 28. Check out the facts: http://sie.ag/1e7lILK,HER,photo
Which Disney Villain brings out your #DisneySide?,HER,photo
We've rounded up the best advice from IKEA fans on #howto organize different areas of the home! Check it out here: http://goo.gl/wUDhjE Thanks for helping us kick 2014 off right! #GetOrganized,HER,photo
Coaches are using tablets on the sidelines to keep players safe by accessing real-time data from smart-sensing helmets when a player sustains a head injury.  Well played  coach. http://intel.ly/1ecFuFI,HER,photo
We celebrate the Chinese Year of the Horse 575 times. Once for each horse in the limited BMW M6 Gran Coupé Horse Edition.,HER,photo
After 15 years in the NFL  he finally gets his shot. Congrats   Champ Bailey! #SuperBowl #SB48,HER,photo
We cannot believe our eyes. It’s here…it’s really here.  *drools* The Simpsons House- http://bit.ly/LEGOSimpsonsHouse,HER,photo
You’re invited to #IKEABYOF Day! RSVP & check out what’s happening: http://goo.gl/qqiwQS   Don’t miss a great day with family  friends and fellow IKEA shoppers on Saturday  March 8  2014! RSVP and be entered for a chance to win a $500 IKEA Gift Card!,HER,photo
Designed for Driving Pleasure – the first-ever BMW 4 Series Gran Coupé. http://youtu.be/CoHrA6GRAKo,HER,photo
Watch out for Curiosity Mars Rover in Munich! Siemens Software Initiative sponsors the OOP 2014 conference from 3.-7.2. "Managing Today's Challenges". http://sie.ag/1n0Vt94,HER,photo
Your favorite friends are waiting for you!,HER,photo
More info: http://bit.ly/1fRZ0El,HER,photo
Two in one sweep! Within a few weeks we were awarded two orders for onshore wind power plants in the USA. Read more about the wind power projects Panhandle 2 (182 MW) and Windthorst-2 (67 6 MW):  http://sie.ag/1fKHhQq,HER,photo
“I'm late  I'm late  I'm late!”,HER,photo
No paper? No problem. Handwritten notes on the GALAXY Note 3 can become actions thanks to Action Memo. Find out more here: http://spr.ly/618356Kt,HER,photo
RSVP for freebies & more on #IKEABYOF Day! Click here: http://goo.gl/8zkkLX,HER,photo
Two sides to every story.,HER,photo
Do you love a winter wedding? February is National #Wedding Month! Check out affordable #DIY ideas for your big day: http://goo.gl/jwuhv5,HER,photo
You’re never too old to show your #DisneySide!,HER,photo
See the latest generation of a vehicle that once pioneered its own class. http://bit.ly/1byH81C,HER,photo
#PictureOfTheWeek: The new Amtrak Cities Sprinter had its debut in Philadelphia  Pennsylvania. Read more about this "Made in America" manufacturing and technology transfer story: http://sie.ag/N8NNY0   View the fact sheet: http://sie.ag/1fC6GKs   Suppliers Map:  http://sie.ag/1lFllw3,HER,photo
In the future  wearable devices like smart earbuds will be able to sense your mood and turn up those pump-up jams right when you need them. http://intel.ly/1iz5Eky,HER,photo
Less weight equals more performance. Would you like to know how that works? We'll show you: http://youtu.be/xAXcObriIA0,HER,photo
Happy 13th Anniversary to Disney California Adventure Park!,HER,photo
Join us for #IKEABYOF Day (Bring Your Own Friends)! Click to RSVP: http://goo.gl/vXZW3y   Learn more about our special day of exclusive rewards and activities on Saturday  March 8  2014! Plus  when you RSVP you'll be entered to win a $500 IKEA Gift Card!,HER,photo
Valentine's Day is just around the corner.  We hope your cards are signed!    Share your #LEGOValentine!,HER,photo
Here’s to a magical end to a magical day!,HER,photo
Seize the Days! Check out one-day-only offers from Feb. 15-17  2014: http://goo.gl/zWXyBg   Click to plan which days you’ll head to your IKEA store!,HER,photo
The US energy business is changing. Have your say about its upcoming challenges and opportunities by taking this Harvard Business Review survey: sie.ag/1exiUb5   The survey is part of our current collaboration with Future Influencers: www.futureinfluencers.com. All results of this survey will find their way into a whitepaper  which will be published by HBR in a few months from now. We’ll keep you posted!,HER,photo
Discover the new collection featuring runway-inspired accessories in vibrant pastels and painterly tones. Bags  scarves and shoes are updated with graphic prints and check details for Spring/Summer 2014,HER,photo
Welcome to Main Street  U.S.A.!,HER,photo
The first-ever BMW 4 Series Gran Coupé is a perfect fusion of elegance  agility and comfort – joined with the exclusiveness of BMW Individual  it becomes a new benchmark.,HER,photo
Emmet has that Monday feeling... #TheLEGOMovie,HER,photo
Our perception of winter sports: A day with BMW Driving Experience in the Austrian alps near Sölden.,HER,photo
Click here to RSVP for #IKEABYOF Day  our special shopping event: http://goo.gl/ZkrT4h   Invite friends  so you can enjoy the perks and rewards together on March 8  2014!,HER,photo
This IKEA fan used EXPEDIT as both a room divider and a storage unit! Check out Share Space for more inspiration from IKEA fans: http://goo.gl/TGK7Lw,HER,photo
Check out Gillette Deodorant's new NFL web series #PressurePoints at www.NFL.com/PressurePoints,HER,video
Ryan Suter and #TeamUSA are taking on Russia in men’s ice hockey Saturday. Check out his inspiring  story! ,HER,link
The #NBAAllStar jerseys look great! Where is your loyalty? East or West? Read Rachael McBrearty’s blog for keys to enabling the emotional spark to build that loyalty between consumer and brand. ,HER,link
3 weeks until BYOF Day on Saturday  March 8  2014! RSVP here: www.IKEA-USA.com/BYOF Join us to enjoy shopping perks with your friends! #IKEABYOF,HER,photo
The Disney animated classic “Cinderella” was released 64 years ago today! Is she your favorite princess?,HER,photo
Who ya gonna call? LEGO Ghostbusters  of course! So much ghost-busting greatness coming this June... #LEGOPreview #ToyFairNY http://on.mash.to/1gHUmKT,HER,photo
Décor tip: Add wall shelves and art above an entertainment center to create a focal point. Here’s more inspiration for designing your media center: http://goo.gl/opxdvI,HER,photo
The Bloomsbury Girls - view runway looks from the Burberry Womenswear A/W14 show,HER,photo
The new challenger. BMW M235i Racing. BMW Motorsport http://bit.ly/1dEOFsw,HER,photo
Draw a box on the GALAXY Note 3 to bring up Pen Window and quickly access useful features like calculator  contacts and internet. http://spr.ly/618356Kt,HER,photo
Under its so-called Share Matching Plan and Base Share Plan  we transferred to our employees this year some 440 000 Siemens shares  with a value of around €41 million. This was an increase of more than 25 percent over last year  when the volume was 350 000 shares. http://sie.ag/MvvT0X,HER,photo
Do you get excited when you see this sight?,HER,photo
4 the win!  http://bit.ly/1fRZ0El,HER,photo
As early as 1866  Werner von Siemens introduced a stocktaking bonus  which enabled employees to participate in the jointly generated profits. In 1969  for the first time  Siemens AG's German employees were able to buy shares and today  over a third of our employees are Siemens AG shareholders. http://sie.ag/1jL3cLv,HER,photo
IKEA Gift Card giveaways – just 1 of the #IKEABYOF perks! RSVP here: www.IKEA-USA.com/BYOF  Tell us what you’re looking forward to on Saturday  March 8  2014!,HER,photo
Travel in style. http://intel.ly/1l2aZ81,HER,photo
How do you make your bathroom your sanctuary? Check out simple ideas for improvement: http://goo.gl/jKRKLo,HER,photo
Feeling a little Goofy today?,HER,photo
Discover the new collection featuring runway-inspired accessories in vibrant pastels and painterly tones. Bags  scarves and shoes are updated with graphic prints and check details for Spring/Summer 2014,HER,photo
For the next four days  Barcelona is the capital of all things mobile innovation. Learn more about Mobile World Congress here: http://intel.ly/1hgTOfj,HER,photo
A magical day awaits you!,HER,photo
Inspired by nature. See why the BMW i8 aerodynamics is about more than what meets the eye. http://bit.ly/1g2DYow,HER,photo
FREE breakfast with your coupon on #IKEABYOF Day  a special day of rewards on 3/8/14! RSVP here: www.IKEA-USA.com/BYOF Create personalized invitations to send to your friends!,HER,photo
This week´s Awesome Alliance prize is EPIC! We´re giving away The LEGO Star Wars Death Star! Pretty cool right? Get your LEGO bricks out and join the fun at: http://bit.ly/AwesomeAlliance,HER,photo
Hex code combinations in HTML produce over 16 million different colors on our screens  but only about 8% of them are common human eye colors. What hex code are your eyes?,HER,photo
Thank you for the laughter  Harold Ramis 1944-2014,HER,photo
Who’s hungry?,HER,photo
Can't get enough of BMW pictures? Follow us on Instagram: www.instagram.com/bmw,HER,photo
Throwback: IKEA customers at BYOF Day 2013! RSVP for #IKEABYOF 2014: www.IKEA-USA.com/BYOF Join us for the 3rd annual celebration of friendship  shopping and IKEA rewards! #tbt,HER,photo
#PictureOfTheWeek: 4438 hp strong  room for 940 passengers  award-winning design - meet the Siemens C2  the latest rail innovation for Munich's metro network. http://sie.ag/1fEA6GR,HER,photo
Unveiled at this year's International CES  Jarvis is the Intel-powered personal assistant that knows what you want before you do – maybe even what suit you’ll wear today.,HER,photo
Ladies who latte. #vanillalatte #coffeedate,HER,photo
140 Disney Characters invite you to an All-Night #DisneySide Party on both coasts! Learn more: http://di.sn/jYt,HER,photo
As time goes by...,HER,photo
#FolloFriday: Mercedes-Benz Niederlassung Berlin  A beast has temporarily taken over command at the dealership Berlin. Quite the stunning sight for the customers on site  don't you think?  Photos courtesy of Mercedes-Benz Berlin.,HER,photo
Wave goodbye to the real world...,HER,photo
Tonight is Oscar Night. Our favorite for "Best Sound".  [Photo courtesy of marioroman pictures. http://instagram.com/p/hKC-1IzcN2/],HER,photo
Feelin' crafty? It's National Craft Month! Click for tips and ideas on how to keep your craft zone from overtaking your home: http://goo.gl/bipMde,HER,photo
@TheEllenShow sent what is now the most re-tweeted Tweet with over 1 million RTs during tonight's Academy Awards!,HER,link
Congrats to Walt Disney Animation Studios!,HER,photo
Best selfie ever?,HER,photo
Our new flyer is blooming with deals & ideas for spring! Click here: http://goo.gl/fpgj0q  We're ready for more bright and sunny mornings!,HER,photo
FREE IKEA blue bag  anyone? 5 DAYS until #IKEABYOF Day  a special day of shopping rewards and activities for you and your friends! Can’t wait to see you on Saturday  March 8  2014! RSVP here: http://goo.gl/OFGkGY,HER,photo
What do you think: Would Werner von Siemens be proud of today‘s technology?,HER,photo
Discover the new collection featuring runway-inspired accessories in vibrant pastels and painterly tones. Bags  scarves and shoes are updated with graphic prints and check details for Spring/Summer 2014,HER,photo
From GPS enhanced beetles to surgical scorpions and jellyfish drones; discover artist Vincent Fournier's whole new kind of animal kingdom: http://intel.ly/1gP4y2A,HER,photo
The REAL #Oscars selfie...sort of  photo courtesy of: LEGOLAND Discovery Centre Manchester,HER,photo
Happy 19th Anniversary to Indiana Jones Adventure!,HER,photo
Carry creativity wherever you go. http://intel.ly/1jQKHmF,HER,photo
Ready for a magical day?,HER,photo
Press Days are over! We're looking forward to meeting you at the Geneva Motor Show. #BMWGeneva #SIAG,HER,photo
What GALAXY S5 feature are you most excited about*^?,HER,photo
2 DAYS until #IKEABYOF Day on Saturday  March 8  2014! Who are the friends you're bringing? RSVP and find more details here: http://goo.gl/Nfvtgj,HER,photo
X-troverted character. http://bit.ly/1otoprd,HER,photo
Think you'd score high on the #Wonderlic? Find out now and you could win a trip to train like a pro with Team EXOS!  ,HER,link
Happy First Friday! Here’s your chance to win a $100 IKEA Gift Card: What craft or #DIY project do you hope to complete this month? Leave a comment on this post that answers the question and you could be randomly selected to win! See official rules here: http://goo.gl/WsUCQ6,HER,photo
Get fit with pleasure. Driving Pleasure  to be precise. The new generation of BMW Bikes: http://bit.ly/MUlSKo,HER,photo
When is your next Disney California Adventure visit?,HER,photo
Coming this May  collect a true icon of the classic Star Wars universe – the mighty Sandcrawler!,HER,photo
Exceptional luggage for an exceptional automobile: Louis Vuitton  the pioneer of the art of travel  has created a tailor-made luggage set for the most progressive sports car – the BMW i8 plug-in hybrid.  http://www.bmw.com/com/en/newvehicles/i/i8/2014/showroom/design.html,HER,photo
Thank you to all across the country who joined us on Saturday for #IKEABYOF Day! Check out our photo album here and tag yourself:  http://goo.gl/JKBzcj,HER,photo
The Combined Cycle Power Plant (CCPP) at the Lausward location in the port of Düsseldorf  is aiming for no less than three world records! To name one: The electrical efficiency will be more than 61 percent. Learn more: http://sie.ag/1hHLiov,HER,photo
The Ornament Valley - always a beautiful sight in Cars Land!,HER,photo
We are "teaching" wind turbines how to automatically optimize their operation in line with weather conditions. Curious how that works? Read more: http://sie.ag/1hbwfmu,HER,photo
Sustainability is not just about car efficiency. You have to work with renewable materials  too. Such as these: http://bit.ly/1dytmNG,HER,photo
Whenever you're in Rome  feel free to take a closer look. Visit us at the first BMW City Sales Outlet – it just opened a few days ago.,HER,photo
Happy Pi(e) Day!,HER,photo
Love this #kitchen? Check out the homes of fellow IKEA fans to get some ideas of your own! Click for Share Space: www.IKEA-USA.com/sharespace,HER,photo
Sorry  we're out. Going for a drive. #TGIF,HER,photo
Who’s ready for a Disney California Adventure visit?,HER,photo
Have you started dreaming about outdoor dining? IKEA FAMILY members save on the FALSTER table this month! More IKEA FAMILY offers here: http://goo.gl/l5QGZz,HER,photo
Happy St. Patrick’s Day!,HER,photo
We had a great time at the Geneva Motor Show. Thanks for having us.,HER,photo
A “hybrid” locomotive? Siemens has been awarded to build 32 diesel-electric passenger locomotives for five U.S. states. The contract is valued at approximately €165 million ($225 million) and marks Siemens' entry into the U.S. diesel-electric locomotive market.  http://sie.ag/1ieADTU,HER,photo
Yar! Happy 47th Anniversary to Pirates of the Caribbean!,HER,photo
BMW M is part of the MotoGP for the 16th season running. This time  the BMW M4 Coupé is at the heart of the 2014 Safety Car fleet.,HER,photo
Congratulations to Pina Dunne  Tze Ling Chung  Azhar Sheikh  Adrian Macdonald and Judy Holmes! You've all scored yourself your very own Samsung Galaxy S5!   Thanks everyone for entering. Watch this space as there will be more Samsung promotions coming up!,HER,photo
Who’s excited to see Big Thunder Mountain Railroad back in action?,HER,photo
Partners.,HER,photo
#PictureOfTheWeek: Three fully assembled Siemens high-speed Velaro D trains at the testing center in Wegberg-Wildenrath  Germany. The trains are traveling through Germany at speeds of up to 300 kilometers an hour. Get more details: http://sie.ag/OGSIzv,HER,photo
Learn how you can take part in the "it's a small world" 50th Anniversary celebration! http://di.sn/hZu,HER,photo
It's Spring in Germany. So click here and calm down: http://bit.ly/1cFnHqF,HER,photo
It’s all about spring deals! Check out new offers on the things you need to get organized for a fresh start: http://goo.gl/ldbDez,HER,photo
Signature details of The Burberry Heritage Trench Coat - our hundred-year-old design  proudly made in England in three fits and five colours  Explore The Burberry Heritage Trench Coat: http://brby.co/3cd,HER,photo
The best of both worlds. See how a plug-in hybrid makes the perfect match: http://bit.ly/1gWydpt,HER,photo
Here’s to a magical week!,HER,photo
How long have you been thinking about a new kitchen? Check out our #kitchen designs here: http://goo.gl/Ht31Ej,HER,photo
Congratulations to Pina Dunne  Tze Ling Chung  Azhar Sheikh  Adrian Macdonald and Judy Holmes! You've all scored yourself your very own Samsung Galaxy S5!   Thanks everyone for entering. Watch this space as there will be more Samsung promotions coming up!,HER,photo
Happy International Waffle Day! Who could go for some Mickey Waffles right now?,HER,photo
We are investing more than EUR190 million (GBP160 million) in new offshore production facilities in Great Britain. Production of rotor blades for offshore wind turbines of the 6-megawatt class is planned  with a new logistics- and service centre slated for Hull. http://sie.ag/1m3sGlm﻿,HER,photo
Putting the speed in The Goodwood Festival of Speed! The BMW M4 Coupé.,HER,photo
We’re hands on with the Samsung GALAXY S5 launch in Sydney and we must admit; we’re pretty excited! Check out some first hand pics below #GALAXYS5Launch,HER,photo
Coming this May!,HER,photo
Who's in? The all-new BMW M3.,HER,photo
Want to get your hands on the GALAXY S5? Pre order yours now: http://spr.ly/6182gLt0,HER,photo
#PictureOfTheWeek: A2SEA's installation vessel  the SEA INSTALLER is designed and built for the transport and installation of large wind turbines. Get more details: http://sie.ag/1o0YvQy,HER,photo
Who could go for a visit with Mickey right now?,HER,photo
VP of Talent Tara August sheds light on how Cisco TelePresence technology and the #InternetofEverything is helping the #NBA connect players  TV hosts and fans by powering seamless live interviews. Watch it here. ,HER,link
Find your zen with the simplicity of a 2in1 device. http://intel.ly/1i6dVf0,HER,photo
We don't reinvent the wheel. We reinvent light. See what makes BMW Laserlight so special: http://bit.ly/1li7vwb,HER,photo
Watch the Executive Producer of Turner Sports  Scooter Vertino  talking about the Barclays Arena game time app and how it’s changing the #NBA fan experience with the help of Cisco and the Internet of Everything. ,HER,link
Summer is getting hot: Refresh with our #BMW summer complete wheelsets. What would suit you best? http://bit.ly/1my3re0,HER,photo
HomeSync is your very own media hub and personal cloud. Get one for free when you pre purchase both a GALAXY S5 and Gear 2 from a Samsung Experience Store before April 10 2014*.,HER,photo
Who wishes they were at Cars Land right now?,HER,photo
Buddies.,HER,photo
Congratulations to Pina Dunne  Tze Ling Chung  Azhar Sheikh  Adrian Macdonald and Judy Holmes! You've all scored yourself your very own Samsung Galaxy S5!   Thanks everyone for entering. Watch this space as there will be more Samsung promotions coming up!,HER,photo
How many books can you fit on an Intel tablet? A stack approximately half the height of Mount Everest. http://intel.ly/1k2N3hz,HER,photo
Heritage trench coats in miniature - boys and girls in the new Burberry Childrenswear S/S14 campaign,HER,photo
A coffee press is perfect for entertaining at home. Share your questions so we can help you prepare it perfectly. #AtHomeCoffeeWeek,HER,photo
Open for maximum intensity! The first-ever BMW M4 Convertible. http://bit.ly/PqrfTA,HER,photo
Good night from Disney California Adventure!,HER,photo
It all comes down to this! Our final March Magic matchup - west coast vs. east coast to decide your winner! Comment PIRATES to vote for Pirates of the Caribbean at Disneyland or comment HITCHHIKERS to vote for The Haunted Mansion at Walt Disney World.,HER,photo
German Chancellor Angela Merkel and Dutch Prime Minister Mark Rutte gained some useful insights at the Siemens booth at this year's Hannover Messe. Siemens CEO Joe Kaeser and Siegfried Russwurm  member of the Siemens Managing Board and Industry Sector CEO  gave an outlook on integrated manufacturing solutions and "Industrie 4.0". You weren't there? Watch our video! http://sie.ag/1lFHS8R,HER,photo
40 years in the heart of Europe  40 years of BMW Belux: experience 1 600 m² of the best BMW has to offer. We're celebrating our anniversary by opening a new BMW brand store in Brussels!  Come and visit us at http://www.bmwbrandstore.be/,HER,photo
New episode! The #IKEAHomeTour Squad heads to Brooklyn with living room ideas to help this family create a more organized space! Watch the makeover to see how living room storage options transform this room: http://bit.ly/1gmDBBA,HER,photo
If Shakespeare had a tablet  would he have live-tweeted his own plays?,HER,photo
From 0 to 100 km/h in 4 4 seconds. From closed to open in 20 seconds. No upper limit! – See the performance of the first-ever BMW M4 Convertible: http://youtu.be/cIyHm6hSMrc,HER,photo
Gillette BODY is our first razor built for the male terrain. Are you ready to get #BODYREADY? http://bit.ly/1lTDUsI,HER,photo
The power of tablet tethering is helping photographer Paul Souders capture unforgettable moments. Learn more now: http://intel.ly/1qpikwT,HER,photo
One macchiato  two macchiato  three macchiato  pour. :),HER,photo
We would say each and every BMW is a piece of art. But we have to admit that the exhibition of @BMW George V by @BMW France shows some very unique art cars.  Visit us at www.facebook.com/BMWGeorgeV,HER,photo
CERN – one of the world’s largest automation systems – generates terabytes of operation data per day. Our Smart Data Management solutions provide event based diagnostics to discover unknown relations and patterns and automate the complete alarm management process. http://sie.ag/1gKIYL8,HER,photo
A reservation has been made in your name for an extended stay...,HER,photo
Espresso is a symphony of sound  aroma  and smiles.,HER,photo
When you're driving a BMW 4 Series Convertible in a postcard setting  you should also listen to one. "Postcards" – with greetings from James Blunt! Be the first to see it here: http://bit.ly/1mZaCMG #BMWstories,HER,photo
See how the Barclays Center is transforming the fan experience and how the #InternetofEverything will change the way fans enjoy an #NBA game in the future.,HER,link
What could make Friday even better? The release of the GALAXY S5 and Gear family! Available now from Samsung Experience Stores  telco operators and selected retailers. Find out more here: www.samsung.com/au/galaxys5,HER,photo
#PictureOfTheWeek: Lunch Break at Hannover Messe: TITAN the Robot impressed and entertained our visitors at the Siemens booth at this year’s Hannover Messe. Seemingly  robots get hungry sometimes  too!,HER,photo
Battery life that will outlast your writer’s block. Equip yourself with the ASUS T100 Transformer now: http://intel.ly/1gYuqrb,HER,photo
An exclusive open-air concert for all senses!   Enjoy the all-new BMW M4 Convertible inspired by BMW Individual. How do you like the interaction of the Merino leather Opal White with the Tanzanite Blue metallic paintwork? #BMWIndividual,HER,photo
Let me count the ways #espresso #love,HER,photo
You’ve come a long way since your first hair cut. The Fusion ProGlide may not be your first razor  but it will be your first real one. http://bit.ly/1hGJSbL,HER,photo
Who could go for a splash right now?,HER,photo
Spring savings! Click for new offers and inspiration to let your home come to life: http://goo.gl/BIM3qe,HER,photo
Exclusive download of the new ARC Client Report “The Future of Manufacturing: Scenarios for Investment in Manufacturing through 2050”. Register here: http://sie.ag/1gPr21T,HER,photo
Nearly one million German households will be supplied with clean electricity from wind power. Check out our new project BorWin3: http://sie.ag/P0kbw6,HER,photo
We're looking forward to a smashing Easter weekend!,HER,photo
The wildest ride in the wilderness!,HER,photo
A playground for grown-ups built by BMW Asia Insider #BMWstories,HER,photo
++ FIRST LOOK ++ Set for its world premiere in fall 2014  the Mercedes-AMG GT will thrill sports car fans throughout the world with breath-taking design and supreme agility. The first look at the interior already promises that this upcoming sensation will define the concept of "Modern Luxury".,HER,photo
"Owning every kind of transportation and naming it after yourself." - #LEGOBatman #Batman75 #Batman75thAnniversary,HER,photo
A whole load of experience is about to hit the track. http://bit.ly/1h3Aqix,HER,photo
