 spin wonderland ,0,0,0
 swear telling truth say ashley benson abc family pretty little liars blast recent visit disneyland resort ,30.04,27.67,26.1
 mickey ears perfect way grow ,0,0,0
 greetings main street ,5.22,3.39,4.81
 foolish mortals ,3.54,4.46,4.12
 ready 4th july celebration lasts week long limited magic enjoy disney celebrate america fireworks night july plus special merchandise delicious treats mickey mouse sporting star spangled attire ,47.99,40.0,38.58
 nice little help friend ,14.29,10.12,12.32
 ready whale adventure ,13.83,12.21,13.01
 let sing like birdies sing wish enchanted tiki room happy 50th birthday today ,49.72,40.19,39.47
 reason 37 visit fantasy faire boysen apple freeze maurice treats ,21.18,14.93,18.07
 magical sight angle ,14.04,10.68,11.2
 famouse star look best ,7.27,5.83,4.68
 happy father day ,21.95,17.41,18.14
 happy 54th birthday disneyland monorail matterhorn bobsleds park icons opened day 1959 ,22.71,18.17,18.4
 need cool summer day grizzly river run splash mountain ,26.93,19.17,22.41
 know dreams come true ,27.76,21.89,23.81
 princess needs beauty sleep ,22.1,13.21,17.26
 make sure prepared disneyland resort visit ,6.53,5.0,6.03
 disneyland day finished seeing ,6.66,5.0,5.88
 hope disneyland vacation great moments ,20.97,14.91,17.13
 celebrate opening new live mickey magical map taking mickey compass quest receive map follow clues complete challenge special prize limited magic experience june ,37.91,31.79,34.75
 stop tomorrowland ,3.96,4.26,4.89
 watch mickey soundsational parade wait ,5.78,4.1,5.37
 aboard ,0,0,0
 memorial day recognize honor men women armed forces families service sacrifice ,46.68,36.82,41.03
 beautiful sight matter galaxy ,20.39,16.86,16.05
 pajamas mean bedtime nighter continues ,0,0,0
 night party got little magical ,21.38,18.58,16.3
 begins monstrous summer nighter officially started celebrating 24 hours ,5.1,4.21,4.25
 princess 101 ,7.08,5.46,6.32
 instagram want photos snap great pic disneyland resort tag disneyland photo featured feed follow ,18.79,17.26,15.94
 results facebook fan favorites sunday asked favorite disneyland treat based responses ,19.39,15.51,16.07
 favorite disneyland treat ,7.36,5.62,5.78
 24 kicks monstrous summer 24 hour nighter live entertainment parades special character appearances exciting food merchandise offerings disneyland disney california adventure parks ,30.53,27.18,28.16
 pool park ,7.7,5.9,5.93
 meeting favorite princess ,7.08,5.46,6.32
 yay nay truly spire ing view ,0,0,0
 magical day awaits ,18.76,15.49,15.36
 share mom makes life magical ,14.73,11.97,11.45
 pairs mickey ears collection ,0,0,0
 friday include dole whip float ,0,0,0
 favorite stop main street ,9.18,7.65,9.7
 delicious way start week ,5.35,4.38,4.92
 mouse needs best friend ,7.74,5.74,6.74
 magical way end magical day ,25.02,21.34,21.75
 dream come true ,13.69,9.64,11.53
 ghosts dying meet ,4.42,6.19,3.55
 welcome happiest place ,0,0,0
 understand hard contain excitement ,19.85,17.79,18.54
 fantasmic way end fantastic day ,10.1,9.44,10.29
 sleeping beauty castle ,15.25,11.08,11.96
 mike sulley drop kick monstrous summer 24 hour nighter disneyland disney california adventure parks starting 24th learn monster limited magic event ,30.37,26.58,28.07
 indiana jones possibly wrong ,2.93,4.67,3.3
 favorite friends waiting ,7.74,5.74,6.74
 sweet start week ,12.99,10.34,10.28
 guess ,0,0,0
 like room view ,13.04,10.4,10.93
 buzz lightyear kind big deal ,7.59,4.46,5.95
 best disneyland souvenir gotten ,0,0,0
 tea ,5.87,4.13,5.71
 soar land peter pan ,18.02,14.87,16.9
 word met mickey ,0,0,0
 happy 10th birthday adventures winnie pooh whimsical journey acre woods disneyland park ,35.17,29.72,30.61
 night disneyland dream suite ,20.04,16.06,15.71
 ready arrival ,6.23,5.23,6.55
 make splash dropping critter country ,5.93,5.26,5.96
 yay nay exploring deep sea finding nemo submarine voyage ,13.25,10.38,10.46
 weather warming disney parks blog tasty suggestions cooling check 10 cool alcohol free drinks disneyland park disney california adventure ,34.32,26.96,29.16
 april fools day fun prankster crime ,17.92,17.63,16.8
 share prince princess life ,21.38,17.55,17.63
 dead men tell tales ,21.76,20.79,20.04
 whoooooo hoping visit disneyland park ,0,0,0
 stop spin mickey toontown ,3.96,4.26,4.89
 share picture love disneyland resort ,8.72,6.44,7.11
 zero ,0,0,0
 true false know words small world ,27.4,24.03,26.46
 way mountain ,6.59,5.49,5.46
 limited magic help decide long lost disney friends drop disneyland resort head disney parks blog cast vote march 21 ,28.28,27.06,27.64
 sweet dreams ,21.51,16.97,16.27
 enter dare ,5.76,6.57,5.0
 yay nay waking extra early park ,0,0,0
 know force ,6.93,5.77,6.9
 princes princesses land hear ye hear ye fantasy faire open disneyland park ,20.1,15.37,17.55
 thumbs wish work day ,23.23,19.81,20.52
 best day ,6.66,5.0,5.88
 remember dreams come true ,20.83,16.12,16.91
 grow ,0,0,0
 familiar faces starting arrive fantasy faire opening week disney parks blog offers look ,19.15,14.56,17.02
 yay nay exploring mickey incredible imagination fastasmic ,0,0,0
 true false mickey soundsational parade puts mood dance ,26.95,24.38,25.94
  mine mine mine  ,0,0,0
 gets vote best picture ,6.63,5.3,6.93
 beautiful day drive ,14.26,11.17,12.17
 stopping mickey toontown visit favorite toon friends ,7.74,5.74,6.74
 making new friends ,7.74,5.74,6.74
 visit disney post exciting look lunar new year festivities taking place hong kong disneyland february 24 read ,5.41,4.22,5.25
 like hope day filled love happy valentine day ,52.93,41.06,42.24
 attraction soon enter park ,0,0,0
 ready follow dark sinister path snow white flees foreboding forest avoid wrath evil queen ,56.67,57.3,57.27
 yay nay enjoying shops main street ,5.22,3.39,4.81
 looking fairytales right way ,6.45,4.79,6.38
 true love air valentine day celebrate romantic day year week long limited magic come celebrate week february 11 17 2013 ,67.88,52.3,56.95
 today ,0,0,0
 minnie love stop say hello ,12.68,10.7,12.0
 disney royalty thing coming new fantasy faire sure stop maurice treats adorable new food cart area opens march 12 ,57.57,44.62,50.81
 like introduce 999 ghosts ghouls goblins dying meet ,11.94,12.82,8.96
 princesses come different sizes ,0,0,0
 know surprises reach finish line ,22.46,18.21,17.7
 mickeys ,0,0,0
 honor sleeping beauty premiere 54 years ago today visit disney post story iconic disney parks landmarks sleeping beauty castle ,42.77,31.52,34.91
 feel like monday morning ,7.52,6.63,5.41
 rail sea wrong way disneyland resort ,9.93,9.5,8.58
 congratulations mickey toontown celebrating 20 years founded day 1993 ,12.07,9.22,11.13
 yay nay space mountain favorite disneyland mountain ,19.96,16.12,16.12
 little disney today ,0,0,0
 february 27 2013 advantage special discounted ticket offer disneyland resort additional information visit ,12.41,10.55,11.5
 treasured disneyland souvenir ,0,0,0
 come enjoy day friends ,22.57,17.07,19.02
 favorite spot disneyland picture ,0,0,0
 conquered perilous peaks matterhorn mountain ,6.59,5.49,5.46
 yay nay getting swept away swinging south seas celebration enchanted tiki room ,12.52,8.6,10.8
 make wish disney princess ,14.17,10.62,11.6
 happy birthday star tours official jump lightspeed disneyland park day 1987 ,29.98,24.0,23.08
 ready adventure ,13.83,12.21,13.01
 day disneyland resort uplifting experience ,6.66,5.0,5.88
 days left disneyland holidays season miss ,0,0,0
 rose parade fans floored destination cars land float watch float cruise today disney parks blog ,32.7,25.22,28.84
 happy new year magical 2013 ,21.08,16.66,17.61
 new year ready 2013 ,11.64,9.45,11.8
 favorite disneyland memory 2012 ,6.62,5.42,5.11
 merry christmas happy holidays family ,31.56,23.46,24.64
 marching toy soldiers santa claus far ,12.79,10.59,11.78
 continue prepare year destination cars land float look 75 year tradition disney involvement annual rose parade disney parks blog ,24.21,18.84,23.01
 yay nay new orleans square trading colorful mardi gras beads christmas ornaments ,18.08,13.56,14.49
 dreams come true ,20.83,16.12,16.91
 thumbs loving disneyland holidays ,13.8,10.75,11.54
 happy birthday walt disney ,16.05,13.17,12.52
 true false daytime nice nighttime disneyland holidays come life ,27.79,23.34,25.6
 santa mrs claus trip north pole host jingle jangle jamboree big thunder ranch ,12.09,10.65,10.32
 cruise route 66 celebrate disneyland holidays cars land ,20.56,16.23,18.14
 lasting rivalry good vs evil hits wonderground gallery downtown disney district december 15 choose images unveiled disney parks blog ,21.06,21.62,21.27
 lasting rivalry good vs evil hits wonderground gallery downtown disney district december 15 choose images unveiled disney parks blog ,21.06,21.62,21.27
 love experience disneyland holidays best friend share picture let know ,23.39,17.95,20.75
 day 1997 small world received holiday overlay seeing lights brightens day ,27.37,21.91,23.32
 select nights come pool deck stay disney paradise pier hotel special viewing disneyland fireworks including piped music ,50.77,39.07,39.43
 exactly month away christmas celebrating ,12.95,10.3,10.22
 true false holiday season favorite year visit disneyland resort ,26.93,23.75,25.85
 disney souvenir want holiday season ,12.8,12.59,10.84
 memories thankful happy thanksgiving loved ones ,37.84,28.73,29.56
 yay nay having disneyland day ,6.66,5.0,5.88
 celebrate season sending merrier holiday cards friends family little help favorite disney pals course create available mobile ,35.34,27.31,30.5
 know small world disneyland attraction offer disney fastpass service day 1999 fastpass thankful ,26.98,20.43,23.36
 day 1993 partners statue walt disney mickey mouse joining hands dedicated disneyland park taken picture nostalgic icon ,23.71,18.07,21.92
 disneyland holidays ,0,0,0
 beware haunted mansion holiday fright dreadful delight survive holidays ,39.5,42.73,35.54
 happiest place got merrier mater ringing disneyland holidays january joining watch video ,13.08,9.77,11.14
 ready glow snow disneyland park beginning november 12 believe holiday magic fireworks spectacular wear glow ears learn disney parks blog ,41.76,34.5,36.6
 yay nay going spin disneyland resort ,0,0,0
 dead men tell tales ,21.76,20.79,20.04
 yay nay acting little goofy mickey toontown ,0,0,0
 combine disney parks photographers various styles backgrounds brand new tumblr account peek looking glass ,11.57,9.63,10.64
 months left 2012 joining year ,10.56,8.25,10.1
 hi everybody ,0,0,0
 pumpkin sculptors creating works art halloween carnival big thunder ranch jamboree disney parks blog ,17.41,16.17,15.01
 best disneyland halloween ,0,0,0
 know tinker bell flying disneyland park fireworks 1961 pixie hollow home fairy friends day 2008 ,48.41,36.09,41.46
 yay nay spending downtown disney district visiting disneyland resort ,0,0,0
 trick treat mickey pals disneyland halloween click link start filling bag treats forget invite friends available mobile ,30.4,28.08,26.45
 wicked good treats disneyland halloween frightfully delectable dishes tried far discover ghoulishly fun favorites disney parks blog ,29.78,28.42,28.19
 morning mickey pals helped unveil story ice castle heart times square new york city kicking limited magic 52 weeks magical surprises unexpected experiences disney parks 2013 true love long lost friends pirates villains discover extra sprinkles pixie dust await disney parks blog ,98.77,84.72,82.79
 holiday visit hundredth new experience holidays bringing disneyland park holiday disneyland park guided tour offered november 12 january pricing booking information 714 781 8687 tour learn disney parks blog ,22.25,18.57,18.94
 share photo wish enjoying view disney grand californian hotel spa ,27.72,20.41,21.56
 candy makers plenty tricks sleeves halloween season discover oooey gooey ghoulish delights disneyland resort candy kitchens ,33.79,27.38,26.73
 hear hotel ups downs recommend drop experience ,6.0,4.8,5.12
 true false stay fireworks ,21.52,19.61,19.81
 dare test legend big thunder mountain ,18.74,16.94,16.0
 spooky surprises await corner mickey halloween party favorite thing party eerie images disney parks blog ,37.28,33.07,28.17
 briar patch right way ,6.45,4.79,6.38
 happiest place got spookier merrier times far disneyland holidays officially arrive november 12 2012 spirit disney parks blog ,12.31,10.2,10.45
 anybody ,0,0,0
 yay nay adding bit minnie mouse makes day better ,6.66,5.0,5.88
 best thing downtown disney district ,4.83,4.17,4.77
 worry elephants trunks ,13.88,15.77,12.8
 soarin late week shared photos video space shuttle endeavour making historic flyover disneyland resort nasa photographers able capture sky ,40.31,29.39,33.58
 window gibson girl ice cream parlor changed original photo taken 1960 love nostalgia main street ,44.81,32.22,38.84
 ahoy like come aboard ,7.52,6.63,5.41
 soarin spottheshuttle ,0,0,0
 looking bite eat disneyland restaurant typically head ,20.86,16.8,17.36
 know 300 sculpted pumpkins main street alike discover frightening facts disneyland halloween disney parks blog ,17.7,13.45,17.28
 jack skellington taken haunted mansion create haunted mansion holiday discover goes magical makeover disney parks blog ,36.28,30.35,29.64
 disneyland halloween better way ready frighteningly fun gear treat disney parks blog ,21.96,18.07,19.13
 yay nay cruising aboard mark twain riverboat rivers america ,6.85,4.51,5.1
 explored depths tomorrowland lagoon know ,6.93,5.77,6.9
 labor day marks unofficial end summer fun stop disneyland resort upcoming season excited celebrating disneyland halloween disneyland holidays ,22.43,20.92,21.98
 happy birthday big thunder mountain railroad wildest ride wilderness day 1979 ,29.3,23.66,23.86
 good day pineapple dole whip agree ,21.13,15.02,18.57
 bit winter woods coming pixie hollow frost fairy periwinkle disney secret wings joins tinker bell beginning mid september ,35.86,28.89,31.97
 places explore like head ,14.15,12.33,11.44
 know popularity small world replicated disney resort world ,19.93,16.41,17.42
 tasty tour newly updated candy kitchen main street disney parks blog video ,19.06,13.64,15.91
 start weekend like join ,7.52,6.63,5.41
 happy anniversary dumbo flying disneyland sky day 1955 ,22.24,15.76,17.67
 holiday season history candlelight ceremony processional extended total 20 nights stay tuned disney parks blog information ,24.59,21.27,21.17
 ready scream ,10.11,12.27,11.3
 sing disney small world storybook app languages learn disney parks blog ,20.42,16.44,16.97
 opens mouth eating comes goes geppetto ,5.46,4.79,5.93
 happy anniversary haunted mansion opened gates ghoulish grounds day 1969 ,32.99,26.18,28.24
 repeat hakuna matata ,0,0,0
 hear neon summer agree ,7.0,4.59,6.28
 set sail safari uncharted waters fearless skipper ,6.61,4.97,5.08
 hard work spectacular live entertainment experience fantasyland theatre set debut summer prepare princess fantasy faire closing august 12 look favorite disney princesses path small world new fantasy faire opens spring learn ,58.23,47.19,52.71
 ready make splash ,6.23,5.23,6.55
 sun sets disneyland park new opportunity emerges love photography ,23.68,17.95,19.86
 disneyland vacation ,8.16,5.64,6.8
 stop visit mickey toontown neighbors including minnie mouse ,3.96,4.26,4.89
 come happy place welcome happy 57th birthday disneyland ,24.26,19.66,19.15
 foolish mortals fear friday 13th ,6.3,11.42,7.34
 met prince dream ,13.76,10.6,11.12
 mickey looks dressed 1929s ,0,0,0
 perfect disneyland day definitely include ,6.66,5.0,5.88
 paws moment say hi pals pluto goofy ,5.76,3.83,4.81
 hope lose sight thing started mouse walt disney ,21.27,19.27,19.09
 disneyland amusement park walt disney ,7.96,6.22,5.74
 looking good mickey ,7.47,5.43,6.41
 like visited mickey house ,14.78,11.19,11.49
 happy birthday walt ,16.05,13.17,12.52
 best day visit disneyland resort ,6.66,5.0,5.88
 celebrate mother day gifts burberry visit flagship store 121 regent street discover bespoke floral bouquets inspired fragrances partnership rebel rebel ,54.21,41.93,45.91
 introducing burberry festive film celebrating 15 years billy elliot starring british cast including sir elton john julie walters james bay romeo beckham james corden naomi campbell rosie huntington whiteley george ezra michelle dockery ,24.1,20.62,21.24
 discover w15 accessories cashmere scarves sneakers seasonal prints warming gloves hats discover burberry accessories festive season ,19.1,15.75,17.52
 celebrate mother day gifts burberry visit flagship store burberry 121 regent street discover bespoke floral bouquets inspired fragrances partnership rebel rebel ,54.21,41.93,45.91
 discover w15 accessories cashmere scarves sneakers seasonal prints warming gloves hats discover burberry accessories festive season ,19.1,15.75,17.52
 celebrate mother day gifts burberry visit flagship store burberry 121 regent street discover bespoke floral bouquets inspired fragrances partnership rebel rebel ,54.21,41.93,45.91
 explore seasonal women accessories burberry including signature bags summer shoes limited edition box set works bruce chatwin ,16.79,14.95,16.33
 explore seasonal women accessories burberry including signature bags summer shoes limited edition box set works bruce chatwin ,16.79,14.95,16.33
 explore seasonal women accessories burberry including signature bags summer shoes limited edition box set works bruce chatwin ,16.79,14.95,16.33
 spring summer 2015 childrenswear collection featuring runway prints heritage trench coats ,7.76,5.67,6.26
 explore seasonal women accessories burberry including signature bags summer shoes limited edition box set works bruce chatwin ,16.79,14.95,16.33
 introducing gabardine collection eyewear burberry spring summer 2015 starring naomi campbell jourdan dunn ,7.76,5.67,6.26
 naomi campbell jourdan dunn trench coats patent trims cashmere scarves vibrant hues spring summer 2015 ,13.05,9.17,11.16
 happy valentine day burberry love ,31.7,23.99,25.43
 suki waterhouse george barnett star campaign burberry brit rhythm intense men floral women sample new fragrances ,40.43,32.6,34.08
 explore seasonal women accessories burberry including signature bags summer shoes limited edition box set works bruce chatwin ,16.79,14.95,16.33
 explore seasonal women accessories burberry including signature bags summer shoes limited edition box set works bruce chatwin ,16.79,14.95,16.33
 introducing gabardine collection eyewear burberry spring summer 2015 starring naomi campbell jourdan dunn ,7.76,5.67,6.26
 spring summer 2015 childrenswear collection featuring runway prints heritage trench coats ,7.76,5.67,6.26
 explore seasonal women accessories burberry including signature bags summer shoes limited edition box set works bruce chatwin ,16.79,14.95,16.33
 celebrate mother day gifts burberry visit flagship store burberry 121 regent street discover bespoke floral bouquets inspired fragrances partnership rebel rebel ,54.21,41.93,45.91
 celebrating new year burberry lunar new year campaign scenes romeo beckham cast dancers ,28.01,23.87,26.74
 celebrate mother day gifts burberry visit flagship store burberry 121 regent street discover bespoke floral bouquets inspired fragrances partnership rebel rebel ,54.21,41.93,45.91
 celebrate mother day gifts burberry visit flagship store burberry 121 regent street discover bespoke floral bouquets inspired fragrances partnership rebel rebel ,54.21,41.93,45.91
 celebrate mother day gifts burberry visit flagship store burberry 121 regent street discover bespoke floral bouquets inspired fragrances partnership rebel rebel ,54.21,41.93,45.91
 celebrating new year burberry lunar new year campaign scenes romeo beckham cast dancers ,28.01,23.87,26.74
 celebrate mother day gifts burberry visit flagship store burberry 121 regent street discover bespoke floral bouquets inspired fragrances partnership rebel rebel ,54.21,41.93,45.91
 celebrating new year burberry lunar new year campaign scenes romeo beckham cast dancers ,28.01,23.87,26.74
 celebrate mother day gifts burberry visit flagship store burberry 121 regent street discover bespoke floral bouquets inspired fragrances partnership rebel rebel ,54.21,41.93,45.91
 celebrating new year burberry lunar new year campaign scenes romeo beckham cast dancers ,28.01,23.87,26.74
 celebrate mother day gifts burberry visit flagship store burberry 121 regent street discover bespoke floral bouquets inspired fragrances partnership rebel rebel ,54.21,41.93,45.91
 celebrating new year burberry lunar new year campaign scenes romeo beckham cast dancers ,28.01,23.87,26.74
 celebrate mother day gifts burberry visit flagship store burberry 121 regent street discover bespoke floral bouquets inspired fragrances partnership rebel rebel ,54.21,41.93,45.91
 celebrating new year burberry lunar new year campaign scenes romeo beckham cast dancers ,28.01,23.87,26.74
 celebrating new year burberry lunar new year campaign scenes romeo beckham cast dancers ,28.01,23.87,26.74
 celebrating new year burberry lunar new year campaign scenes romeo beckham cast dancers ,28.01,23.87,26.74
 burberry festive film tells tale young couple falling love ,43.68,34.5,34.84
 new accessories autumn winter 2014 inspired prorsum runway collection features bloomsbury bag hand painted leather floral motif scarves umbrellas screen printed iconic landmarks globe ,30.35,23.93,27.38
 new accessories autumn winter 2014 inspired prorsum runway collection features bloomsbury bag hand painted leather floral motif scarves umbrellas screen printed iconic landmarks globe ,30.35,23.93,27.38
 chelsea jesper shot daan district taipei art trench taipei discover ,6.68,4.86,5.3
 burberry autumn winter collection bloomsbury canvas check leather ,12.09,9.83,9.94
 discover burberry eau toilette fresh new fragrance women inspired essence london garden bloom discover ,40.53,30.66,35.13
 discover burberry eau toilette fresh new fragrance women inspired essence london garden bloom discover ,40.53,30.66,35.13
 discover burberry eau toilette fresh new fragrance women inspired essence london garden bloom discover ,40.53,30.66,35.13
 iconic british models kate moss cara delevingne shot new burberry fragrance campaign ,17.76,14.36,14.54
 founded thomas burberry 1856 discover history brand selection images heritage archive ,5.24,3.93,4.83
 founded thomas burberry 1856 discover history brand selection images heritage archive ,5.24,3.93,4.83
 new accessories autumn winter 2014 inspired prorsum runway collection features bloomsbury bag hand painted leather floral motif scarves umbrellas screen printed iconic landmarks globe ,30.35,23.93,27.38
 new accessories autumn winter 2014 inspired prorsum runway collection features bloomsbury bag hand painted leather floral motif scarves umbrellas screen printed iconic landmarks globe ,30.35,23.93,27.38
 founded thomas burberry 1856 discover history brand selection images heritage archive ,5.24,3.93,4.83
 new accessories autumn winter 2014 inspired prorsum runway collection features bloomsbury bag hand painted leather floral motif scarves umbrellas screen printed iconic landmarks globe ,30.35,23.93,27.38
 new accessories autumn winter 2014 inspired prorsum runway collection features bloomsbury bag hand painted leather floral motif scarves umbrellas screen printed iconic landmarks globe ,30.35,23.93,27.38
 founded thomas burberry 1856 discover history brand selection images heritage archive ,5.24,3.93,4.83
 featuring guests including tom felton jourdan dunn tinie tempah david gandy ,0,0,0
 discover new collection featuring runway inspired accessories vibrant pastels painterly tones bags scarves shoes updated graphic prints check details spring summer 2014 ,26.65,20.31,24.03
 discover new collection featuring runway inspired accessories vibrant pastels painterly tones bags scarves shoes updated graphic prints check details spring summer 2014 ,26.65,20.31,24.03
 discover new collection featuring runway inspired accessories vibrant pastels painterly tones bags scarves shoes updated graphic prints check details spring summer 2014 ,26.65,20.31,24.03
 discover new collection featuring runway inspired accessories vibrant pastels painterly tones bags scarves shoes updated graphic prints check details spring summer 2014 ,26.65,20.31,24.03
 burberry brings london city 24 april 2014 night celebrations heart shanghai ,19.48,17.52,15.97
 heritage trench coats miniature boys girls new burberry childrenswear s14 campaign ,6.87,4.29,5.8
 signature details burberry heritage trench coat year old design proudly england fits colours explore burberry heritage trench coat ,14.27,11.82,13.75
 discover new collection featuring runway inspired accessories vibrant pastels painterly tones bags scarves shoes updated graphic prints check details spring summer 2014 ,26.65,20.31,24.03
 discover new collection featuring runway inspired accessories vibrant pastels painterly tones bags scarves shoes updated graphic prints check details spring summer 2014 ,26.65,20.31,24.03
 bloomsbury girls view runway looks burberry womenswear w14 ,6.87,4.29,5.8
 discover new collection featuring runway inspired accessories vibrant pastels painterly tones bags scarves shoes updated graphic prints check details spring summer 2014 ,26.65,20.31,24.03
 introducing burberry beauty box london covent garden new concept make fragrance fashion ,27.64,20.13,22.69
 burberry celebrates year horse special gift collection featuring iconic check accessories soft cashmere scarves bright leather bags ,33.69,24.28,27.78
 wishing happy new year burberry love ,22.34,17.15,18.99
 burberry wishes facebook fans merry christmas ,29.15,22.22,22.62
 burberry festive gifts adorn london skyline night christmas ,41.94,34.77,31.93
 cara delevingne edie campbell romeo beckham wearing burberry prorsum new spring summer 2013 campaign ,7.76,5.67,6.26
