 led bulbs consume 85 energy incandescent bulbs 50 saturday february 14 monday february 16 2015 plus led bulb buy ikea foundation donate help refugee agency unhcr create brighter safer life children living temporary settlements world ,53.84,46.23,49.49
 start day monday february 16 2015 99 breakfast plate free 11am ,20.22,14.15,17.78
 ikea family presents byof day bring friends click rsvp day ikea perks friends saturday march 2015 ikea store ,49.33,36.4,43.07
 check new offers help make bedroom real place recharge ,0,0,0
 start morning right organizational accessories new sprutt collection ,6.45,4.79,6.38
 excited new sektion kitchens learn updated organization lighting layout features local ikea store ,13.08,10.39,12.34
 brand new sektion kitchens designed choice function style easier create kitchen ,20.55,16.34,18.86
 want fans using ikea homes explore share space add ikea home photos ,40.98,30.08,32.57
 help make refugees lives little brighter ikea foundation donate unhcr ledare led bulb purchased sunday february saturday march 28 2015 funds generated help improve access lighting renewable energy primary education refugee camps asia africa middle east ,47.07,42.2,44.59
 check tips creating versatile living room ready ideas room home ikea project guide ,32.18,22.84,29.75
 check new ikea family offers february hemnes queen bed frame 144 ikea family members tuesday march 2015 ,35.08,23.0,29.67
 create flexible workspace ways set home office small large ,19.94,14.04,17.38
 make ikeanewyear real solution month vote favorite idea chance win product ,33.18,28.29,30.07
 brand new sektion kitchen designed convenience ways organize tools check ikea store starting monday february 2015 ,11.12,9.33,11.67
 new tv big game make complete customizable media storage best storage 15 ikea family members tuesday january 27 2015 ,28.63,21.47,24.36
 late ikeanewyear check ideas real solutions vote favorite win ,22.01,18.88,20.58
 50 ideas new home project guide make home work look feel better ,26.78,19.39,22.17
 looking 2015 resolution pick ikeanewyear real solution win ikea product help ,8.38,7.72,7.39
 design inspiration ikea fans like check share space ,20.66,16.66,15.94
 home comfort foam latex mattresses 15 ikea family members new flyer ,34.53,23.23,28.14
 handy skog cart gives extra storage space home ideas ikeahometour squad ,34.4,25.73,28.4
 choose favorite ikeanewyear real solution win product ,8.38,7.72,7.39
 new year new clothes check customizable pax komplement wardrobes 15 ikea family members tuesday january 27 2015 ,31.52,24.51,28.87
 slow morning rush need arm reach check ikea ideas bathroom smart design ,33.72,29.0,31.98
 use little help improving first59 minutes day check ways create organized bedroom dreams ,27.32,21.76,22.68
 comes storage space look shelving bathroom help stay organized first59 tips ,12.33,9.02,10.85
 check new ikea offers help organize year ahead ,5.41,4.22,5.25
 save right need entertain home check ikea ideas ,27.81,19.81,24.54
 best way improve first59 minutes day good night sleep comfy bed explore bedroom ideas ,49.55,34.33,41.66
 real life party furniture lets spend serving enjoying explore entertaining ideas ,33.66,28.34,29.23
 explore ikea holiday home ideas pinterest ,22.46,16.66,18.46
 check latest ikea offers help finishing touches festive holiday home ,29.07,23.57,23.78
 sprinkle holiday magic room explore ikea holiday collection ,20.62,16.95,18.12
 education children knowledge skills confidence need build better future soft toy purchase january 2015 help ikea foundation support children education worldwide ,48.69,39.32,42.39
 expertly organize bathroom drawers ease check tips products make first59 minutes day run smoothly ,19.14,12.34,18.24
 chance rated akurum kitchen save 20 new kitchen sunday november 30 2014 ,12.47,10.33,10.64
 save 50 soft toys weekend friday november 28 sunday november 30 2014 plus soft toy buy ikea foundation donate unicef save children offers new flyer ,41.03,28.75,36.79
 buy ikea soft toy help soft toy sold jan 2015 ikea foundation donate unicef save children support children education 2003 annual soft toys education campaign raised 90 4m impacting 11m children ,62.08,45.02,55.18
 click check holiday ikea gift baskets enter win special person list winikea ,35.47,28.27,30.32
 holiday movie tradition upgrade click check best storage units 15 ikea family members tuesday december 23 2014 ,33.48,25.1,27.71
 baker life check win themed gift baskets special list winikea ,28.87,23.51,24.39
 check newest ikea offers help create welcoming home holidays ,14.7,9.96,11.79
 makes family celebrations unforgettable guide creating holiday memories ,29.3,22.91,23.29
 make impressive entrance tjusig hallway storage 20 ikea family members tuesday november 25 2014 ,13.48,9.83,11.3
 stumped perfect gift enter win ikea gift basket best matches special life winikea ,36.64,29.65,29.91
 dark earlier check new lighting trends cozy home shining bright ,32.91,22.24,26.37
 want ikea history want story billy bookcase klippan sofa click share exhibition ikea museum sweden ,34.44,28.0,30.87
 tis season entertain ahead home inspiration ways save ,14.36,9.16,11.9
 expecting family town soon stock bedside table carafe water good books ideas ,45.6,32.44,38.16
 party ends kitchen ready guests save 20 new ikea kitchen right ,30.43,26.1,29.17
 72 americans think stressful morning affects rest day ways stress first59 ,15.16,17.79,16.19
 gotta love halloween falls friday check tips planning haunting halloween party ,20.67,17.83,16.94
 bright bold soft natural home style inspired ikea fan spaces share space ,69.81,50.48,58.52
 long planning new kitchen save 20 right rated kitchen ,12.9,9.74,12.38
 seeing splash color open eyes gets adrenaline going makes easier wake first59 tips ,12.88,9.25,11.24
 love home fall make better new offers favorite products plus details save 20 rated ikea kitchen ,32.72,24.4,28.22
 start day organized bathroom storage space helps godmorgon bath cabinets coordinating sinks faucets 20 ikea family members tuesday october 28 2014 ,44.85,31.44,39.17
 explore share space ikea inspired spaces fans mobile ,27.07,21.19,22.4
 miss new 2015 ikeacatalog explore online ,0,0,0
 add color world paper shop check new collection ,18.72,12.55,15.9
 ready make bed check email eat breakfast tips keeping busy morning track ways improve first59 minutes day ,39.71,29.8,35.68
 happy fall like season colors cor best look ,26.84,22.55,22.21
 introducing paper shop new collection exquisite paper products notepads gift wrap decorations check ,18.17,11.14,14.46
 enjoy new 2015 ikeacatalog online check digital version design inspiration need ,8.17,6.33,6.4
 design new space skip heavy lifting learn picking delivery service ,23.77,20.81,21.01
 sharing tips help transform first59 minutes day morning madness great start ,11.03,10.8,10.41
 looking perfect kitchen inspiration dream ikea kitchen ,6.73,4.53,5.53
 happy friday september chance win 100 ikea gift card home need order make morning little better leave comment post answers question randomly selected win official rules ,66.97,56.24,56.59
 ikeahometour squad highlights ultimate clothing storage solution pax closet keeps wardrobe organized smallest items like jewelry sunglasses home ideas ,51.49,39.38,44.72
 great day starts good morning good mornings start home sign receive 2015 ikeacatalog ,29.51,20.07,24.6
 celebrate creativity school year check 10 ideas delight children child ,39.59,32.19,33.08
 work pleasant space works malm desks drawer units 20 ikea family members tuesday september 30 2014 offers ,38.43,32.97,35.38
 know 2015 ikeacatalog available 69 printed editions 33 languages 47 countries territories sign copy flip pages 104 105 inspired room ,25.53,20.82,25.05
 ikea miami opens doors tomorrow august 27 2014 join festivities giveaways continue sunday click details ,10.68,7.9,9.9
 make good days happen check ways improve everyday life home click ,30.3,21.35,24.11
 remember age bedroom favorite place hang check ways help kids create room love ,38.69,31.98,33.95
 home improvement big renovation explore guide simple solutions area home ,27.77,15.95,23.13
 packing big college make sure forget thing ,14.33,14.17,14.35
 new ikeahometour makeover squad helps sandra create dining entertaining area small living space home ideas squad ,45.09,35.14,38.02
 smart organization effortless style make easy morning check bathroom design ideas ,34.4,25.48,31.32
 personal spaces big living sign receive 2015 ikeacatalog inspired ways refresh recharge home ,21.84,15.37,17.77
 think dream kitchen reach think save 20 new ikea kitchen proud ranked highest customer satisfaction kitchen cabinets power 2014 kitchen cabinet satisfaction study sm ,66.05,52.91,61.29
 best college room big style budget check ideas help design home away home ,35.16,23.41,29.22
 diy watch ikeahometour squad create hideaway play table perfect puzzles games check home ideas squad ,58.94,46.04,50.1
 kitchen need exactly way want check save 20 new ikea kitchen ,11.7,10.95,10.54
 check entire 2015 ikeacatalog right online extra features browse digital version inspiration ,6.45,4.79,6.38
 bath towels check door hangers got em use college checklist make sure forget thing ,32.54,26.32,31.14
 tobias chair adds modern flair dining table desk check ikea family products save month ,34.21,23.88,31.43
 ikeahometour squad helped sisters bedroom ideas needed personalize organize spaces squad ,32.4,26.81,25.93
 know ranked highest customer satisfaction kitchen cabinets power 2014 kitchen cabinet satisfaction study sm check save 20 brand new kitchen ,45.4,37.91,43.16
 inspiration day begins ends 2015 ikeacatalog ,10.1,9.44,10.29
 send college checkmark ,0,0,0
 check organization tricks smart solutions home lot going explore new brochure ,20.81,16.21,17.27
 2015 ikeacatalog cover shot sunrise sunset illustrates beginning end day home sign receive copy pages ways make life little moments bit better ,52.78,37.63,43.77
 inspirational design latest style trends fun decorating tips design ikea blog ,20.59,17.61,16.84
 turn volume dorm room waking roommate personalize space bold patterns cheerful prints ,27.2,20.87,24.18
 new ikea home tour episode small studio apartment dire need designated space storage working eating entertaining watch comes ,33.3,23.31,28.99
 hey miami celebrating upcoming ikea store opening cafecito truck showroom complimentary ikea coffee treats neighborhood ,18.76,15.46,17.11
 ahead curve picks school essentials ,9.9,9.51,10.19
 start taking inventory new college space sweat easy checklist ,13.88,9.62,12.2
 kitchen remodel long overdue save 20 new ikea kitchen ,6.45,4.95,6.0
 ready 2015 ikeacatalog arriving stores august week secret cover revealed products featured ,17.51,14.61,17.47
 brand new brochure brimming smart solutions room style organization fix ,20.27,15.03,17.93
 check great ideas dorm cor send school style ,18.18,15.66,16.9
 ikeahometour squad shows easy update look bedding ikea comforters duvet covers watch squad ,24.04,18.96,21.91
 healthy kid meal purchased ikea restaurant thursday july 31 2014 ikea donate feeding america 50 000 helping fight childhood hunger learn ,41.33,38.93,40.41
 send college style customizable storage cooking basics college essentials fit personality budget ,14.3,11.24,11.14
 turn outdoor space little getaway share ikea space ,13.56,10.28,10.4
 getting excited college check ideas bring new home school ,19.27,14.51,17.16
 tuesday check simple sewing projects conquer sy sewing machine favorite textiles ,18.45,14.34,18.58
 hunt begins looking affordable furniture campus college housing inspired ,19.15,14.98,17.22
 says summer relaxing dining outdoors check ideas creating favorite spot eat outside ,21.94,17.47,18.13
 check college living space ideas pinspiration new home away home ,29.6,19.42,23.26
 college digs decorate moving dorm campus housing check ways express personal style new space ,26.6,20.43,21.92
 kitchen place make meals dream new recipes signature dishes hone cooking skills check ways improve dream kitchen ,45.92,35.9,40.82
 need father day gift ideas inspiration ,28.51,22.92,23.29
 new ikeahometour episode watch week squad makes good use space awkward shaped family room create places dining doing homework ,54.12,44.26,47.11
 sleek sophisticated barometer work lamp adds style desk check new ikea family offers ,28.5,23.1,26.57
 congrats class 2014 ready think new home college let ikea inspired ,32.07,24.73,30.3
 love long summer days join june 13 2014 celebrate midsummer traditional swedish sm rg sbord check local store webpage tickets ,20.11,17.23,18.25
 new ikeahometour episode squad helps pereira family complete master bedroom makeover check transform space ,28.18,20.88,23.33
 share space place design inspiration ikea fans check ,13.14,10.03,10.53
 know ikea fans crafty creative exceptional enter video ikea love contest win 500 ikea gift card details ,56.62,45.16,48.8
 ikea love use creativity love ikea best effort video win 500 ikea gift card learn ,53.65,42.23,44.81
 create beautiful summer inside check new deals ikea store ,20.32,16.92,18.18
 new episode ikeahometour squad uses ikea kitchen cabinets add extra work space room storage craft room watch makeover ,44.73,35.21,40.55
 ikeahometour design tips squad make small bedroom thanks fans giving ikeahometour videos million views ,19.24,15.75,15.87
 new episode ikeahometour squad helps case family bedroom makeover including dream pax closet meet storage needs watch ,30.95,23.19,27.49
 love warmer season new flyer ways save click check ,15.17,11.39,13.11
 sunday april 27 2014 day save 20 brand new ikea kitchen tops list kitchen improvements ,13.11,9.95,11.88
 spring savings click new offers inspiration let home come life ,22.94,15.9,17.88
 check instagram daily home design beauty shots best spaces created ikea fans ,28.87,19.19,21.96
 new episode ikeahometour squad heads brooklyn living room ideas help family create organized space watch makeover living room storage options transform room ,69.26,52.59,62.42
 long thinking new kitchen check kitchen designs ,0,0,0
 spring deals check new offers things need organized fresh start ,12.59,9.84,11.03
 started dreaming outdoor dining ikea family members save falster table month ikea family offers ,37.95,26.53,32.62
 love kitchen check homes fellow ikea fans ideas click share space ikea usa com sharespace ,36.77,26.54,29.8
 ripe save 20 dream kitchen details big improvement kitchen need ,18.73,13.58,16.74
 thank country joined saturday ikeabyof day check photo album tag ,25.57,21.07,22.58
 days ikeabyof day saturday march 2014 friends bringing rsvp details ,19.95,14.84,17.83
 help ring season home improving share save 20 new ikea kitchen right details ,32.69,23.42,28.22
 free ikea blue bag days ikeabyof day special day shopping rewards activities friends wait saturday march 2014 rsvp ,50.09,35.94,42.98
 new flyer blooming deals ideas spring click ready bright sunny mornings ,28.49,22.16,25.41
 feelin crafty national craft month click tips ideas craft zone overtaking home ,33.14,23.5,27.67
 ikea makeover kitchen dark closed avocado vinyl flooring 60s check story ,11.34,9.65,10.31
 throwback ikea customers byof day 2013 rsvp ikeabyof 2014 ikea usa com byof join 3rd annual celebration friendship shopping ikea rewards tbt ,20.67,15.74,18.38
 free breakfast coupon ikeabyof day special day rewards 14 rsvp ikea usa com byof create personalized invitations send friends ,50.07,36.69,42.57
 make bathroom sanctuary check simple ideas improvement ,19.05,13.47,18.01
 matter way turn space cooking snacking using laptop activity goes kitchen ,6.78,5.14,5.2
 ikea gift card giveaways ikeabyof perks rsvp ikea usa com byof tell looking forward saturday march 2014 ,13.38,10.57,11.09
 cor tip add wall shelves art entertainment center create focal point inspiration designing media center ,18.23,14.79,15.6
 weeks byof day saturday march 2014 rsvp ikea usa com byof join enjoy shopping perks friends ikeabyof ,34.4,27.24,30.44
 ikea fan used expedit room divider storage unit check share space inspiration ikea fans ,30.61,22.44,26.49
 click rsvp ikeabyof day special shopping event invite friends enjoy perks rewards march 2014 ,42.79,32.91,37.04
 seize days check day offers feb 15 17 2014 click plan days head ikea store ,29.21,26.99,27.72
 join ikeabyof day bring friends click rsvp learn special day exclusive rewards activities saturday march 2014 plus rsvp entered win 500 ikea gift card ,57.5,44.37,49.32
 love winter wedding february national wedding month check affordable diy ideas big day ,48.96,38.59,42.25
 rsvp freebies ikeabyof day click ,6.66,5.0,5.88
 invited ikeabyof day rsvp check happening miss great day family friends fellow ikea shoppers saturday march 2014 rsvp entered chance win 500 ikea gift card ,56.49,44.21,47.62
 rounded best advice ikea fans howto organize different areas home check thanks helping kick 2014 right getorganized ,36.65,27.76,33.81
 let games begin pinterest play sweepstakes chance win 500 ikea gift card click sign ,42.86,36.49,35.79
 ikea fan turned craft room organized spaces seen ikea space share share space ,38.76,28.78,31.78
 radiant orchid coloroftheyear add shade purple bedroom ,6.73,5.39,5.61
 thinking walk closet space saving solution hallway room wanted inspire dream ,31.21,23.01,28.41
 continue organizational kick storage solutions make room family friends check ikea ideas make home new year ,45.54,33.5,41.17
 closet need function better check algot storage 25 ikea family members ideas howto customize ,25.69,20.26,23.38
 ikea family members save 15 best storage month join ikea family free space need media storage ,47.77,33.9,39.7
 home belong explore new interactive brochure ideas help make inside count ,21.37,15.71,17.91
 happy friday month chance win 100 ikea gift card today known festival sleep best improvement bedroom help sleep better leave comment post answers question randomly selected win official rules ,78.61,61.66,66.36
 blank month determined organize check energizing home ideas brand new interactive brochure ,20.06,14.1,17.01
 seize days post holiday savings need organize save space home week incredible day offers thursday december 26 2013 wednesday january 2014 details ,49.77,40.89,42.67
 soft toy heroes way ikea store soft toy sold ikea stores saturday january 2014 ikea foundation donate help children learn learn ,54.14,39.35,49.22
 bakers pantries bunch check ideas help organize kitchen tools ingredients ,18.77,14.76,17.56
 lot year holiday home need 100 ready check new online flyer ideas ,34.1,26.11,30.26
 tuesday incorporate new pantone color year space check ways make 2014 radiant orchid come alive home ,41.1,29.19,34.52
 deck halls holiday spirit check new online flyer cor baking tools children toys make season bright home ,35.15,26.09,30.03
 chance win 500 ikea gift card upload picture ikea products home help prepare holidays wednesday december 11 2013 day enter official rules ,46.58,37.26,38.24
 delighted announce new ikea store planned st louis missouri excited ,5.93,5.0,6.0
 love space ,15.5,11.58,12.31
 ikea helped prepare holidays chance win 500 ikea gift card enter ,27.78,23.67,23.12
 baaaack seize days offers start friday november 29 2013 ikea store click day offers friday saturday sunday blackfriday ,16.11,16.52,15.14
 like new recipe new kitchen save 20 brand new kitchen sunday december 2013 details ,26.22,21.28,22.72
 kitchn rounds 20 reasons love ikea kitchens reason ,8.72,6.44,7.11
 calling cooks details save 20 brand new kitchen dream kitchen look like ,32.41,24.65,27.29
 ikea holiday style share space win 500 ikea gift card click details enter ,48.46,39.48,40.83
 ikea family member free start saving items need holiday entertaining like henriksdal chair details ,52.7,38.69,44.39
 dining chairs undergo lot wear tear depending family gathers meals need update check new lower price rje chair ,33.23,26.12,29.81
 throwback love greenery seating space family room 1977 ikea catalog cover tbt ,28.67,20.15,23.83
 new online flyer stuffed ways make family special make thanksgiving memorable ,7.65,4.8,6.0
 like hot spices kitchen door handles knobs little things big impact check options match enhance style kitchen ,42.14,34.32,37.76
 reward facebook fans friday month look chance win 100 ikea gift card chance need home ready holiday guests leave comment answering question randomly selected win official rules ,90.97,75.41,77.78
 happy halloween ,8.21,6.49,6.63
 home delivery service focus design details leave transportation learn ,24.44,18.06,21.81
 best kitchen organization tip bring complete kitchen vision life save 20 details ,34.06,25.48,30.31
 check smart ikea spaces designed fans explore share space ,27.85,21.07,22.5
 dress home celebrations big small textiles welcome guests warm home watch textiles remix video inspiration myikeamoment ,41.81,27.38,33.3
 kitchen heart home right save 20 dream kitchen details ,40.48,28.92,34.51
 tuesday design living dining room open floor plan cozy functional fall entertaining check look ,23.47,16.56,20.96
 check kitchen gallery browse designs different styles sizes style myikeamoment ,19.67,14.79,16.01
 tell coziest room home ,13.43,7.98,11.42
 kitchen priority list save 20 dream kitchen fall check online flyer details ,22.82,18.28,20.74
 design inspiration trends tips right fingertips design ikea blog read latest post ,11.85,9.82,10.78
 love cushions visit ikea store check new arrivals peek new online flyer ,14.65,11.44,13.11
 share space place design inspiration ikea fans start exploring ,13.14,10.03,10.53
 enjoy flavors fall dream kitchen save 20 brand new ikea kitchen right check new online flyer details ,37.44,29.4,33.52
 getorganized week home organization project ,13.26,8.59,10.82
 favorite space ,6.78,5.14,5.2
 new ikea stockholm collection features organic colors inspired nature tactile materials elegant proportions learn ,41.66,29.09,35.2
 weather gets cooler help home grow warmer vibrant textiles add cozy room new throws cushions new online flyer ,20.82,11.3,16.31
 new online flyer inspired love fall season click explore home ready fall ,38.19,31.3,34.23
 shoes deserve good home check new lower price hemnes shoe cabinet ,34.45,26.82,31.21
 tarva chest untreated wood provides perfect palette creative vision learn ,25.89,20.16,23.39
 today remember thank work safe ,11.03,8.97,9.92
 tuesday create picture perfect wall collage big small check step step process ,11.55,9.93,10.3
 funky denim design 1973 ikea catalog cover tbt ,0,0,0
 heard ikea catalog app love new design features augmented reality function watch ,14.5,10.54,12.48
 turn space bed dust bunny hangout extra closet ,30.64,21.48,27.37
 new ikeacatalog overflowing design inspiration pick copy ikea store click download digital version sign receive mail ,12.81,10.63,11.67
 fall rhythm ideas new online flyer share prepare home fall ,30.15,25.2,26.39
 national day add vase windowsill ,11.63,8.9,11.29
 save ikea store using picking delivery service items gathered warehouse delivered home create room looks like ,50.51,37.55,44.7
 weekend head ikea store chance save 20 dream kitchen offer ends sunday august 25 2013 ,35.2,30.0,32.61
 college ikea store trip tell planning pick school starts ,17.25,15.74,16.0
 say wow new 2014 ikeacatalog pick copy ikea store click download digital version sign receive mail ,12.81,10.63,11.67
 cooking smart check save 20 brand new kitchen sunday august 25 2013 ,14.38,10.85,12.77
 college meal check tools need graduate frozen pizza cooking dishes ,31.24,26.67,29.55
 know ikea store range services help dream kitchen installed home check ,27.5,19.51,24.33
 miss new 2014 ikeacatalog sign copy download digital version ,0,0,0
 explored new interactive seasonal brochure enter pinterest sweepstakes learn ,7.15,5.39,6.34
 miss chance save 20 dream kitchen summer offer ends august 25 2013 details ,28.19,23.4,25.79
 check college pinterest board discover inspiring ways express style school ,16.0,13.16,15.62
 enter daily august 23 2013 chance win kitchen dreams sweepstakes ,28.27,24.11,22.94
 share great ikea space inspired share space ,20.71,16.3,17.07
 designer anna salander believes bold patterns make people feel good designed tvingen shower curtain anna families children mind ,42.97,32.31,37.91
 new ikeacatalog click sign copy download digital version ,0,0,0
 school reality smart solutions help savor bright days ahead explore new interactive seasonal brochure ,19.79,15.74,18.11
 crash course diy dorm room cor local ikea store buzzfeed ,13.76,15.72,14.96
 dreaming new kitchen lately save 20 ikea kitchen right make dream come true using mobile device click ,26.59,19.38,23.91
 share post favorite ikea buddy check upcoming events taking place local ikea store ,12.14,10.1,11.52
 determined organized school year start stuff drawers order skubb boxes using mobile device click ,9.77,8.66,10.25
 got quick kitchen tip share ikea fans got save 20 new ikea kitchen right ,25.9,21.2,24.28
 new klippan loveseat cover makes statement ,0,0,0
 tuesday design kitchen zones layouts choose appliances kitchen planner ,5.1,4.05,5.05
 brimnes bed frame headboard built drawers help make best use space bed room dust bunnies using mobile device click ,38.46,24.29,33.95
 drum roll 2014 ikeacatalog arrived click sign receive copy download digital version check local ikea store copies available pick shop ,5.93,5.0,6.0
 turn inspire tell unique home ,14.88,9.21,12.24
 think college room blank canvas check 13 ideas help liven space fall ,29.8,24.81,27.36
 cook book way kitchen right save 20 new ikea kitchen design way works using mobile device click ,28.74,23.46,26.93
 create college space duvet covers flexible expedit shelving unit help school space shows style using mobile device click ,37.12,29.58,32.04
 happy hammock day dream adding cozy hammock space ,35.77,24.48,28.13
