 pringles stash safe ,7.07,3.86,5.81
 come far wide pringles ,0,0,0
 caution flavour construction progress ,7.73,6.02,6.76
 pringles ,0,0,0
 weird feeling finish pringles ,14.03,10.37,12.55
 ooooooo say ,0,0,0
 sit eat chip cast line order ,11.93,10.19,10.68
 original champion ,8.44,5.85,6.5
 young jalape practicing kick pringlesxtra ,11.2,10.54,10.8
 retro mr ,0,0,0
 let stomach rumble begin come ,4.82,3.93,4.68
 common sense ,0,0,0
 pop open fun ,8.37,7.22,6.8
 pringlesxtra ,0,0,0
 flavour strong pick happystarwarsday ,7.11,5.92,6.92
 got chips mind snack ,6.68,5.0,6.37
 paradise pringles ,8.72,5.12,6.03
 people defend favourite flavour ,13.4,11.91,12.41
 chips timeless ,0,0,0
 sure pringles stash forget stashright ,9.5,10.0,9.58
 things look like pringles need snack 539 ,12.35,10.8,10.18
 kick yes nights ball firing madness goalie robopop mr legends sydney fc postcode 3023 table days left play july 11 12 sydney come kick details come stay tuned ,44.31,40.37,42.46
 step score suburb sydney fc goals crack pringoooals ,13.01,10.98,12.36
 sydney fc house check ttps bit pringoooals ,7.26,4.56,6.08
 pringoooals soccer reaches fever pitch play right home control robotic ball kicking machine win pringles suburb ,56.94,47.62,53.63
 oh mention sydney fc goals 9pm hit ,11.45,12.17,11.4
 running play pop play game think beat current scores head midnight 31 click terms conditions ,43.4,37.29,38.01
 want play pop play home hit link follow game instructions win year supply pringles click terms conditions ,59.73,52.01,52.87
 settle vote favourite flavour ,6.63,5.3,6.93
 staring contest blink pizza original ,6.65,5.24,5.69
 valentine day ,14.77,11.06,11.69
 technique eating crumbs ,4.27,4.5,5.31
 far 2012 ,0,0,0
 unleashed inner troy shot 10k woot click ,0,0,0
 correct answer question ,6.63,5.41,5.85
 best tasting pringle ,0,0,0
 weekend ,0,0,0
 couch check tv check friends check pringles check missing ,14.52,9.77,12.57
 love pringles ,8.72,6.44,7.11
 weekends moment ,5.76,3.83,4.81
 pringles delicious ,0,0,0
 feel answering poll waste eating pringles instead ,2.93,4.14,4.72
 pringles opens ends ,3.44,4.44,4.41
 pringles cup holder car ,13.17,9.94,12.61
 hey weekend ,0,0,0
 win masterchef tonight ,8.38,7.72,7.39
 pringles clock ,5.14,4.02,4.67
 safest place stash pringles ,0,0,0
 verdict final harry potter movie ,6.86,4.93,5.0
 eat pringles ,7.47,5.69,5.6
 making nachos pringles ,0,0,0
 feeling masterchef far season ,6.23,5.0,5.62
 pringles friends ,7.74,5.74,6.74
 think pirates caribbean ,6.41,5.34,6.38
 pop culture think lady gaga new album ,18.52,15.42,16.99
 pop culture think justin bieber likes eggs ,25.12,20.63,21.85
 alas longest long weekends ,0,0,0
 pop culture movie franchise love eaten pringles whilst watching ,21.48,16.27,17.68
 join dj pringles 40 minute musical adventure world world weekend choose ,14.1,12.3,11.72
 pringles flavour face favourite ,6.39,5.04,5.67
 aston shuffle album released week celebrate created chart favourite tracks pop krrunch reason dance tuesday ,18.94,16.27,16.0
 julius pringles day ,6.66,5.0,5.88
 jimmy sing gives lowdown best jamaican jams pop krrunch reggae artists love bob ,29.21,22.44,24.66
 dj maestro wax motif runs 10 tracks pop krrunch shaping song week ,12.45,10.45,10.77
 pirate party pals aston shuffle taking good times tour couple weeks going dance ,40.78,34.24,33.85
 live set recorded pringles island song brings good times ,27.47,22.28,23.1
 congratulations weeks pringles island winners koko kara brennan preview pringles island party sound like click woot ,44.15,36.84,36.3
 sort buried treasure think pringles island ,22.27,18.23,18.95
 love air jaime doom gives 10 romantic songs pop krrunch greatest love song ,53.43,42.06,43.37
 want guess song aston shuffle play pringles island ,28.04,25.14,23.57
 weeks pringles island competition winners select remember enter times like em coming onboard ,34.01,28.65,28.89
 congratulations latest pringles island winners luke jessica announcing winners shortly entries rolling ,29.76,24.58,27.46
 mighty mouse runs favourite british songs pop krrunch ultimate uk band stones beatles blur oasis radiohead iron maiden ,32.88,26.14,29.63
 special dj pringles mixtape special ultimate love song dedication valentine day ,30.59,23.57,24.65
 best hip hop track 2010 dj kato gives pop krrunch ,7.13,5.33,6.27
 pop culture hey sydney siders best performance big day yesterday tool iggy beetroots ,17.75,14.23,17.12
 zola jesus track sea talk ultimate monday anthem grab free pop krrunch listening afternoon ,15.26,9.98,11.63
 metal pop rock rap dance indie ,17.89,15.02,16.57
 act big day year rammstein iggy stooges tool ,17.26,13.55,16.8
 download memory tapes bicycle tanlines remix pop krrunch catch touring nationally parklife speak ,6.62,5.42,5.11
 flavour bieber getting hot spicy support act ,0,0,0
 hit pop krrunch party van tech melbourne saturday free entry surprises hand pringles lid door dad b4 11pm flavour fine ,54.95,45.08,46.95
 dj generik gives places eat pringles pop krrunch eat pringles couch car work school ,44.9,36.53,39.39
 hammer vanilla ice stars new home renovation ,25.98,19.29,20.37
 achtung baby u2 rumored remastering classic album release year need version ,19.84,14.93,15.29
 day life best beatles song rolling stone magazine thinks ,33.23,27.25,28.76
 covercharge party mum world bar tonight 10pm tell em mr pringles sent bands 12 djs yeehaw ,27.33,22.67,21.9
 kings queens groove armada says kings leon wusses ,20.96,15.78,20.25
 east ended 50 cent dream appearing tv soap shot ,12.7,9.05,11.5
 download matt van schie song journey pop krrunch favourite song listen road ,30.63,25.35,27.82
 party got special ticket offer pop krrunch today rats doing weekend ,16.34,17.43,15.52
 doom gives dancefloor fillers pop krrunch favourite tracks dance ,14.51,12.04,12.31
 download cassian final round mp3 free pop krrunch page songs sample music effects video games ,37.77,28.1,30.06
 congratulations jennifer 000 richer thanks pringles king 100k promotion stay tuned week announcing major prize winner ,29.05,23.19,26.81
 running pringles king cans waiting start weekend chance win 100k enter click link ,21.66,18.61,19.41
 congratulations emily won 1000 thanks pringles 100k promotion click enter weeks draw ,13.55,10.82,11.71
 congratulations jennifer 1000 richer weekly prize winner pringles play win 100k friends click ,32.46,27.25,28.82
 nearly weekend save pringles king cans worth 50k click ,19.86,15.08,18.61
   ,0,0,0
 hey friends celebrate offering chance play win 100k click link play win 100k tab comp entry details ,57.96,49.24,51.12
 pringles fun facts ,13.92,11.51,12.37
 final episode grounded pro snowboarder kaitlyn farrington gets wheel beefed fj40 land cruiser test roading skills miller motorsports park watch ,23.89,18.82,22.78
 shane neill lands monster buzzer beater run win street league skateboarding tampapro ,19.26,15.27,17.73
 rough rutted sizzling hot romain febvre charges challenging mxgp rd2 thailand overall season read ,4.74,5.33,4.81
 jamie anderson chloe kim 2016 burtonusopen storm jamie grabbed fifth open women slopestyle victory read chloe continues dominance women snowboard pipe read ,32.07,27.67,30.12
 fastest qualifier heat race win main win perfect night daytona eli tomac sxonfox et3 ,33.19,32.51,28.86
 supercross fans think end podium tonight daytona international speedway sxonfox daytonasx ,16.21,14.67,16.12
 fight night let hear predictions ufc196 watch conor mcgregor step ufc octagon live ppv 10pm et 7pm pt ,15.6,17.19,15.38
 preseason testing swing ready high powered motorsports action f1 motogp ,26.68,22.85,22.89
 chasing wildest gnarliest waves south africa hawaii matt bromley talks riskybusiness read ,0,0,0
 thing nate diaz saturday night ufc octagon conor mcgregor putting work ufc196 ,14.85,15.22,13.62
 desert palm islands ken block slays luxurious streets dubai gymkhanaeight watch ,23.55,18.45,21.39
 supercross monster energy girls like ,21.62,17.82,18.14
 chloe kim throws mind blowing 98 point run highest scoring run women sbd superpipe history claims games gold read punch men ayumu hirano iouri podladtchikov grabbing xgamesoslo gold silver read ,60.86,47.78,52.28
 heaviest games skateboard street finals nyjah huston shane neill throw monster runs claim gold silver xgamesoslo ,26.59,20.23,22.01
 wait watch ken block unleash 650hp turbocharged fiesta world ultimate exotic playground dubia gymkhanaeight launches february 29th 9pm pst ,12.28,9.42,10.63
 sven thorgren claims 2015 16 air style ring glory ,27.04,20.87,22.32
 look champion introducing brand new mercedes amg petronas w07 hybrid silver arrow wearew07 f1 ,20.46,16.41,17.02
 favorite sundayfunday activity vaughn gittin jr loves create smoke clouds ,25.08,19.97,22.89
 ya ready round supercross action tonight arlington sxonfox ,12.86,11.76,12.18
 cal crutchlow jorge lorenzo valentino rossi vr46 official pol espargar leave phillip island inside 10 close 2016 motogp season austest ,11.42,10.5,10.57
 floodlit boosting moon kevin peraza blows minds thenightharvest ,13.42,9.6,11.17
 drop graham agassiz charging insane lines utah ,2.85,5.83,4.12
 caught europe slab chaser nic von rupp epic myroadseries edit read ,0,0,0
 victor spoils joey savatgy claims win san diego sole ownership red plate sxonfox ,20.09,17.01,18.72
 caught wave sliding artist brendon gibbens low thedillandbeegproject read ,6.59,4.94,5.91
 dreaming hot summer days throwbackthursday plg spinning way summer games vert gold ,14.52,11.65,11.55
 sven thorgren st le sandbech sending air style mega booter ,13.16,9.48,10.74
 nate adams throwing style crowd pits glendale supercross ,11.75,10.66,9.51
 south africa sam reynolds crew building ultimate dirt playground insane lines seen pure darkness ,12.31,13.51,14.2
 pair podiums team green joey savatgy eli tomac leave arizona place finishes sxonfox ,25.24,19.94,22.01
 sage kotsenburg raised bar style innovation high shred right ,30.77,25.71,27.76
 nic von rupp takes cover portuguese pit watch epic entry thewintersession ,11.47,8.82,11.18
 chloe kim makes history athlete win gold medals games age 16 lindsey jacobellis takes home 10th xgames gold medal snowboarder unleashedatx watch day highlights ,63.27,48.87,53.44
 congratulations joey savatgy career win new owner 250 red plate ,20.09,17.01,18.72
 baddest dude snowmobile tucker hibbert claimed ninth consecutive games snowbmobile snocross gold medal paul thacker gus kenworthy added medal count silver unleashedatx watch highlights ,27.15,20.94,22.57
 wheel tuesday courtesy tire slayer ken block ,14.52,15.1,15.34
 inspired jamie anderson boosted competition grabbed win 2016 laaxopen women slopestyle read ,22.17,19.06,20.39
 row twotwo second place finishes chad reed second overall points ,7.8,5.37,6.93
 owen wright office comes view tbt 2014 pipeline masters ,5.24,4.08,5.59
 make double chad reed joey savatgy battled night intense supercross racing claim 2nd box main events ,12.27,11.04,10.26
 best view san diego ready explosive night supercross racing ,12.29,11.17,11.29
 check nate adams tribute video 2006 award winning documentary fullcircle watch ,21.52,16.99,18.4
 throwbackthursday unleashed world class drifters vaughn gittin jr daigo saito abandon russian village japan epic battledrift want stay tuned scenes video soon ,34.93,29.93,30.45
 real fireworks started gates dropped think night supercross season opener ,25.54,22.47,21.36
 day till ignite flames new supercross season pick win saturday season opener anaheim ,21.2,18.99,19.14
 allow introduce chad reed line aboard monster energy 360fly chaparral motorsports yamaha factory racing 2016 supercross season read ,11.82,10.83,11.86
 chad reed ready light 2016 supercross season ,6.23,5.23,6.55
 charging monday 2016 like ,7.52,6.63,5.41
 2016 monster energy supercross season week away ready info ,18.81,16.51,18.4
 celebrate new year monster energy style doonies2 live watch ,25.24,20.58,23.19
 doonies2 drops new year day 2016 ,12.07,9.22,11.13
 rehabrewind 2015 big year monsterenergy nascar road racing athletes vote favorite moment 2015 ,30.57,24.75,28.99
 ballistic bj baldwin entire doonies2 crew land living room january 2016 ,11.18,7.93,11.05
 lot epic moments 2015 rehabrewind highlights best different categories lets vote favorite vote best wheel bmx ,24.57,19.29,24.22
 doonies2 takes flight january 2016 watch sneak peek ,12.47,10.35,10.18
 send josh hill goes huge doonies2 tune pbr danger dirt sunday dec 27th cbs exclusive sneak peek doonies2 ,24.76,25.29,24.84
 transform lamborghini murci lago beast drift machine ,9.32,9.39,10.12
 seen desert like doonies2 launches soon ,12.48,11.45,10.41
 like group friends wreaking havoc sand dunes doonies2 coming soon ,26.63,21.33,23.08
 eli tomac putting fast laps yesterday southern california getting ready 2016 supercross season opener january 9th ,6.23,5.23,6.55
 look forward 2015 let look favorite moments 2014 monster energy rehabrewind ,12.99,10.73,11.74
 judge biggest wave ridden look benjamin sanchis catching beast nazare weekend monstersdoexist ,8.76,10.67,8.56
 jamie anderson missing chance shred winterishere ,10.48,10.38,9.53
 join sage kotsenburg transworld snowboarding latest series holycrail check ep ,0,0,0
 looks like chad reed ready supercross excited season start ,13.75,11.86,11.96
 like celebrating holidays lil stunt bike session jason britton ,7.52,6.63,5.41
 trophy pose ,7.78,5.39,6.44
 sitting waiting friday tune mtv watch rob dyrdek fantasy factory 9et ,27.51,24.28,25.27
 ken block want heads link new official fan page click fan topped number friends current page allow needed fan page everyon join current content ,44.25,36.45,38.54
 rick thornes bring noize skatepark tour dates ,0,0,0
 earlier check rider paul thacker jumping sled 301 feet thats football field new world record check ,24.94,19.61,22.91
 grabbin lo carb monster ,0,0,0
 password skittles safe ,7.07,3.86,5.81
 best gear spy mission ,0,0,0
 press like button skittles gets ,17.54,15.06,15.67
 coming skittles ,0,0,0
 best way stop mummy ,3.96,4.26,4.89
 best place eat skittles ,7.47,5.69,5.6
 computer dispense skittles click like ,13.76,11.38,10.7
 share skittles ,0,0,0
 favorite summer road trip music ,20.62,16.52,16.72
 best way eat skittles ,7.47,5.69,5.6
 magic spell want learn ,12.4,11.39,10.88
 best superpower ,0,0,0
 best job world ,12.33,10.52,10.96
 rip rainbow flip hairstyle ,8.14,4.64,4.72
 tastes best ,6.66,5.22,5.5
 tastes best ,6.66,5.22,5.5
 today help rainbro ,0,0,0
 ninjas vs pirates let settle ,0,0,0
 half machine bowling lover ,5.09,3.82,5.23
 love somebody let come skittles ,8.72,6.44,7.11
 love choreographing dance routines ringtones guarantees goes voicemail ,16.1,13.15,13.15
 karen solomon wrote soooooooooo addicted skittles yep breakfast lunch dinner karen know breakfast burrito skittles ,23.81,21.44,22.56
 jetpacking islands lunch ,14.8,11.57,12.31
 nicole stevens wrote loveee american skittles soo better english skittles wrote thanks nicole promise tell queen paintball game ,13.42,10.65,11.19
 paulette thompson wrote way release bag red purple original flavors skittles wrote paulette maybe instead introduce likes green yellow orange skittles bff soul mates ,45.78,36.29,37.98
 romina castro wrote cost lot money argentina im fan kisses skittles wrote blush rainbow ,22.09,15.23,16.3
 adrian ho wrote skittattle skittalz skittles green blue skittle guy skittles wrote adrian spell ,12.94,8.59,10.45
 mandra fandel wrote kids reward going potty reliable skittles wrote thanks mandra glad know regular life ,42.83,33.06,36.25
 bed 15 zones going strong ,14.62,9.53,13.8
 darla brown wrote skittles new white meat skittles wrote especially white meat skittles ,26.26,19.56,24.02
 completely forgot friday ,0,0,0
 currency good theory eat checking account ,20.24,15.74,16.89
 froze rainbow today ,8.14,4.64,4.72
 performing deliciousness enhancement procedure taste buds ,11.21,9.9,10.21
 ryan lynch wrote think skittles taste good cousin katy sorry hear taste buds disagree skittles excited page doubles lynch family reunion group ,51.27,42.33,44.38
 melanie street harper wrote skittles rock autistic son loves skittles word learned spell thanks melanie humbled honored lives ,25.89,20.06,22.71
 breathing room counts new layout ,5.52,3.77,5.52
 thanks scott check skittles com chatter htm tweet away ,0,0,0
 liz know referring mind need work family beet farm ,35.08,28.61,34.0
 thanks jacob forget post mix discussion forum love hear ,11.69,11.44,10.66
 brant happen regional manager mid level paper company ne pennsylvania ,5.2,2.5,4.47
 thanks stay tuned ,0,0,0
 skittles love inside mouth brant ,14.18,11.23,13.04
 thanks teenum sounds like world popular extreme sport ,20.41,19.06,16.38
 thanks thoughts new site know lingering questions twitter site real causing smell stay tuned answers questions promise ,25.15,21.21,24.21
 thanks wilyssa like binky blanket bit tastier ,14.46,10.04,11.16
 solveig green purple like word ,13.7,10.91,10.23
 taking look facebook stuff ,0,0,0
 lucie est notre secret sol pour la mauvaise francais ,0,0,0
 wait second laila think line ,6.41,5.34,6.38
 vanessa suppose way bring new meaning taste rainbow ,14.8,9.86,10.22
 pamela ,0,0,0
 know couple days late wanted wish happy newyear traveling dec 31 landed today ,29.64,23.81,24.83
 lauren sourman agree performing strict course ,7.0,4.59,6.28
 luciano beach try tropical skittles tell like doubling paradise ,24.27,17.28,16.88
 hi nate thanks stopping happy passed sour man strict approval process sour skittles ,22.8,21.93,21.44
 carly thanks life pretty sweet ,22.66,18.01,16.58
 aurora sure delicious bath help think leave feeling sticky ,30.33,23.86,28.8
 carson kate offense taken thanks letting know ,6.93,5.77,6.9
 hey mikes ideal world skittles used form currency killer exchange rate settle favorite candy ,14.93,17.76,15.13
 sian maybe green ones got confused hemisphere changed ,9.39,10.31,9.06
 mahtz introduce matt sounds like worked skittles financing operation ,7.52,6.63,5.41
 sameer agree say slightly biased ,7.0,4.59,6.28
 emma rose sorry hear blue skittles appreciate haiku ish post ,10.38,9.42,9.45
 christine glad hear like better sugar coated crab apples previous favorite ,33.72,26.86,28.75
 ashley pru glad guys expressing friendship little facebook rainbow world tim looking bff want make dynamic duo trio ,27.66,21.66,21.05
 ashley best friend referring ,7.74,5.74,6.74
 cleo stores sorry hear friend maybe 4th times charm ,29.37,25.65,26.76
 heber eating ,0,0,0
 jennie roygbiv says technically true like believe rainbow make ,22.62,16.38,16.13
 alexander brandon think like really tasty jaw exercise ,21.06,18.81,17.47
 derek despite internet thing assure orange skittles conspiracy red hand ,30.7,23.35,27.43
 mix hot ryan em coming ,0,0,0
 nice beats heather brecken future professional skittles mixing awaits ,17.9,15.4,14.22
 wow thanks carol world truly honor say belong ,20.62,16.86,17.71
 noor trying say chocolate favorite ,6.88,5.29,5.18
 nice julie cooper sounds like wedding vow ,27.97,22.33,23.59
 hey pamela able save widget facebook page separate page music sounds mix click word save click mix facebook mix button hope helps happy mixing skittles team ,55.67,41.2,48.95
 woo hoo 100 000 fans months thanks stopping got good stuff come stay tuned ,18.98,14.35,16.59
 noor saying like sour skittles hunch ,11.45,11.73,10.05
 lot love air like spring skittles board ,35.16,26.22,28.86
 laurie george mcfly say density mean destiny ,0,0,0
 sorry hear michael maybe basking tropical sunlight st kitts long word ,11.38,11.21,9.45
 hey quila try meantime mix lemon strawberry let know comes close pink lemonade ,6.93,5.77,6.9
 kevin dictionary com defines skittles ninepins wooden ball disk used knock pins know definition nicer maybe urban dictionary definition instead ,16.68,14.8,17.31
 hey cheri believed love came cutting ,8.72,6.44,7.11
 thanks jessica break company softball game ,11.57,11.12,10.96
 thanks rhea skittles literally rocks check mix rainbow make beats ,13.7,9.16,9.87
 maria tina turner say better rest ,0,0,0
 thank dimitri like hope bring good start ,22.04,17.5,17.34
 anya honored maybe skittles playmate named sour skittles ,3.93,5.1,4.64
 bongi love hear beats post mix discussion board ,13.54,9.8,12.09
 ashley lemonade maybe handful sour lemon skittles trick instead ,8.9,11.2,9.24
 chris enact second rule won tell want extend hours ,10.35,10.21,8.79
 hey check mix rainbow click drag skittles make track amazing beatboxing kenny muhammad human orchestra wanna hear creative unique fresh tracks forget post mix page send friends fun ,33.24,26.12,26.98
 marc hopefully able use skittles hunger sort rescue device like signal giant falcon overhead pull safety ,37.21,32.74,33.39
 brogan hitting pinatas looking ,0,0,0
 sure dialect writing thanks comments kittles lubbs nu ,6.53,5.0,6.03
 muchas gracias andres ,0,0,0
 thanks beau better bon bons peg bundy disagree won ,0,0,0
 roads closed school cancelled getouthere gear nike com getouthere ,9.89,9.34,10.33
 know short guy gear ready gonike gear ,17.8,14.75,17.41
 dream justdoit ,6.73,4.53,5.53
 playing safe playing riskeverything ,7.07,3.86,5.81
 kobe bryant ashton eaton richard sherman allyson felix mo farah push nike flyknit learn lighter stronger nike flyknit lunar2 kobe elite rest flyknit family nike com flyknit ,14.8,10.19,12.34
 run lap run mile run mile run race run run faster run farther justdoit ,16.55,14.81,15.79
 doing today beat yesterday justdoit ,0,0,0
 justdoit ,0,0,0
 fit stand revolutionary freeflyknit features second skin fit holds fly gonike 6017zsg5 ,12.84,11.5,10.39
 introducing nike freeflyknit designed super natural performance revolutionary second skin fit ,12.14,8.95,10.78
 innovation antidote limits introducing nike freeflyknit designed super natural performance revolutionary second skin fit ,12.14,8.95,10.78
 begins ,0,0,0
 new breed attack arrived ,2.7,7.03,3.3
 elevate af1 lf1 icon reborn hyperfuse lunarlon force future ,6.71,6.48,4.89
 explore 30 years air force 1thology check 000 af1s year style color material build share collection ,36.26,26.7,32.53
   ,0,0,0
   ,0,0,0
   ,0,0,0
   ,0,0,0
   ,0,0,0
   ,0,0,0
   ,0,0,0
 remember trolls kings world woo hoo target stores ,19.69,15.83,18.64
 spirit shark week say hello dreaded north american melon shark dig ,19.65,24.26,16.0
 cabin fever hack food jenga high build tasty tower forget garnish ,25.46,24.72,24.41
 exclusive burt bees lip shades perfect fall balm gloss shine kind girl ,34.82,29.92,31.09
 biggest dimples goes erin little kiddo join live celebration instagram firstdayofschool pics target kid ,6.42,5.35,6.03
 sleek sporty wins race samsung gear fit fitness tracker tracks activities 24 healthy dose cool ,21.28,17.32,18.53
 better believe seconds summer debut album finally hands copy today extra songs onlyattarget ,25.19,20.86,21.98
 buy event happening people buy select school supply donate kids need foundation like awesome folders example ,50.91,41.59,45.14
 seconds summer debut album music ears plus got extra tracks multiple album covers wait till releases 22 pre order ,20.55,15.68,16.47
 share coke share smile free coke friend share facebook friend target cheers ,40.0,28.68,32.43
 case know real big fans lego swing grab lego movie blu ray today ,27.35,21.12,22.56
 latest update data breach investigation need know pins ,11.43,10.94,11.67
 ingredient flourless chocolate peppermint blossoms look dazzlin holiday cookie tray plus save supplies cartwheel click start saving click recipe ,52.81,40.94,45.72
 targettruth halloween edition words hear uttered year candy ,11.95,8.8,10.58
 guys halloween humans ,0,0,0
 won pay dollar dollar power event oct save 000s items targetrun ,31.93,26.03,30.39
 bullseye university going check 10am 8pm covel commons games food prizes chance shop latest college items dorm ,25.91,20.43,21.78
 iphone 5s coming target 20 ,0,0,0
 ready patriots proud announce bullseye university happenin september swing north plaza campus music games prizes ,54.94,41.38,46.85
 save 20 archer farms salsa store expires 13 ,21.04,18.45,21.46
 record ready say bye bye bye place morejt vmas ,6.23,5.23,6.55
 voted givewithtarget week vote help help favorite school ,16.34,14.12,16.85
 bullseye university going check 10am 8pm rudder plaza games food prizes chance shop latest college items dorm ,31.5,24.32,26.99
 givewithtarget running vote giving away million schools remember votes favorite school ,21.98,19.48,23.86
 wish reading fancy new smartphone upgrade target run ,7.09,5.16,5.28
 classic road trip games play summerup travels spy state license plates 20 questions car bingo ,47.7,40.47,41.84
 targettruth heading freezer section little cool ,11.79,8.47,10.82
 kid deserves moment single ,12.18,9.18,10.84
 new baby new album big year michael bubl exclusive tracks new album truly ,26.05,20.11,20.33
 target truth 64 starts toothpaste thing leads cute pair shoes pillow ,34.36,22.19,26.55
 thumbs wearing red today raise awareness heart disease women know ,41.59,38.21,38.23
 today remember great martin luther king jr bravery work legacy ,11.22,10.62,11.49
 bring holiday cheer save 50 storewide minute sale ,29.17,23.66,24.63
 ticking away chance enter win dream big win bigger sweepstakes enter 12 24 2pm cst ,29.51,25.35,24.95
 red went galaxy far far away bring 20 lego star wars sets week ,27.32,28.95,24.17
 better getting 16gb ipod touch getting free 50 target giftcard store ,20.5,16.34,18.16
 favorite gift giver little 50 giftcard purchase ipad excludes ipad mini ,7.77,6.14,5.52
