 today crew members country head local neighbourhoods clean australia day keeping country clean ongoing mission continue support day help australia beautiful ,59.7,47.02,55.1
 clipsal500 weekend make sure check createyourtaste food truck traction zone cytatclipsal free instagram print ,27.91,20.91,23.89
 cat got tongue code cracking hats letter answer clues spells sauce enter answers order macc secret chance win special prize good luck ,65.9,54.7,57.42
 clue pattern answers remember need clues crack mystery enter answers macc secret chance win bottle big mac special sauce 10 000 cash prize clue monday got guess ,58.89,52.64,50.56
 giveaway clue crack enter words macc secret chance win bottle big mac special sauce 1000 cash prize ,34.49,30.78,28.8
 second clue cruisy need crack code enter answer macc secret chance win big mac special sauce 1000 cash prize ,34.97,31.4,29.87
 winning easy clue enter answer macc secret chance win bottle big mac special sauce 1000 cash prize ,48.22,40.67,41.65
 word clue need clues solve enter answer macc secret chance win special surprise ,39.9,36.62,31.81
 charm enter word answer macc secret chance win bottle big mac special sauce 1000 ,33.95,28.46,28.23
 second clue second chance win bottle big mac special sauce 1000 cash prize enter answer macc secret crack clues ,46.69,41.71,39.68
 guys quick toughie giving away bottle big mac special sauce 1000 day week solve clues enter answer macc secret chance win ,51.4,44.77,45.06
 luck clue word enter answer macc secret chance win special giveaway ,34.01,30.48,27.88
 clue word enter answer macc secret chance win special ,26.6,24.03,22.91
 fry brain clue help answer macc secret chance win special saucy surprise ,41.03,36.63,32.71
 feeling lucky giving away bottle big mac special sauce 1000 day week think fast crack clue enter answer macc secret chance win ,65.57,55.07,56.54
 new day new clue new chance win giving away bottle big mac special sauce 1000 day week crack clue enter answer macc secret chance win ,71.39,61.82,61.43
 hint clue help crack code enter answer macc secret chance win saucy treat ,33.96,29.65,28.69
 giving away bottle big mac special sauce 000 day week gone gone code cracking hats solve clue enter answer macc secret chance win ,50.22,42.3,43.88
 macca legends match catch aussie legend mark philippoussis goran ivanisevic 6pm aedt 7tennis ,12.78,9.76,11.08
 support families seriously ill children mchappyday donate ,14.54,9.28,12.7
 buy helping hand restaurant mchappy day october 17th bit help support families seriously ill children mchappyday ,27.02,19.61,22.96
 ronald mcdonald houses great work helping families seriously ill children help change ,24.11,19.72,20.98
 easy way bring light life ,14.37,10.5,12.72
 small donation ronald mcdonald house charities make genuine difference family life ,22.18,15.38,17.8
 ronald mcdonald house charities helped smile felix face years make difference donating online rmhc org au donate ,34.11,24.23,30.3
 watch help seriously ill children forget illness fun playing kids going similar treatments make difference donating online rmhc org au donate ,45.06,41.65,41.21
 summer comin sign local cricket club register today cricketnsw com au cricket nsw ,0,0,0
 love going movies amazing chance win instantly win tickets latest blockbuster monopoly game macca ends 20 10 15 total 127 796 884 tickets average yield instant win prize enter terms visit nsw ltps 15 03114 act tp 15 05656 vic 15 896 sa t15 666 monopoly 2015 hasbro rights reserved ,97.95,85.17,86.69
 chance win big monopoly game half million instant win big mac burgers chance win ends 20 10 15 total 127 796 884 tickets average yield instant win prize enter terms visit nsw ltps 15 03114 act tp 15 05656 vic 15 896 sa t15 666 monopoly 2015 hasbro rights reserved ,91.31,81.11,81.47
 eliminating hunger vital peaceful prosperous world join international day peace stop hunger peace donate ,52.74,38.55,47.19
 today international day peace join stopping hunger starting peace watch learn share peaceday ,37.79,25.75,32.42
 want win big chance win monopoly game macca including volkswagen jettas hurry today ends 20 10 15 total 127 796 884 tickets average yield instant win prize enter terms visit nsw ltps 15 03114 act tp 15 05656 vic 15 896 sa t15 666 monopoly 2015 hasbro rights reserved ,82.16,74.01,73.98
 macca tomorrow support beacon egg breakfast bacon egg mcmuffin sold breakfast tassie mcdonald restaurants donated beacon foundation beaconfoundation com au beaconbrekkie ,24.04,18.56,20.52
 gourmet skills good win 100 ticketek vouchers test building online ,28.04,22.77,25.38
 goes angus patty egg tortilla chips build burger online way movie 650 tickets won ,17.61,14.48,14.63
 right kind cheese win 100 25 westfield vouchers build perfect burger online late ,28.75,22.17,24.69
 australian open game plan sneaky genius whatalegend ,20.84,16.77,18.64
 factor australia stoked bringing backstage antics luke wyatt new web series fanfactor check ,5.33,4.3,5.2
 loving factor australia tonight grab backstage pass new web series fan factor hosted luke wyatt wednesday ,19.97,15.4,16.82
 save save save save save gol performance deserving cape fryfutbol ,25.68,19.88,24.07
 ooh la la penalty watch 2006 fifa worldcup goal fryfutbol ,15.73,15.64,15.84
 steps scores brazil favourites worldcup ,0,0,0
 miss opportunity win way rio fifa worldcup final enter ,15.79,14.19,13.98
 looking impress mates littlebitfancy words add vocabulary ,6.87,6.3,5.48
 looking littlebitfancy fancy ways started ,0,0,0
 asked question lot curious click ,6.08,5.82,5.42
 enjoyment bonus winner guess surprised news ,36.81,31.53,31.72
 inside macca 30am enjoymentbonus ,0,0,0
 fave macca breakfast menu item tell best entries free amore breakfast meal ,33.17,23.67,29.83
 decide win macca enjoyment bonus help cast votes enjoymentbonus ,35.27,29.55,32.69
 enjoyment bonus nominee georgia loves round golf win dream golf experience voting enjoymentbonus ,49.29,38.52,42.98
 like guys question food ready waiting ask ,21.4,17.78,18.14
 aussie olympic hero cameron mcevoy mcdonald cavill iii 30pm 30pm today support mchappy day ,14.25,11.41,11.78
 look real fun heart meet 36ers basketball team mcdonald frewville cross roads collinswood west beach 11 30am 2pm today support mchappy day ,49.55,40.86,40.03
 lovely sarah bono music voice australia mcdonald parramatta north 12pm 2pm today support mchappy day final chance create virtual helping hand amex donating rmhc behalf clicking ,33.55,25.85,28.15
 grand final week factor australia jai taylor dami message support receive personal reply like ones cheering ,12.87,11.01,10.33
 saturday omar jtr factor australia performing eltham macca melbourne cnr bolton bridge st 7am boys shot 5mins fame weekend sunrise want factor concert local macca enter quick day left enter ,47.26,41.53,39.52
 huge congratulations nicole thornton aussie crew member voice mcdonald competition global finals taking place orlando year nicole ,16.63,15.0,16.23
 tuned factor australia heroes night week check scenes action ,23.63,21.78,20.43
 enter win factor concert local macca ,16.04,15.04,13.1
 think better big mac chant weekly winner took home 500 voucher running epic overseas trip friends let ,37.26,28.45,31.74
 huge congratulations cameron meyer successful tour france campaign proud partner team home satalyst giant racing willing finish line inspiration ,43.16,32.12,37.15
 sign member themaccasplayground com au chance opinion win prizes ,26.51,23.02,22.86
 tastiest ,0,0,0
 best happy meal toys ,15.8,12.28,13.04
 come join macca playground sign chance feedback tell think join simply click themaccasplayground com au cash prizes given week members ,31.98,27.5,28.2
 come join macca playground sign chance feedback tell think join simply click themaccasplayground com au cash prizes given week members ,31.98,27.5,28.2
 meet carl wazza thompson wazza chicken changed stories meet chickens ,20.37,15.57,17.13
 mcdonald character favourite ,5.87,5.17,5.77
 new yorker texan californian comes tastes america range ,6.66,5.22,5.5
 footy season macca renewed commitment junior footy south australia extending sponsorship sanfl development programs info check ,0,0,0
 meet stuart qld beef farmer supplies macca passionate environment doing pretty cool stuff check ,24.78,18.13,22.24
 mcdonald proud support newcastle knights week left season kicks support red blue information visit ,30.86,24.44,28.57
 2013 victorian ride sick kids team gearing cycle 700km aid rmhc programs victoria check details support seriously ill children families donating rideforsickkids com au ,42.79,35.15,36.8
 mr monopoly aka guy cane moustache hat choose ,15.86,13.54,15.36
 1d world road trip stopping mcdonald wagga wagga 27 january 2013 ,18.99,16.52,15.59
 best new aussie day item ,11.92,8.24,11.14
 remember tell aussie passion chance win year worth concert experiences right year ,53.51,45.53,45.98
 1d world road trip stopping mcdonald belconnen 24 january mcdonald erindale 25 january mcdonald dickson 26 january 2013 ,18.99,16.52,15.59
 sa rfsk team looking cyclists support crew join 2013 sa ride sick kids come information night wednesday 23rd january ,28.72,26.78,24.78
 1d world road trip stopping mcdonald fairy meadow 22 january mcdonald warrawong 23 january 2013 ,25.23,20.77,21.02
 1d world road trip stopping mcdonald west gosford 20 january mcdonald wyong 21 january 2013 ,18.99,16.52,15.59
 lovin australian open tell submit fave player nickname ,4.37,5.22,3.96
 1d world road trip stopping mcdonald bathurst 15 january 2013 ,18.99,16.52,15.59
 1d world road trip stopping mcdonald dubbo west 14 january 2013 ,18.99,16.52,15.59
 1d world road trip stopping mcdonald tamworth south 13 january 2013 ,18.99,16.52,15.59
 score game macca run managed complete 100 fries box play leader board compatible mobile devices ,42.51,33.17,38.86
 1d world road trip stopping mcdonald booval january 2013 ,18.99,16.52,15.59
 1d world road trip stopping mcdonald toowoomba 31 december 2012 ,18.99,16.52,15.59
 1d world road trip stopping sunshine coast mcdonald minyama 28 december 2012 mcdonald currimundi 29 december 2012 mcdonald coolum 30 december 2012 ,24.97,21.11,21.26
 1d world road trip stopping mcdonald hervey bay 23 december 2012 ,18.99,16.52,15.59
 1d world road trip stopping mcdonald bundaberg west 22 december 2012 ,18.99,16.52,15.59
 1d world road trip stopping mcdonald rockhampton 21 december 2012 ,18.99,16.52,15.59
 1d world road trip stopping mcdonald mackay north 19 december mcdonald mackay northern beaches 20 december 2012 ,18.99,16.52,15.59
 1d world road trip stopping mcdonald cannonvale 18 december 2012 ,18.99,16.52,15.59
 challenge mates new facebook game macca run beat current leader 560 000 points ,27.91,24.89,25.13
 fave newbie ,0,0,0
 tasty treats make thursday evening complete ,15.53,11.37,13.14
 gets vote ,6.63,5.3,6.93
 curtain tomorrow chance help johnny ruffo write new song win factor australia vip experience enter ,21.5,19.17,17.88
 fave mcflurry flavour ,0,0,0
 gets vote ingredient lamb burger ,12.52,8.66,11.84
 cool new treats gets vote ,20.82,15.09,18.68
 day create social playlist win 12 month spotify premium account friends check ,41.6,33.22,36.66
  it s time to get serious  ,10.39,8.64,9.75
 fave aussie gold medal moment far ,13.3,9.59,10.66
 songs got ultimate playlist start add friends win spotify premium account ,23.22,19.53,19.98
 flavour games item gold medal ,19.78,14.89,16.81
 enjoying spotify select fave track mates win 12 month spotify premium account started ,20.4,18.05,17.72
 fancy winning 12 month spotify premium account mates start social playlist ,18.9,15.31,16.24
 want hear mums olympic heroes ,5.25,6.0,4.54
 think win 100m sprint ,14.79,13.06,13.77
 congratulations champions play winners heading london 2012 olympic games ,31.76,25.53,26.89
 know 14 year old star making tell enter comp chance attend london 2012 olympics mcdonald champion play reporter ,51.78,42.22,43.58
 stacks favourite layer sydney stack ,0,0,0
 macca parents day left 14 year old enter champions play competition lifetime trip london 2012 olympic games grabs ,45.86,37.69,38.59
 dmacncr164 big mac farm challenge leader board 6691 points thinks got takes steal limelight ,34.0,30.41,35.83
 got left pocket loose change menu ,11.61,10.02,10.79
 fave loose change menu item ,16.87,13.26,16.05
 blt team ,7.43,5.93,5.9
 favourite place eat macca ,7.47,5.69,5.6
 dessert island want ,12.84,12.14,10.75
 miss ,0,0,0
 hear lovin new smoothies frapp fave flavour ,0,0,0
 check scenes footage macca team audition video knockout countdown episode ,20.32,16.53,16.81
 fave new mcflurry flavour ,0,0,0
 shakes make shaker fries perfect ,6.81,4.97,5.97
 clicked cowboy spy video spy skills notch completed levels ,20.68,17.12,17.81
 macca tastes best ,6.66,5.22,5.5
 spy prize like win ,15.9,14.35,12.8
 looks like factor bringing old favourites ,10.83,10.13,8.7
 brief return shores 2008 ,0,0,0
 lovin today ,0,0,0
 like share mates meal ,21.98,18.72,17.3
 fave macca value lunch meal ,14.8,11.22,12.51
 favourite dipping sauce mcnuggets ,0,0,0
 mates meal etiquette tell rules sharing rock paper scissors ,34.5,27.96,30.01
 mcwings bite reactions pic video 3pm friday win 5k ,15.68,13.39,13.16
 chance win 5000 cash beat winning mcwings reactions past weeks ,28.12,24.85,23.91
 big congrats goes jenny vic winner mcwings bite reactions promo check entry chinny tries mcwings pg4 gallery chin eyes week left entries fast chance win final 5k ,56.55,45.68,51.35
 bring fave macca ,0,0,0
 chicken tastes best ,13.53,10.32,11.33
 5000 goes ruth sa hot cold check video gallery pg1 red hoodie video congrats ruth 5000 richer mcwings bite reactions chance win ,45.46,38.99,38.77
 planning big weekend mates meal diving lunch ,21.67,17.52,17.99
 chicken snack fave ,6.87,5.1,5.83
 chicken mcwings ,6.87,5.1,5.83
 chicken mcbites ,6.87,5.1,5.83
 grimace keeps avoiding question ,0,0,0
 favourite sauce ,0,0,0
 yes mcbites question prefer mcnugget ,6.0,4.5,5.47
 lots suggestions bringing favourites thanks feedback guys question favourite favourites ,5.66,4.72,4.88
 forget let mum know best sunday make day little bit fancy ,16.56,15.77,16.33
 let old skool fave character ,9.18,8.67,9.06
 previous poll playing trying hang tight ,4.33,5.4,4.33
 lovin tuesday night cinema hot right movies missing ,27.23,21.84,22.26
 fancy old skool ,3.31,3.5,3.29
 added lot fancy menu favourite selections range ,6.37,4.77,6.0
 wait kate wills tie knot tuning ,4.64,4.07,4.67
 pop easter road trip good times best road trip ,37.76,32.47,31.7
 glad liked idea bacon swiss cheese smoky bbq angus good news going restaurants soon let know think ,60.67,49.51,53.59
 heard want new flavours angus add ,5.25,6.0,4.54
 hi value feedback customers remember difficult answers need facebook lovin contact follow directly forget language page clean delete post cheers ,27.86,27.29,26.49
 chocolate oreo cookie pieces strawberry cadbury dream white chocolate tough decision gotta make ,34.56,24.91,28.04
 yes shakes got fancier new selection shakes form orderly queue ,0,0,0
 hi abide rules engagement detailed info tab defamatory derogatory comments automatically deleted thank ,4.23,4.38,3.34
 hmmm friday night qp friday night big mac ,12.12,11.88,9.48
 best bagel boston nyc ,0,0,0
 asked little bit fancy got lot winners friday shannon nsw daily winner matthew sa took major prize efforts building kids water slide ,41.71,33.23,36.87
 remember change clocks sunday fret open 25 hours ,15.48,13.48,13.71
 yesterday winner nova comp jessica sa entry taught dogs count knows individual number count order congratulations jessica remember guys day nova comp today entries 3pm chance win 1000 grand prize 10 000 ,60.73,50.27,55.64
 big congrats goes cazz vic nova comp winner yesterday entry aunty owns 83 wedding dresses married bride mind wears visitors 1k coming way ,35.77,28.1,32.32
 1k goes annabelle nsw yesterday winner nova comp fancy entry mum types dinner menu plans meal night month night eat entr main dinner hope mum makes fancy meal celebrate win ,96.44,78.32,83.94
 yesterday winner nova comp ryan doreen friends nova blown away brand new ride esky whopping 1000watts power goes 30kmh fancy congrats ryan ,22.52,19.27,21.74
 comp think lah dee dah win 10k apps facebook com littlebitfancy ,14.79,13.06,13.77
 round applause friday nova comp winner becky vic entry swarovski covered toenails schmancy little bit fancy congrats becky fancy 1000 spending spree ,21.43,17.38,20.01
 lights golden arches 30pm sat support hour joining earthhour org au ,5.1,4.21,4.25
 michael vic yesterday comp winner entry giant radio control plane 8ft wingspan 22inch black carbon fibre propeller 55cc engine little bit fancy ,49.57,41.45,45.85
 winner yesterday nova comp laura ridgewell congratulations laura remember guys lovin hearing fancy things sure enter competition app chance win 1k ,34.0,29.13,30.55
 forget enter comp fancy chance win ,17.37,18.1,15.58
 congratulations matthew baxter nova comp winner yesterday built 20metre long waterslide kids summer decided build trebuche winter treat fancy matthew ,34.72,28.42,29.39
 drum roll winner day nova comp karina harley entry collect really big inflatable rubber animals duck sunny congratulations karina ,27.07,22.13,25.41
 witnessed fancy action tell win 1k day ,21.67,19.25,18.9
 lovin new angus great burger mushrooms swiss cheese think little bit fancy fancy toppings add ,18.52,15.26,16.87
 forget schmancy facebook ,2.97,5.0,3.55
 ronald mcdonald house australia facebook head ronald mcdonald house charities australia like great work doing ,32.63,26.56,27.71
 congratulations took clean australia day sunday founding partner really proud participate ,21.92,15.36,19.52
 schmancy schmancy app facebook profile bit schmancy ,0,0,0
 schmancied facebook page head app profile schmancying ,6.63,5.7,6.03
 favourite restaurant favourite social network welcome official mcdonald australia facebook page designed share maccas stories thoughts questions know upcoming promotions products special deals hope enjoy page suggestions like let know ,77.12,61.69,65.93
 oh boy happy birthday magical mickey mouse ,29.83,23.7,23.59
 hope lose sight thing started mouse walter elias disney ,21.27,19.27,19.09
 hope lose sight thing started mouse walter elias disney ,21.27,19.27,19.09
 hairy baby ,8.22,5.53,5.0
 know ingredients went making hearty film courtesy visit new orleans ,13.86,11.09,12.04
 craft celebrate world bff r2 d2 diy hp ,13.04,10.02,10.59
 dinner party flight fanciful fluttery diy brought hp ,21.71,18.37,16.74
 pup day ,6.66,5.0,5.88
 warm hugs season happy day spring ,37.13,27.65,29.92
 timeless tale medium ,6.43,4.13,5.5
 tales derring bad good ducktales coming disney xd woo oo ,16.46,15.08,15.75
 friend groups big blue tank gang ,22.25,21.45,20.48
 today disney history ,5.24,3.93,4.83
 favorite tale old return theatres reimagined live action guess starring belle ,16.37,14.16,14.42
 oh boy going magical year ,19.19,14.75,16.32
 calls warm hugs ,14.5,10.49,11.15
 imagine cooler treats olaf inspired goodie bag crafting courtesy hp ,21.83,17.62,19.52
 today disney history ,5.24,3.93,4.83
 baby eyes blue straight heaven right ,34.59,24.76,28.23
 today disney history ,5.24,3.93,4.83
 kindness goodness goodness magic new live action cinderella theatres march 13 2015 ,21.86,15.7,17.59
 today disney history ,5.24,3.93,4.83
 power smile ,14.7,12.6,13.88
 today disney history ,5.24,3.93,4.83
 smile little help friends ,15.9,11.67,13.34
 friends support fumbles ,7.74,5.74,6.74
 christmas careful wish woods premieres december 25 ,20.75,16.1,16.24
 met love ,8.72,6.44,7.11
 crazy tents make camper wildest dreams come true ,26.76,22.4,22.04
   ,0,0,0
 diese teiler zb sie sind nicht vom film waterworld sie stehen england und sind berbleibsel vom weltkrieg ,6.93,5.32,5.14
 inspired red bull air race female pilot ,39.91,31.76,33.68
 amikor meg rkezel vil tetej ,0,0,0
 amazing women celebrate london internationalwomensday ,6.64,5.32,6.33
 levi lavallee takes streets braaap ,5.22,3.39,4.81
 und sie slacklinen mit den wanderschuhen saying ,5.72,3.5,6.17
 learn boss gym super women internationalwomensday ,20.0,16.85,18.56
 womensday ,0,0,0
 und shaun white zerlegt mal wieder alles es zu zerlegen gibt ,6.47,4.37,5.98
 love secret game lion picked 10 assists death 32 minute game ,29.86,29.01,26.1
 saage tuttavaks red bull music academy artistid kes astuvad les tallinn music weekil ,22.67,15.93,18.56
 hyv naistenp iv te rokkaatte naistenp iv ,0,0,0
 memorable f1 season openers ,0,0,0
 noah kin puhuu suunsa puhtaaksi koko video haastattelu ,7.3,5.67,5.77
 siguld tiku aizvad tas ice sacens bas ar showel race superfin ls ,11.99,10.1,10.21
 sports womensday ,6.45,6.23,5.77
 fasts talks da modalisboa em livestreaming em redbull pt sabe mais aqui ,0,0,0
 run world ,6.5,5.32,5.26
   ,0,0,0
  8  ,0,0,0
 eero ettala ender subilla klo 21 00 katso ,0,0,0
 fastest women international women day ,19.94,15.64,18.54
 pieliedie team secret best dota player best player shanghai major ,7.43,5.93,5.9
 internationalwomensday meet female mc changed hip hop forever inventing dis track ,7.83,5.83,5.57
 21 ,0,0,0
 watch races ,11.85,9.53,10.54
 real trick shots vancouver whitecaps fc excited play ,13.07,13.03,11.57
 nenn uns kitschnudeln aber diese fotos sind sch ner als im traum ,0,0,0
 dolos regreso al tbol colombiano ,0,0,0
 qu se siente al escalar la cordillera alta del mundo descubr lo en este deo ,0,0,0
 cerramos los finalistas neymarjrsfive dos equipos lima mira las fotos aqu ,0,0,0
 suivez partir 21h le live pennywise au red bull sound space sur red bull tv ,19.6,15.72,16.76
 tonight pm european red bull tv join pennywise exclusive concert perform classic punk anthems intimate studio setting ,32.08,29.29,28.43
 ist teurer auch besser ,0,0,0
 das beste actionbild die gewinnerin des internationalen foto contest red bull illume 2013 romina amato gibt hier tipps und sagt wie sie zu ihrem awesome job gekommen ist ,14.72,16.87,14.03
 blizzard shake competitive game ,6.98,5.89,5.7
   ,0,0,0
 street fighter iv pro daigo umehara earned 171 677 30 winnings pros earned ,5.22,3.39,4.81
 pauls jonass sezonas otraj posm taizem fini piektais ,0,0,0
 til rmeste postkasse dag er siste frist sende inn knad til red bull music academy 2016 apply redbullmusicacademy com ,14.54,10.61,12.17
 vamos jari matti ,0,0,0
 let history class football ,17.25,14.4,15.84
 connect nature environmentally conscious adventures southeast asia ,15.25,11.35,11.41
 geht dir auch ,0,0,0
 travis rice pow bluebird ja tack ,0,0,0
 brace ,0,0,0
 jumpandfreeze ,0,0,0
 tampa pro 11 ,0,0,0
 moment hyped league legends teams malaysia dulcet essence ,26.33,19.82,21.86
 jaws win gs 24l7gry ,8.38,7.72,7.39
 man careers loves ,15.45,11.68,12.64
 incredible high altitude images captured ,6.62,5.56,5.38
 rides love ride ,8.72,6.44,7.11
 mit dieser auswahl mountainbike fahrern bringst du die action deine timeline wer fehlt ,9.11,12.91,8.18
 jyv skyl syk hdytt jokaista futsalfania huomenna ,0,0,0
 elindult vitorl szezon vend nk legkem nyebb kapit ny oracle team usa ,7.43,5.93,5.9
 montag feierten wir den schalttag und zwar mit einem highlight um highlight video ,13.02,9.17,11.94
 competing kumite 2016 april ,0,0,0
 emmanuel karalis passed record best youth pole vault givesyouwings ,11.88,10.02,10.43
 make dota better game ,6.98,5.89,5.7
 tunes tonight sorted click play bass sekolah magnetic fields festival ,21.23,15.72,18.55
 dj ,0,0,0
 read dubs drama classic culture clash went bristol redbull com music ,17.89,16.61,17.28
 girls wanna fun really ,15.24,11.51,12.6
 mountainbiker marcelo guti rrez erkundet mit seinem bike eine kolumbianische salzmine ,0,0,0
 applying year red bull music academy need little help getting grips montreal ,19.95,14.83,17.42
 month favourite thing uci world cup ,21.92,17.22,20.51
 learn essentials bike servicing veteran mechanic ,7.15,5.39,6.34
 eyes motogp riders 2016 season ,5.86,4.52,5.07
 live halfpipe finals ,0,0,0
 wenn dtm und rallycross fahrer mattias ekstr free skier bene mayr snowboarder heikki sorsa und downhill mountain biker aaron gwin zusammen die steilste strasse der welt bezwingen ,23.05,22.38,20.11
 sigues dando vueltas contin el burton open 2016 en vivo por red bull tv ,6.41,5.29,5.78
 make beats essential reading ,0,0,0
 ride container uncontainable ,0,0,0
 learn cannes sfv esports scene ,12.74,10.32,11.48
 malaysia boleh ,0,0,0
 started og transition dota ,0,0,0
 sprint win gs 1l7tgl4 ,8.38,7.72,7.39
 691 24 fernanda maciel ,0,0,0
 wipeout ,0,0,0
 andy graham oplever hele verden kun 70kr om dagen hvordan ,0,0,0
 celebrating local heroes ,0,0,0
 going rbma 2016 compilation original music born studio sessions ,14.16,10.43,12.24
 let history class football ,17.25,14.4,15.84
 burtonusopen red bull tv ,6.41,5.29,5.78
 cultureclash exist uk bristol ,6.68,5.39,4.79
 virtual reality features better ,0,0,0
 mate la tradici el red bull music academy se realiza este en montreal puedes ser parte su selecci ingresa al formulario win gs 1qp76fw llena la info si quieres nosotros nos ponemos el env tu material solo pasa por nuestras oficinas recuerda que las inscripciones finalizan el marzo ,35.05,28.68,30.16
 redbull com music caught original line oag producing biggest selling local english album eventually selling 75 000 copies ,14.34,10.5,11.43
 repsol honda mission marc rquez dani pedrosa 2016 rc213v look coming campaign ,0,0,0
 burton open slopestylen finaalit klo 18 15 katso live ,0,0,0
 helgutflykt gon ,0,0,0
 red bull jump freeze ,6.41,5.29,5.78
   ,0,0,0
 mart nosl dzas pieteik red bull music academy kas ogad notiks monre ,14.54,10.61,12.17
 tuled kustu muusika peale ,0,0,0
 think red bull cliff diver simple jumping cliff ,35.11,31.9,32.0
 2016 ,0,0,0
 dota exclusive interview chuan shanghai major ,0,0,0
